"DESCRIPTION","DURATION IN MS","NAME","PARENT SUITE","START TIME","STATUS","STOP TIME","SUB SUITE","SUITE","TEST CLASS","TEST METHOD"
"","1935","Sections use 'See More' / 'View All' links per PB §6.1 (max 10 per section)","mobile-chrome","2026-03-22","passed","2026-03-22","Browse: Homepage Sections (PB §6.1)","browse.spec.ts","",""
"","753","Pricing page (if exists) shows the 4 main tiers: Free, Basic, Standard, Premium","chromium","2026-03-22","failed","2026-03-22","PB: Subscription Tiers in UI (PB §1.3, v4.6)","product-bible.spec.ts","",""
"","2392","Author profile pages use /author/ route (PB §6.10)","chromium","2026-03-22","passed","2026-03-22","PB: Author Profile Rules (PB §6.10, Q15, Q16)","product-bible.spec.ts","",""
"","107","/.env.local does not expose sensitive data","chromium","2026-03-22","passed","2026-03-22","Security: Admin Route Hardening (PB §11.6)","security.spec.ts","",""
"","210","/wp-admin does not expose admin panel (PB §11.6)","chromium","2026-03-22","passed","2026-03-22","API: Admin Route Hardening (PB §11.6)","api.spec.ts","",""
"","249","/settings without auth returns 200 with login content or redirects","chromium","2026-03-22","passed","2026-03-22","API: Auth-Gated Routes Return Redirect (not 200)","api.spec.ts","",""
"","1742","Footer shows payment method logos (PB §5.2)","mobile-chrome","2026-03-22","passed","2026-03-22","PB: Web Navigation Structure (PB §5.2)","product-bible.spec.ts","",""
"","92","/admin/login does not expose sensitive data","chromium","2026-03-22","passed","2026-03-22","Security: Admin Route Hardening (PB §11.6)","security.spec.ts","",""
"","16124","Homepage has a canonical URL","chromium","2026-03-22","failed","2026-03-22","SEO: Canonical URLs","seo.spec.ts","",""
"","2421","Content type shown as icon/label — NOT file format (PB §6.3, §10.5)","chromium","2026-03-22","failed","2026-03-22","Browse: Book Detail Page (PB §6.3)","browse.spec.ts","",""
"","1909","Logged-out users see marketing/landing content on homepage","chromium","2026-03-22","passed","2026-03-22","PB: Information Architecture (PB §5.3)","product-bible.spec.ts","",""
"","1661","No EPUB / PDF / MP3 format names appear in UI (PB §10.5)","chromium","2026-03-22","passed","2026-03-22","PB: Home Screen Sections (PB §6.1)","product-bible.spec.ts","",""
"","1795","Help Centre (/help) returns 200 and loads","chromium","2026-03-22","passed","2026-03-22","Smoke: Public Pages Load","smoke.spec.ts","",""
"","5541","Book cards show content type label (Book/Comic/Audiobook)","chromium","2026-03-22","passed","2026-03-22","Browse: Homepage Sections (PB §6.1)","browse.spec.ts","",""
"","1695","Forgot Password (/forgot-password) returns 200 and loads","chromium","2026-03-22","passed","2026-03-22","Smoke: Public Pages Load","smoke.spec.ts","",""
"","719","Login form inputs have labels","chromium","2026-03-22","passed","2026-03-22","Accessibility: Semantic HTML","accessibility.spec.ts","",""
"","998","Documents category page loads without error","chromium","2026-03-22","failed","2026-03-22","Browse: Discover Sub-Categories","browse.spec.ts","",""
"","738","Page has exactly one h1 tag","chromium","2026-03-22","failed","2026-03-22","Accessibility: Semantic HTML","accessibility.spec.ts","",""
"","123","/register returns 200","chromium","2026-03-22","passed","2026-03-22","API: HTTP Status Codes","api.spec.ts","",""
"","563","No 'Publisher Profile' page — Publisher is internal-only (PB Q16)","chromium","2026-03-22","passed","2026-03-22","PB: Author Profile Rules (PB §6.10, Q15, Q16)","product-bible.spec.ts","",""
"","2666","Homepage does not load excessive JavaScript (< 2MB total)","chromium","2026-03-22","passed","2026-03-22","Performance: Resource Loading","performance.spec.ts","",""
"","2697","Homepage has a nav landmark","chromium","2026-03-22","passed","2026-03-22","Accessibility: Semantic HTML","accessibility.spec.ts","",""
"","5485","Discover (/discover) returns 200 and loads","chromium","2026-03-22","passed","2026-03-22","Smoke: Public Pages Load","smoke.spec.ts","",""
"","1038","Login with wrong credentials shows error, not 500","chromium","2026-03-22","failed","2026-03-22","Auth: Login Page UI","auth.spec.ts","",""
"","620","Forums page requires login — redirects unauthenticated users (PB §6.6, Q14)","chromium","2026-03-22","failed","2026-03-22","Browse: Authenticated User Flows","browse.spec.ts","",""
"","107","Login responds within 5 seconds","chromium","2026-03-22","passed","2026-03-22","API: Response Time Benchmarks","api.spec.ts","",""
"","1012","Forums page requires login — redirects unauthenticated users (PB §6.6, Q14)","mobile-chrome","2026-03-22","failed","2026-03-22","Browse: Authenticated User Flows","browse.spec.ts","",""
"","1660","Log In (/login) returns 200 and loads","chromium","2026-03-22","passed","2026-03-22","Smoke: Public Pages Load","smoke.spec.ts","",""
"","314","Homepage includes content security or transport headers","chromium","2026-03-22","passed","2026-03-22","API: Security Headers","api.spec.ts","",""
"","2079","Logged-out users see marketing/landing content on homepage","mobile-chrome","2026-03-22","passed","2026-03-22","PB: Information Architecture (PB §5.3)","product-bible.spec.ts","",""
"","1734","Footer contains copyright notice for The Book Crunch Limited","chromium","2026-03-22","passed","2026-03-22","PB: Web Navigation Structure (PB §5.2)","product-bible.spec.ts","",""
"","1674","News (/news) returns 200 and loads","chromium","2026-03-22","passed","2026-03-22","Smoke: Public Pages Load","smoke.spec.ts","",""
"","2426","Library page has search within library (PB §6.2)","mobile-chrome","2026-03-22","failed","2026-03-22","Browse: Authenticated User Flows","browse.spec.ts","",""
"","275","/dashboard/admin does not expose admin panel (PB §11.6)","chromium","2026-03-22","passed","2026-03-22","API: Admin Route Hardening (PB §11.6)","api.spec.ts","",""
"","1964","Forums require login — unauthenticated visitors redirected (login is CTA per PB Q14)","mobile-chrome","2026-03-22","failed","2026-03-22","PB: Forum Access Rules (PB §6.6, Q14)","product-bible.spec.ts","",""
"","195","/.env does not expose sensitive data","chromium","2026-03-22","passed","2026-03-22","Security: Admin Route Hardening (PB §11.6)","security.spec.ts","",""
"","3544","Homepage renders Bestsellers section","mobile-chrome","2026-03-22","passed","2026-03-22","Browse: Homepage Sections (PB §6.1)","browse.spec.ts","",""
"","1983","Homepage book cover images load from R2","mobile-chrome","2026-03-22","passed","2026-03-22","Smoke: Image Delivery (Cloudflare R2)","smoke.spec.ts","",""
"","2388","Homepage — Full load within 5s","chromium","2026-03-22","passed","2026-03-22","Performance: Page Load Times","performance.spec.ts","",""
"","475","Security response headers are present","chromium","2026-03-22","passed","2026-03-22","Smoke: SSL & Security Headers","smoke.spec.ts","",""
"","223","/admin does not expose admin panel (PB §11.6)","chromium","2026-03-22","passed","2026-03-22","API: Admin Route Hardening (PB §11.6)","api.spec.ts","",""
"","1942","Discover Books (/discover/books) returns 200 and loads","mobile-chrome","2026-03-22","passed","2026-03-22","Smoke: Public Pages Load","smoke.spec.ts","",""
"","2179","Author name is visible and clickable (Priority 1 per PB §6.3)","chromium","2026-03-22","failed","2026-03-22","Browse: Book Detail Page (PB §6.3)","browse.spec.ts","",""
"","1291","Clicking a book card navigates to book detail page","mobile-chrome","2026-03-22","failed","2026-03-22","Browse: Authenticated User Flows","browse.spec.ts","",""
"","218","/discover/periodicals returns 200","chromium","2026-03-22","passed","2026-03-22","API: HTTP Status Codes","api.spec.ts","",""
"","811","No 'Publisher Profile' page — Publisher is internal-only (PB Q16)","mobile-chrome","2026-03-22","passed","2026-03-22","PB: Author Profile Rules (PB §6.10, Q15, Q16)","product-bible.spec.ts","",""
"","1742","Title and author displayed (Priority 1)","chromium","2026-03-22","passed","2026-03-22","PB: Book Detail Page Spec (PB §6.3)","product-bible.spec.ts","",""
"","2455","Age rating is displayed (PB §2.4)","chromium","2026-03-22","passed","2026-03-22","Browse: Book Detail Page (PB §6.3)","browse.spec.ts","",""
"","1834","No duplicate page titles across key pages","chromium","2026-03-22","failed","2026-03-22","SEO: Technical SEO","seo.spec.ts","",""
"","1271","Privacy Policy (/privacy) returns 200 and loads","mobile-chrome","2026-03-22","passed","2026-03-22","Smoke: Public Pages Load","smoke.spec.ts","",""
"","1846","Discover category navigation links are present","chromium","2026-03-22","passed","2026-03-22","Browse: Discover Screen (PB §6.8)","browse.spec.ts","",""
"","1718","Top navigation includes: Home, Library, News, Events, Forums","mobile-chrome","2026-03-22","passed","2026-03-22","PB: Web Navigation Structure (PB §5.2)","product-bible.spec.ts","",""
"","147","/admin/login does not expose admin panel (PB §11.6)","chromium","2026-03-22","passed","2026-03-22","API: Admin Route Hardening (PB §11.6)","api.spec.ts","",""
"","16983","Book detail page has OG tags with book info","chromium","2026-03-22","failed","2026-03-22","SEO: Open Graph Tags","seo.spec.ts","",""
"","1823","Forums page does not return a 500 error","mobile-chrome","2026-03-22","failed","2026-03-22","PB: Forum Access Rules (PB §6.6, Q14)","product-bible.spec.ts","",""
"","1962","Discover category navigation links are present","mobile-chrome","2026-03-22","passed","2026-03-22","Browse: Discover Screen (PB §6.8)","browse.spec.ts","",""
"","211","/careers returns 200","chromium","2026-03-22","passed","2026-03-22","API: HTTP Status Codes","api.spec.ts","",""
"","1704","Comics category page loads without error","mobile-chrome","2026-03-22","failed","2026-03-22","Browse: Discover Sub-Categories","browse.spec.ts","",""
"","857","/ loads within 5 seconds","chromium","2026-03-22","passed","2026-03-22","Smoke: Response Times","smoke.spec.ts","",""
"","2075","Free label appears for free books (PB §1.3)","chromium","2026-03-22","passed","2026-03-22","PB: Book Detail Page Spec (PB §6.3)","product-bible.spec.ts","",""
"","2406","Cover image is large and prominent (Priority 1 per PB §6.3)","mobile-chrome","2026-03-22","passed","2026-03-22","Browse: Book Detail Page (PB §6.3)","browse.spec.ts","",""
"","160","favicon is served","chromium","2026-03-22","passed","2026-03-22","API: Next.js Infrastructure","api.spec.ts","",""
"","3058","Sign up link navigates to /register","chromium","2026-03-22","passed","2026-03-22","Auth: Login Page UI","auth.spec.ts","",""
"","447","/ returns 200","chromium","2026-03-22","passed","2026-03-22","API: HTTP Status Codes","api.spec.ts","",""
"","956","Site serves over HTTPS","mobile-chrome","2026-03-22","passed","2026-03-22","Smoke: SSL & Security Headers","smoke.spec.ts","",""
"","1682","Bestsellers section is present on homepage","chromium","2026-03-22","passed","2026-03-22","PB: Home Screen Sections (PB §6.1)","product-bible.spec.ts","",""
"","6857","Homepage — Cumulative Layout Shift (CLS) < 0.1","chromium","2026-03-22","passed","2026-03-22","Performance: Web Vitals (via Navigation API)","performance.spec.ts","",""
"","788","Junior add-on available to Free tier — not exclusive to paid tiers (PB §1.3, Q21)","chromium","2026-03-22","passed","2026-03-22","PB: Junior Add-On Model (PB §1.3, §2.3, Q21 — v4.6)","product-bible.spec.ts","",""
"","2162","News (/news) returns 200 and loads","mobile-chrome","2026-03-22","passed","2026-03-22","Smoke: Public Pages Load","smoke.spec.ts","",""
"","1490","Careers (/careers) returns 200 and loads","chromium","2026-03-22","passed","2026-03-22","Smoke: Public Pages Load","smoke.spec.ts","",""
"","3991","Book detail page has a meta description","chromium","2026-03-22","passed","2026-03-22","SEO: Meta Tags","seo.spec.ts","",""
"","1148","Discover — DOMContentLoaded within 3s","chromium","2026-03-22","passed","2026-03-22","Performance: Page Load Times","performance.spec.ts","",""
"","585","/library redirects unauthenticated user to /login","chromium","2026-03-22","passed","2026-03-22","Smoke: Auth-Gated Routes Redirect","smoke.spec.ts","",""
"","2046","All internal links use consistent domain (no mixed domains)","chromium","2026-03-22","passed","2026-03-22","SEO: Technical SEO","seo.spec.ts","",""
"","1722","About Paygees (/about) returns 200 and loads","chromium","2026-03-22","passed","2026-03-22","Smoke: Public Pages Load","smoke.spec.ts","",""
"","1496","Audiobooks category page loads without error","chromium","2026-03-22","failed","2026-03-22","Browse: Discover Sub-Categories","browse.spec.ts","",""
"","1774","Age rating appears on book detail (PB §2.4)","chromium","2026-03-22","passed","2026-03-22","PB: Book Detail Page Spec (PB §6.3)","product-bible.spec.ts","",""
"","493","/login loads within 5 seconds","mobile-chrome","2026-03-22","passed","2026-03-22","Smoke: Response Times","smoke.spec.ts","",""
"","2003","Publisher Dashboard not linked from public homepage (PB §5.3)","chromium","2026-03-22","passed","2026-03-22","PB: Information Architecture (PB §5.3)","product-bible.spec.ts","",""
"","2120","Events (/events) returns 200 and loads","chromium","2026-03-22","passed","2026-03-22","Smoke: Public Pages Load","smoke.spec.ts","",""
"","979","Library page has search within library (PB §6.2)","chromium","2026-03-22","failed","2026-03-22","Browse: Authenticated User Flows","browse.spec.ts","",""
"","2767","Content type shown as icon/label — NOT file format (PB §6.3, §10.5)","mobile-chrome","2026-03-22","failed","2026-03-22","Browse: Book Detail Page (PB §6.3)","browse.spec.ts","",""
"","2711","Homepage has a main landmark","chromium","2026-03-22","passed","2026-03-22","Accessibility: Semantic HTML","accessibility.spec.ts","",""
"","1832","Cover image is large and prominent (Priority 1)","chromium","2026-03-22","passed","2026-03-22","PB: Book Detail Page Spec (PB §6.3)","product-bible.spec.ts","",""
"","1834","Homepage book cover images load from R2","chromium","2026-03-22","passed","2026-03-22","Smoke: Image Delivery (Cloudflare R2)","smoke.spec.ts","",""
"","748","Interactive elements show visible focus ring","chromium","2026-03-22","passed","2026-03-22","Accessibility: Focus Indicators","accessibility.spec.ts","",""
"","2092","Admin routes not linked from main site (PB §5.3, §11.6)","chromium","2026-03-22","passed","2026-03-22","PB: Information Architecture (PB §5.3)","product-bible.spec.ts","",""
"","1813","Discover page loads and shows content","chromium","2026-03-22","passed","2026-03-22","Browse: Discover Screen (PB §6.8)","browse.spec.ts","",""
"","2142","Curated section uses 'Editor's Picks' — not 'Staff Picks' or 'Paygees Picks'","chromium","2026-03-22","passed","2026-03-22","PB: Editor's Picks Naming Canonical Rule (PB §6.1)","product-bible.spec.ts","",""
"","485","/register loads within 5 seconds","chromium","2026-03-22","passed","2026-03-22","Smoke: Response Times","smoke.spec.ts","",""
"","1997","Preview/Sample button present (Priority 2 per PB §6.3 and §3.9)","chromium","2026-03-22","passed","2026-03-22","Browse: Book Detail Page (PB §6.3)","browse.spec.ts","",""
"","1423","Blog (/blog) returns 200 and loads","mobile-chrome","2026-03-22","passed","2026-03-22","Smoke: Public Pages Load","smoke.spec.ts","",""
"","146","/api/admin does not expose sensitive data","chromium","2026-03-22","passed","2026-03-22","Security: Admin Route Hardening (PB §11.6)","security.spec.ts","",""
"","1578","All internal links use HTTPS or relative paths","chromium","2026-03-22","passed","2026-03-22","Security: HTTPS Enforcement","security.spec.ts","",""
"","15587","Login page has noindex or appropriate meta (auth pages shouldn't be indexed)","chromium","2026-03-22","failed","2026-03-22","SEO: Meta Tags","seo.spec.ts","",""
"","2441","Author profile pages use /author/ route (PB §6.10)","mobile-chrome","2026-03-22","passed","2026-03-22","PB: Author Profile Rules (PB §6.10, Q15, Q16)","product-bible.spec.ts","",""
"","10624","/forums redirects unauthenticated user to /login","chromium","2026-03-22","failed","2026-03-22","Smoke: Auth-Gated Routes Redirect","smoke.spec.ts","",""
"","865","HTTP redirects to HTTPS","chromium","2026-03-22","passed","2026-03-22","Smoke: SSL & Security Headers","smoke.spec.ts","",""
"","5510","Each book card has a cover image","chromium","2026-03-22","passed","2026-03-22","Browse: Homepage Sections (PB §6.1)","browse.spec.ts","",""
"","584","Error pages do not expose stack traces","chromium","2026-03-22","passed","2026-03-22","Security: Information Disclosure","security.spec.ts","",""
"","272","/privacy returns 200","chromium","2026-03-22","passed","2026-03-22","API: HTTP Status Codes","api.spec.ts","",""
"","1590","Register — Full load within 5s","chromium","2026-03-22","passed","2026-03-22","Performance: Page Load Times","performance.spec.ts","",""
"","369","Response headers do not expose server technology details","chromium","2026-03-22","passed","2026-03-22","Security: Information Disclosure","security.spec.ts","",""
"","3642","Book cards show content type label (Book/Comic/Audiobook)","mobile-chrome","2026-03-22","passed","2026-03-22","Browse: Homepage Sections (PB §6.1)","browse.spec.ts","",""
"","1744","Bestsellers section is present on homepage","mobile-chrome","2026-03-22","passed","2026-03-22","PB: Home Screen Sections (PB §6.1)","product-bible.spec.ts","",""
"","4098","Each book card has a cover image","mobile-chrome","2026-03-22","passed","2026-03-22","Browse: Homepage Sections (PB §6.1)","browse.spec.ts","",""
"","2041","Title and author displayed (Priority 1)","mobile-chrome","2026-03-22","passed","2026-03-22","PB: Book Detail Page Spec (PB §6.3)","product-bible.spec.ts","",""
"","849","Pick 3 genres flow is present for new users (mandatory per PB)","chromium","2026-03-22","passed","2026-03-22","Auth: Day 1 New User Flow (PB §4.7)","auth.spec.ts","",""
"","16088","Homepage has OG title","chromium","2026-03-22","failed","2026-03-22","SEO: Open Graph Tags","seo.spec.ts","",""
"","2024","Home (/) returns 200 and loads","mobile-chrome","2026-03-22","passed","2026-03-22","Smoke: Public Pages Load","smoke.spec.ts","",""
"","1578","No 500 errors on any public page","chromium","2026-03-22","passed","2026-03-22","API: Next.js Infrastructure","api.spec.ts","",""
"","4861","Discover Books (/discover/books) returns 200 and loads","chromium","2026-03-22","passed","2026-03-22","Smoke: Public Pages Load","smoke.spec.ts","",""
"","385","robots.txt is present and allows crawling","chromium","2026-03-22","passed","2026-03-22","SEO: Technical SEO","seo.spec.ts","",""
"","3661","Site title contains 'Paygees' (PB header)","chromium","2026-03-22","passed","2026-03-22","PB: Brand Identity (§10.1, §10.2)","product-bible.spec.ts","",""
"","482","Login — DOMContentLoaded within 3s","chromium","2026-03-22","passed","2026-03-22","Performance: Page Load Times","performance.spec.ts","",""
"","193","/discover/documents returns 200","chromium","2026-03-22","passed","2026-03-22","API: HTTP Status Codes","api.spec.ts","",""
"","998","HTTP redirects to HTTPS","mobile-chrome","2026-03-22","passed","2026-03-22","Smoke: SSL & Security Headers","smoke.spec.ts","",""
"","2005","Forums require login — unauthenticated visitors redirected (login is CTA per PB Q14)","chromium","2026-03-22","failed","2026-03-22","PB: Forum Access Rules (PB §6.6, Q14)","product-bible.spec.ts","",""
"","1938","Books category page loads without error","mobile-chrome","2026-03-22","failed","2026-03-22","Browse: Discover Sub-Categories","browse.spec.ts","",""
"","1151","Register page renders key elements","chromium","2026-03-22","failed","2026-03-22","Auth: Registration Page UI","auth.spec.ts","",""
"","2159","Discover (/discover) returns 200 and loads","mobile-chrome","2026-03-22","passed","2026-03-22","Smoke: Public Pages Load","smoke.spec.ts","",""
"","1266","/settings is protected — unauthenticated access redirects to login","chromium","2026-03-22","passed","2026-03-22","Security: Auth Protection","security.spec.ts","",""
"","2314","Book title is visible (Priority 1 per PB §6.3)","mobile-chrome","2026-03-22","passed","2026-03-22","Browse: Book Detail Page (PB §6.3)","browse.spec.ts","",""
"","1826","'Junior' terminology used — not 'Kids' or 'Children' (PB §1.3)","mobile-chrome","2026-03-22","passed","2026-03-22","PB: Subscription Tiers in UI (PB §1.3, v4.6)","product-bible.spec.ts","",""
"","522","/login loads within 5 seconds","chromium","2026-03-22","passed","2026-03-22","Smoke: Response Times","smoke.spec.ts","",""
"","1173","Sign Out is in profile dropdown only — not in top bar directly (PB §5.2)","mobile-chrome","2026-03-22","failed","2026-03-22","PB: Information Architecture (PB §5.3)","product-bible.spec.ts","",""
"","1924","Preview/Sample button present (Priority 2 per PB §6.3 and §3.9)","mobile-chrome","2026-03-22","passed","2026-03-22","Browse: Book Detail Page (PB §6.3)","browse.spec.ts","",""
"","887","After login, Library is accessible without redirect","chromium","2026-03-22","failed","2026-03-22","Auth: Successful Login Flow","auth.spec.ts","",""
"","2160","Cover image is large and prominent (Priority 1 per PB §6.3)","chromium","2026-03-22","passed","2026-03-22","Browse: Book Detail Page (PB §6.3)","browse.spec.ts","",""
"","1294","/library is protected — unauthenticated access redirects to login","chromium","2026-03-22","passed","2026-03-22","Security: Auth Protection","security.spec.ts","",""
"","194","Discover responds within 5 seconds","chromium","2026-03-22","passed","2026-03-22","API: Response Time Benchmarks","api.spec.ts","",""
"","1977","Junior is not presented as a comparable standalone subscription tier","chromium","2026-03-22","passed","2026-03-22","PB: Junior Add-On Model (PB §1.3, §2.3, Q21 — v4.6)","product-bible.spec.ts","",""
"","2558","Navigation links are focusable with Tab","chromium","2026-03-22","passed","2026-03-22","Accessibility: Keyboard Navigation","accessibility.spec.ts","",""
"","5401","Home (/) returns 200 and loads","chromium","2026-03-22","passed","2026-03-22","Smoke: Public Pages Load","smoke.spec.ts","",""
"","4508","Primary colour #1EAEDB is used — banned #2CB5B5 must not appear (PB §10.2)","chromium","2026-03-22","passed","2026-03-22","PB: Brand Identity (§10.1, §10.2)","product-bible.spec.ts","",""
"","2049","Sections use 'See More' / 'View All' links per PB §6.1 (max 10 per section)","chromium","2026-03-22","passed","2026-03-22","Browse: Homepage Sections (PB §6.1)","browse.spec.ts","",""
"","542","/register loads within 5 seconds","mobile-chrome","2026-03-22","passed","2026-03-22","Smoke: Response Times","smoke.spec.ts","",""
"","1930","Cover image is large and prominent (Priority 1)","mobile-chrome","2026-03-22","passed","2026-03-22","PB: Book Detail Page Spec (PB §6.3)","product-bible.spec.ts","",""
"","201","/help returns 200","chromium","2026-03-22","passed","2026-03-22","API: HTTP Status Codes","api.spec.ts","",""
"","1209","Sign Out is in profile dropdown only — not in top bar directly (PB §5.2)","chromium","2026-03-22","failed","2026-03-22","PB: Information Architecture (PB §5.3)","product-bible.spec.ts","",""
"","1680","Discover section includes: Books, Audiobooks, Periodicals, Comics, Documents","chromium","2026-03-22","passed","2026-03-22","PB: Web Navigation Structure (PB §5.2)","product-bible.spec.ts","",""
"","115","/admin/users does not expose sensitive data","chromium","2026-03-22","passed","2026-03-22","Security: Admin Route Hardening (PB §11.6)","security.spec.ts","",""
"","1864","No console errors on homepage","chromium","2026-03-22","failed","2026-03-22","Performance: Resource Loading","performance.spec.ts","",""
"","2045","Footer contains company and support links (PB §5.2)","mobile-chrome","2026-03-22","passed","2026-03-22","PB: Web Navigation Structure (PB §5.2)","product-bible.spec.ts","",""
"","3258","Audiobooks category page loads without error","mobile-chrome","2026-03-22","failed","2026-03-22","Browse: Discover Sub-Categories","browse.spec.ts","",""
"","2039","Junior is NOT presented as a default-included benefit of any tier (PB §1.3, Q21)","chromium","2026-03-22","passed","2026-03-22","PB: Subscription Tiers in UI (PB §1.3, v4.6)","product-bible.spec.ts","",""
"","405","/discover/books returns 200","chromium","2026-03-22","passed","2026-03-22","API: HTTP Status Codes","api.spec.ts","",""
"","863","Site serves over HTTPS","chromium","2026-03-22","passed","2026-03-22","Smoke: SSL & Security Headers","smoke.spec.ts","",""
"","870","Homepage loads on simulated slow 3G (African market priority — PB §4.5)","chromium","2026-03-22","passed","2026-03-22","Performance: Resource Loading","performance.spec.ts","",""
"","204","/contact returns 200","chromium","2026-03-22","passed","2026-03-22","API: HTTP Status Codes","api.spec.ts","",""
"","1336","Forgot password link navigates to /forgot-password","chromium","2026-03-22","passed","2026-03-22","Auth: Login Page UI","auth.spec.ts","",""
"","644","Login redirect param to external domain is ignored","chromium","2026-03-22","failed","2026-03-22","Security: Open Redirect Prevention","security.spec.ts","",""
"","3910","Login with empty fields shows validation","chromium","2026-03-22","passed","2026-03-22","Auth: Login Page UI","auth.spec.ts","",""
"","2274","Book title is visible (Priority 1 per PB §6.3)","chromium","2026-03-22","passed","2026-03-22","Browse: Book Detail Page (PB §6.3)","browse.spec.ts","",""
"","1938","Forums (/forums) returns 200 and loads","chromium","2026-03-22","passed","2026-03-22","Smoke: Public Pages Load","smoke.spec.ts","",""
"","209","/library without auth returns 200 with login content or redirects","chromium","2026-03-22","passed","2026-03-22","API: Auth-Gated Routes Return Redirect (not 200)","api.spec.ts","",""
