"DESCRIPTION","DURATION IN MS","NAME","PARENT SUITE","START TIME","STATUS","STOP TIME","SUB SUITE","SUITE","TEST CLASS","TEST METHOD"
"","1594","Author profile pages use /author/ route (PB §6.10)","chromium","2026-04-02","passed","2026-04-02","PB: Author Profile Rules (PB §6.10, Q15, Q16)","product-bible.spec.ts","",""
"","587","/register loads within 5 seconds","mobile-chrome","2026-04-02","passed","2026-04-02","Smoke: Response Times","smoke.spec.ts","",""
"","1655","Discover Periodicals (/discover/periodicals) returns 200 and loads","chromium","2026-04-02","passed","2026-04-02","Smoke: Public Pages Load","smoke.spec.ts","",""
"","3899","HTTP redirects to HTTPS","mobile-chrome","2026-04-02","passed","2026-04-02","Smoke: SSL & Security Headers","smoke.spec.ts","",""
"","2928","Logo reads 'PAYGEES' (PB §10.1)","mobile-chrome","2026-04-02","passed","2026-04-02","PB: Brand Identity (§10.1, §10.2)","product-bible.spec.ts","",""
"","187","/cms does not expose admin panel (PB §11.6)","chromium","2026-04-02","passed","2026-04-02","API: Admin Route Hardening (PB §11.6)","api.spec.ts","",""
"","1171","Logged-in Free user can access forums (PB Q14 — read + reply access)","mobile-chrome","2026-04-02","failed","2026-04-02","PB: Forum Access Rules (PB §6.6, Q14)","product-bible.spec.ts","",""
"","153","/forums returns 200","chromium","2026-04-02","passed","2026-04-02","API: HTTP Status Codes","api.spec.ts","",""
"","1586","Comics category page loads without error","chromium","2026-04-02","failed","2026-04-02","Browse: Discover Sub-Categories","browse.spec.ts","",""
"","1929","Free label appears for free books (PB §1.3)","mobile-chrome","2026-04-02","failed","2026-04-02","PB: Book Detail Page Spec (PB §6.3)","product-bible.spec.ts","",""
"","1741","Discover Audiobooks (/discover/audiobooks) returns 200 and loads","mobile-chrome","2026-04-02","passed","2026-04-02","Smoke: Public Pages Load","smoke.spec.ts","",""
"","250","/admin/* returns 404 (not a redirect hint) per PB §11.6","mobile-chrome","2026-04-02","passed","2026-04-02","Smoke: Admin Route Hardening","smoke.spec.ts","",""
"","108","Response headers do not expose server technology details","chromium","2026-04-02","passed","2026-04-02","Security: Information Disclosure","security.spec.ts","",""
"","138","/settings without auth returns 200 with login content or redirects","chromium","2026-04-02","passed","2026-04-02","API: Auth-Gated Routes Return Redirect (not 200)","api.spec.ts","",""
"","1580","Register page renders key elements","chromium","2026-04-02","failed","2026-04-02","Auth: Registration Page UI","auth.spec.ts","",""
"","1111","/discover loads within 5 seconds","chromium","2026-04-02","passed","2026-04-02","Smoke: Response Times","smoke.spec.ts","",""
"","1701","Terms of Service (/terms) returns 200 and loads","chromium","2026-04-02","passed","2026-04-02","Smoke: Public Pages Load","smoke.spec.ts","",""
"","1827","Events (/events) returns 200 and loads","chromium","2026-04-02","passed","2026-04-02","Smoke: Public Pages Load","smoke.spec.ts","",""
"","1529","About Paygees (/about) returns 200 and loads","mobile-chrome","2026-04-02","passed","2026-04-02","Smoke: Public Pages Load","smoke.spec.ts","",""
"","3190","Guardian Dashboard is not linked to logged-out users (PB §5.3)","mobile-chrome","2026-04-02","passed","2026-04-02","PB: Junior Add-On Model (PB §1.3, §2.3, Q21 — v4.6)","product-bible.spec.ts","",""
"","1840","File format names do NOT appear — never show EPUB/PDF/MP3 (PB §6.3)","mobile-chrome","2026-04-02","passed","2026-04-02","PB: Book Detail Page Spec (PB §6.3)","product-bible.spec.ts","",""
"","1197","Sign up link navigates to /register","chromium","2026-04-02","passed","2026-04-02","Auth: Login Page UI","auth.spec.ts","",""
"","1848","Price or Free label is displayed (Priority 2 per PB §6.3)","mobile-chrome","2026-04-02","passed","2026-04-02","Browse: Book Detail Page (PB §6.3)","browse.spec.ts","",""
"","3875","Login with empty fields shows validation","chromium","2026-04-02","passed","2026-04-02","Auth: Login Page UI","auth.spec.ts","",""
"","11293","Cover image is large and prominent (Priority 1 per PB §6.3)","chromium","2026-04-02","failed","2026-04-02","Browse: Book Detail Page (PB §6.3)","browse.spec.ts","",""
"","1763","Careers (/careers) returns 200 and loads","mobile-chrome","2026-04-02","passed","2026-04-02","Smoke: Public Pages Load","smoke.spec.ts","",""
"","13152","Homepage contains 'Discover More' or equivalent CTA","mobile-chrome","2026-04-02","failed","2026-04-02","Browse: Homepage Sections (PB §6.1)","browse.spec.ts","",""
"","358","/admin does not expose sensitive data","chromium","2026-04-02","passed","2026-04-02","Security: Admin Route Hardening (PB §11.6)","security.spec.ts","",""
"","114","/terms returns 200","chromium","2026-04-02","passed","2026-04-02","API: HTTP Status Codes","api.spec.ts","",""
"","12783","Top navigation includes: Home, Library, News, Events, Forums","mobile-chrome","2026-04-02","failed","2026-04-02","PB: Web Navigation Structure (PB §5.2)","product-bible.spec.ts","",""
"","1694","Forums page does not return a 500 error","chromium","2026-04-02","failed","2026-04-02","PB: Forum Access Rules (PB §6.6, Q14)","product-bible.spec.ts","",""
"","599","Login redirect param to external domain is ignored","chromium","2026-04-02","failed","2026-04-02","Security: Open Redirect Prevention","security.spec.ts","",""
"","1384","Footer contains company and support links (PB §5.2)","chromium","2026-04-02","passed","2026-04-02","PB: Web Navigation Structure (PB §5.2)","product-bible.spec.ts","",""
"","326","Security response headers are present","chromium","2026-04-02","passed","2026-04-02","Smoke: SSL & Security Headers","smoke.spec.ts","",""
"","1684","Age rating is displayed (PB §2.4)","chromium","2026-04-02","failed","2026-04-02","Browse: Book Detail Page (PB §6.3)","browse.spec.ts","",""
"","1844","About Paygees (/about) returns 200 and loads","chromium","2026-04-02","passed","2026-04-02","Smoke: Public Pages Load","smoke.spec.ts","",""
"","1197","Footer contains copyright notice for The Book Crunch Limited","chromium","2026-04-02","passed","2026-04-02","PB: Web Navigation Structure (PB §5.2)","product-bible.spec.ts","",""
"","126","/library without auth returns 200 with login content or redirects","chromium","2026-04-02","passed","2026-04-02","API: Auth-Gated Routes Return Redirect (not 200)","api.spec.ts","",""
"","3680","Homepage renders Bestsellers section","chromium","2026-04-02","passed","2026-04-02","Browse: Homepage Sections (PB §6.1)","browse.spec.ts","",""
"","178","Homepage includes content security or transport headers","chromium","2026-04-02","passed","2026-04-02","API: Security Headers","api.spec.ts","",""
"","826","/library redirects unauthenticated user to /login","mobile-chrome","2026-04-02","passed","2026-04-02","Smoke: Auth-Gated Routes Redirect","smoke.spec.ts","",""
"","94","/admin does not expose admin panel (PB §11.6)","chromium","2026-04-02","passed","2026-04-02","API: Admin Route Hardening (PB §11.6)","api.spec.ts","",""
"","786","Register page includes T&C consent text per PB","chromium","2026-04-02","passed","2026-04-02","Auth: Registration Page UI","auth.spec.ts","",""
"","1216","After login, Sign Out is in profile dropdown only per PB §5.2","chromium","2026-04-02","failed","2026-04-02","Auth: Successful Login Flow","auth.spec.ts","",""
"","1143","Documents category page loads without error","mobile-chrome","2026-04-02","failed","2026-04-02","Browse: Discover Sub-Categories","browse.spec.ts","",""
"","2763","Primary colour #1EAEDB is used — banned #2CB5B5 must not appear (PB §10.2)","chromium","2026-04-02","passed","2026-04-02","PB: Brand Identity (§10.1, §10.2)","product-bible.spec.ts","",""
"","4712","Homepage has correct title tag","chromium","2026-04-02","passed","2026-04-02","SEO: Meta Tags","seo.spec.ts","",""
"","2227","Site title contains 'Paygees' (PB header)","chromium","2026-04-02","passed","2026-04-02","PB: Brand Identity (§10.1, §10.2)","product-bible.spec.ts","",""
"","1593","Contact Us (/contact) returns 200 and loads","mobile-chrome","2026-04-02","passed","2026-04-02","Smoke: Public Pages Load","smoke.spec.ts","",""
"","1592","Clicking a book card navigates to book detail page","mobile-chrome","2026-04-02","failed","2026-04-02","Browse: Authenticated User Flows","browse.spec.ts","",""
"","1154","Sign Out is in profile dropdown only — not in top bar directly (PB §5.2)","mobile-chrome","2026-04-02","failed","2026-04-02","PB: Information Architecture (PB §5.3)","product-bible.spec.ts","",""
"","11599","Discover page loads and shows content","chromium","2026-04-02","failed","2026-04-02","Browse: Discover Screen (PB §6.8)","browse.spec.ts","",""
"","66","favicon is served","chromium","2026-04-02","passed","2026-04-02","API: Next.js Infrastructure","api.spec.ts","",""
"","12061","Sections use 'See More' / 'View All' links per PB §6.1 (max 10 per section)","chromium","2026-04-02","failed","2026-04-02","Browse: Homepage Sections (PB §6.1)","browse.spec.ts","",""
"","2119","Discover Documents & Research (/discover/documents) returns 200 and loads","chromium","2026-04-02","passed","2026-04-02","Smoke: Public Pages Load","smoke.spec.ts","",""
"","3941","Discover Audiobooks (/discover/audiobooks) returns 200 and loads","chromium","2026-04-02","passed","2026-04-02","Smoke: Public Pages Load","smoke.spec.ts","",""
"","94","/login returns 200","chromium","2026-04-02","passed","2026-04-02","API: HTTP Status Codes","api.spec.ts","",""
"","185","/privacy returns 200","chromium","2026-04-02","passed","2026-04-02","API: HTTP Status Codes","api.spec.ts","",""
"","1024","Site serves over HTTPS","chromium","2026-04-02","passed","2026-04-02","Smoke: SSL & Security Headers","smoke.spec.ts","",""
"","1803","Discover Periodicals (/discover/periodicals) returns 200 and loads","mobile-chrome","2026-04-02","passed","2026-04-02","Smoke: Public Pages Load","smoke.spec.ts","",""
"","1144","Library page has search within library (PB §6.2)","mobile-chrome","2026-04-02","failed","2026-04-02","Browse: Authenticated User Flows","browse.spec.ts","",""
"","1590","Forgot Password (/forgot-password) returns 200 and loads","mobile-chrome","2026-04-02","passed","2026-04-02","Smoke: Public Pages Load","smoke.spec.ts","",""
"","1749","Discover Comics & Illustrations (/discover/comics) returns 200 and loads","mobile-chrome","2026-04-02","passed","2026-04-02","Smoke: Public Pages Load","smoke.spec.ts","",""
"","1879","Logged-out users see marketing/landing content on homepage","chromium","2026-04-02","passed","2026-04-02","PB: Information Architecture (PB §5.3)","product-bible.spec.ts","",""
"","1050","/settings redirects unauthenticated user to /login","mobile-chrome","2026-04-02","passed","2026-04-02","Smoke: Auth-Gated Routes Redirect","smoke.spec.ts","",""
"","1679","Content type shown as icon/label — NOT file format (PB §6.3, §10.5)","mobile-chrome","2026-04-02","passed","2026-04-02","Browse: Book Detail Page (PB §6.3)","browse.spec.ts","",""
"","1184","Junior add-on available to Free tier — not exclusive to paid tiers (PB §1.3, Q21)","chromium","2026-04-02","passed","2026-04-02","PB: Junior Add-On Model (PB §1.3, §2.3, Q21 — v4.6)","product-bible.spec.ts","",""
"","1435","No duplicate page titles across key pages","chromium","2026-04-02","failed","2026-04-02","SEO: Technical SEO","seo.spec.ts","",""
"","2941","Curated section uses 'Editor's Picks' — not 'Staff Picks' or 'Paygees Picks'","mobile-chrome","2026-04-02","passed","2026-04-02","PB: Editor's Picks Naming Canonical Rule (PB §6.1)","product-bible.spec.ts","",""
"","1660","Help Centre (/help) returns 200 and loads","mobile-chrome","2026-04-02","passed","2026-04-02","Smoke: Public Pages Load","smoke.spec.ts","",""
"","1454","/library is protected — unauthenticated access redirects to login","chromium","2026-04-02","passed","2026-04-02","Security: Auth Protection","security.spec.ts","",""
"","1454","Homepage — First Contentful Paint (FCP) < 3s","chromium","2026-04-02","passed","2026-04-02","Performance: Web Vitals (via Navigation API)","performance.spec.ts","",""
"","721","No 'Publisher Profile' page — Publisher is internal-only (PB Q16)","chromium","2026-04-02","passed","2026-04-02","PB: Author Profile Rules (PB §6.10, Q15, Q16)","product-bible.spec.ts","",""
"","1629","Curated section uses 'Editor's Picks' — not 'Staff Picks' or 'Paygees Picks'","chromium","2026-04-02","passed","2026-04-02","PB: Editor's Picks Naming Canonical Rule (PB §6.1)","product-bible.spec.ts","",""
"","3513","Junior is not presented as a comparable standalone subscription tier","mobile-chrome","2026-04-02","passed","2026-04-02","PB: Junior Add-On Model (PB §1.3, §2.3, Q21 — v4.6)","product-bible.spec.ts","",""
"","172","/careers returns 200","chromium","2026-04-02","passed","2026-04-02","API: HTTP Status Codes","api.spec.ts","",""
"","679","Login redirect param cannot be used to redirect to external site","chromium","2026-04-02","failed","2026-04-02","Security: Open Redirect Prevention","security.spec.ts","",""
"","1834","Junior is not presented as a comparable standalone subscription tier","chromium","2026-04-02","passed","2026-04-02","PB: Junior Add-On Model (PB §1.3, §2.3, Q21 — v4.6)","product-bible.spec.ts","",""
"","1442","Register — Full load within 5s","chromium","2026-04-02","passed","2026-04-02","Performance: Page Load Times","performance.spec.ts","",""
"","898","After login, Library is accessible without redirect","chromium","2026-04-02","failed","2026-04-02","Auth: Successful Login Flow","auth.spec.ts","",""
"","1659","Terms of Service (/terms) returns 200 and loads","mobile-chrome","2026-04-02","passed","2026-04-02","Smoke: Public Pages Load","smoke.spec.ts","",""
"","971","No 'Publisher Profile' page — Publisher is internal-only (PB Q16)","mobile-chrome","2026-04-02","passed","2026-04-02","PB: Author Profile Rules (PB §6.10, Q15, Q16)","product-bible.spec.ts","",""
"","3272","Login page renders all required elements","chromium","2026-04-02","passed","2026-04-02","Auth: Login Page UI","auth.spec.ts","",""
"","432","/admin/* returns 404 (not a redirect hint) per PB §11.6","chromium","2026-04-02","passed","2026-04-02","Smoke: Admin Route Hardening","smoke.spec.ts","",""
"","11999","Discover page loads and shows content","mobile-chrome","2026-04-02","failed","2026-04-02","Browse: Discover Screen (PB §6.8)","browse.spec.ts","",""
"","1669","Privacy Policy (/privacy) returns 200 and loads","chromium","2026-04-02","passed","2026-04-02","Smoke: Public Pages Load","smoke.spec.ts","",""
"","17598","Book detail page has OG tags with book info","chromium","2026-04-02","failed","2026-04-02","SEO: Open Graph Tags","seo.spec.ts","",""
"","1013","Error pages do not expose stack traces","chromium","2026-04-02","passed","2026-04-02","Security: Information Disclosure","security.spec.ts","",""
"","1735","Forums (/forums) returns 200 and loads","mobile-chrome","2026-04-02","passed","2026-04-02","Smoke: Public Pages Load","smoke.spec.ts","",""
"","1608","Periodicals category page loads without error","chromium","2026-04-02","failed","2026-04-02","Browse: Discover Sub-Categories","browse.spec.ts","",""
"","12102","Cover image is large and prominent (Priority 1)","mobile-chrome","2026-04-02","failed","2026-04-02","PB: Book Detail Page Spec (PB §6.3)","product-bible.spec.ts","",""
"","1755","Book title is visible (Priority 1 per PB §6.3)","chromium","2026-04-02","failed","2026-04-02","Browse: Book Detail Page (PB §6.3)","browse.spec.ts","",""
"","2053","All internal links use HTTPS or relative paths","chromium","2026-04-02","passed","2026-04-02","Security: HTTPS Enforcement","security.spec.ts","",""
"","1469","Log In (/login) returns 200 and loads","mobile-chrome","2026-04-02","passed","2026-04-02","Smoke: Public Pages Load","smoke.spec.ts","",""
"","192","/api/admin does not expose sensitive data","chromium","2026-04-02","passed","2026-04-02","Security: Admin Route Hardening (PB §11.6)","security.spec.ts","",""
"","1109","/login loads within 5 seconds","mobile-chrome","2026-04-02","passed","2026-04-02","Smoke: Response Times","smoke.spec.ts","",""
"","164","/discover/documents returns 200","chromium","2026-04-02","passed","2026-04-02","API: HTTP Status Codes","api.spec.ts","",""
"","1750","Discover — DOMContentLoaded within 3s","chromium","2026-04-02","passed","2026-04-02","Performance: Page Load Times","performance.spec.ts","",""
"","213","Discover responds within 5 seconds","chromium","2026-04-02","passed","2026-04-02","API: Response Time Benchmarks","api.spec.ts","",""
"","1513","Title and author displayed (Priority 1)","chromium","2026-04-02","failed","2026-04-02","PB: Book Detail Page Spec (PB §6.3)","product-bible.spec.ts","",""
"","4102","Discover (/discover) returns 200 and loads","chromium","2026-04-02","passed","2026-04-02","Smoke: Public Pages Load","smoke.spec.ts","",""
"","3149","Home (/) returns 200 and loads","chromium","2026-04-02","passed","2026-04-02","Smoke: Public Pages Load","smoke.spec.ts","",""
"","15677","Homepage has a canonical URL","chromium","2026-04-02","failed","2026-04-02","SEO: Canonical URLs","seo.spec.ts","",""
"","1408","Tagline 'Affordable | Accessible | Available' is present (PB §4.1)","chromium","2026-04-02","failed","2026-04-02","PB: Brand Identity (§10.1, §10.2)","product-bible.spec.ts","",""
"","5082","R2 signed URLs on homepage load successfully","chromium","2026-04-02","passed","2026-04-02","API: Cloudflare R2 Image Delivery","api.spec.ts","",""
"","1599","Events (/events) returns 200 and loads","mobile-chrome","2026-04-02","passed","2026-04-02","Smoke: Public Pages Load","smoke.spec.ts","",""
"","188","sitemap.xml is valid XML if present","chromium","2026-04-02","passed","2026-04-02","SEO: Technical SEO","seo.spec.ts","",""
"","189","/wp-admin does not expose admin panel (PB §11.6)","chromium","2026-04-02","passed","2026-04-02","API: Admin Route Hardening (PB §11.6)","api.spec.ts","",""
"","1146","Logged-in Free user can access forums (PB Q14 — read + reply access)","chromium","2026-04-02","failed","2026-04-02","PB: Forum Access Rules (PB §6.6, Q14)","product-bible.spec.ts","",""
"","2608","Junior is NOT presented as a default-included benefit of any tier (PB §1.3, Q21)","mobile-chrome","2026-04-02","passed","2026-04-02","PB: Subscription Tiers in UI (PB §1.3, v4.6)","product-bible.spec.ts","",""
"","1757","Cookies have appropriate flags","chromium","2026-04-02","passed","2026-04-02","API: Security Headers","api.spec.ts","",""
"","1666","Publisher Dashboard not linked from public homepage (PB §5.3)","chromium","2026-04-02","passed","2026-04-02","PB: Information Architecture (PB §5.3)","product-bible.spec.ts","",""
"","2249","Audiobooks category page loads without error","mobile-chrome","2026-04-02","failed","2026-04-02","Browse: Discover Sub-Categories","browse.spec.ts","",""
"","124","Homepage responds within 5 seconds","chromium","2026-04-02","passed","2026-04-02","API: Response Time Benchmarks","api.spec.ts","",""
"","193","/blog returns 200","chromium","2026-04-02","passed","2026-04-02","API: HTTP Status Codes","api.spec.ts","",""
"","1643","Discover category navigation links are present","mobile-chrome","2026-04-02","passed","2026-04-02","Browse: Discover Screen (PB §6.8)","browse.spec.ts","",""
"","1469","Books category page loads without error","mobile-chrome","2026-04-02","failed","2026-04-02","Browse: Discover Sub-Categories","browse.spec.ts","",""
"","3657","Book cards show content type label (Book/Comic/Audiobook)","chromium","2026-04-02","passed","2026-04-02","Browse: Homepage Sections (PB §6.1)","browse.spec.ts","",""
"","3659","Site serves over HTTPS","mobile-chrome","2026-04-02","passed","2026-04-02","Smoke: SSL & Security Headers","smoke.spec.ts","",""
"","1995","Age rating appears on book detail (PB §2.4)","chromium","2026-04-02","failed","2026-04-02","PB: Book Detail Page Spec (PB §6.3)","product-bible.spec.ts","",""
"","2151","Forums page does not return a 500 error","mobile-chrome","2026-04-02","failed","2026-04-02","PB: Forum Access Rules (PB §6.6, Q14)","product-bible.spec.ts","",""
"","2240","Discover Comics & Illustrations (/discover/comics) returns 200 and loads","chromium","2026-04-02","passed","2026-04-02","Smoke: Public Pages Load","smoke.spec.ts","",""
"","971","Documents category page loads without error","chromium","2026-04-02","failed","2026-04-02","Browse: Discover Sub-Categories","browse.spec.ts","",""
"","11945","Homepage contains 'Discover More' or equivalent CTA","chromium","2026-04-02","failed","2026-04-02","Browse: Homepage Sections (PB §6.1)","browse.spec.ts","",""
"","11971","Top navigation includes: Home, Library, News, Events, Forums","chromium","2026-04-02","failed","2026-04-02","PB: Web Navigation Structure (PB §5.2)","product-bible.spec.ts","",""
"","1349","Periodicals category page loads without error","mobile-chrome","2026-04-02","failed","2026-04-02","Browse: Discover Sub-Categories","browse.spec.ts","",""
"","1745","'Junior' terminology used — not 'Kids' or 'Children' (PB §1.3)","chromium","2026-04-02","passed","2026-04-02","PB: Subscription Tiers in UI (PB §1.3, v4.6)","product-bible.spec.ts","",""
"","2115","Footer contains company and support links (PB §5.2)","mobile-chrome","2026-04-02","passed","2026-04-02","PB: Web Navigation Structure (PB §5.2)","product-bible.spec.ts","",""
"","2496","Home (/) returns 200 and loads","mobile-chrome","2026-04-02","passed","2026-04-02","Smoke: Public Pages Load","smoke.spec.ts","",""
"","1887","Author name is visible and clickable (Priority 1 per PB §6.3)","mobile-chrome","2026-04-02","failed","2026-04-02","Browse: Book Detail Page (PB §6.3)","browse.spec.ts","",""
"","1711","Discover Books (/discover/books) returns 200 and loads","mobile-chrome","2026-04-02","passed","2026-04-02","Smoke: Public Pages Load","smoke.spec.ts","",""
"","2434","Blog (/blog) returns 200 and loads","mobile-chrome","2026-04-02","passed","2026-04-02","Smoke: Public Pages Load","smoke.spec.ts","",""
"","1209","Forgot password link navigates to /forgot-password","chromium","2026-04-02","passed","2026-04-02","Auth: Login Page UI","auth.spec.ts","",""
"","212","/admin/login does not expose sensitive data","chromium","2026-04-02","passed","2026-04-02","Security: Admin Route Hardening (PB §11.6)","security.spec.ts","",""
"","1611","Homepage — DOMContentLoaded within 3s","chromium","2026-04-02","passed","2026-04-02","Performance: Page Load Times","performance.spec.ts","",""
"","1408","Content type shown as icon/label — NOT file format (PB §6.3, §10.5)","chromium","2026-04-02","passed","2026-04-02","Browse: Book Detail Page (PB §6.3)","browse.spec.ts","",""
"","106","/admin/finance does not expose sensitive data","chromium","2026-04-02","passed","2026-04-02","Security: Admin Route Hardening (PB §11.6)","security.spec.ts","",""
"","15747","Homepage has OG image","chromium","2026-04-02","failed","2026-04-02","SEO: Open Graph Tags","seo.spec.ts","",""
"","1919","Help Centre (/help) returns 200 and loads","chromium","2026-04-02","passed","2026-04-02","Smoke: Public Pages Load","smoke.spec.ts","",""
"","2228","Logo reads 'PAYGEES' (PB §10.1)","chromium","2026-04-02","passed","2026-04-02","PB: Brand Identity (§10.1, §10.2)","product-bible.spec.ts","",""
"","6994","Book cards show content type label (Book/Comic/Audiobook)","mobile-chrome","2026-04-02","passed","2026-04-02","Browse: Homepage Sections (PB §6.1)","browse.spec.ts","",""
"","628","Forums page requires login — redirects unauthenticated users (PB §6.6, Q14)","chromium","2026-04-02","failed","2026-04-02","Browse: Authenticated User Flows","browse.spec.ts","",""
"","563","Login — DOMContentLoaded within 3s","chromium","2026-04-02","passed","2026-04-02","Performance: Page Load Times","performance.spec.ts","",""
"","12631","Discover section includes: Books, Audiobooks, Periodicals, Comics, Documents","mobile-chrome","2026-04-02","failed","2026-04-02","PB: Web Navigation Structure (PB §5.2)","product-bible.spec.ts","",""
"","2935","Submitting forgot password with valid email shows confirmation, not error","chromium","2026-04-02","failed","2026-04-02","Auth: Forgot Password Flow","auth.spec.ts","",""
"","362","/discover returns 200","chromium","2026-04-02","passed","2026-04-02","API: HTTP Status Codes","api.spec.ts","",""
"","1723","No EPUB / PDF / MP3 format names appear in UI (PB §10.5)","chromium","2026-04-02","passed","2026-04-02","PB: Home Screen Sections (PB §6.1)","product-bible.spec.ts","",""
"","3256","Homepage has a nav landmark","chromium","2026-04-02","passed","2026-04-02","Accessibility: Semantic HTML","accessibility.spec.ts","",""
"","284","robots.txt is present and allows crawling","chromium","2026-04-02","passed","2026-04-02","SEO: Technical SEO","seo.spec.ts","",""
"","1273","Comics category page loads without error","mobile-chrome","2026-04-02","failed","2026-04-02","Browse: Discover Sub-Categories","browse.spec.ts","",""
"","1745","Forgot Password (/forgot-password) returns 200 and loads","chromium","2026-04-02","passed","2026-04-02","Smoke: Public Pages Load","smoke.spec.ts","",""
"","1849","Book title is visible (Priority 1 per PB §6.3)","mobile-chrome","2026-04-02","failed","2026-04-02","Browse: Book Detail Page (PB §6.3)","browse.spec.ts","",""
"","482","Register — DOMContentLoaded within 3s","chromium","2026-04-02","passed","2026-04-02","Performance: Page Load Times","performance.spec.ts","",""
"","2219","Coral #E8735A used for section headers only — not CTA button fills (PB §10.2)","chromium","2026-04-02","passed","2026-04-02","PB: Home Screen Sections (PB §6.1)","product-bible.spec.ts","",""
