"DESCRIPTION","DURATION IN MS","NAME","PARENT SUITE","START TIME","STATUS","STOP TIME","SUB SUITE","SUITE","TEST CLASS","TEST METHOD"
"","1250","Documents category page loads without error","chromium","2026-05-05","failed","2026-05-05","Browse: Discover Sub-Categories","browse.spec.ts","",""
"","16005","Library page shows tabs: In Progress, Favorites, Finished, All My Books (PB §6.2)","mobile-chrome","2026-05-05","failed","2026-05-05","Browse: Authenticated User Flows","browse.spec.ts","",""
"","1702","Book detail page has OG tags with book info","chromium","2026-05-05","passed","2026-05-05","SEO: Open Graph Tags","seo.spec.ts","",""
"","2234","All internal links use HTTPS or relative paths","chromium","2026-05-05","passed","2026-05-05","Security: HTTPS Enforcement","security.spec.ts","",""
"","1619","Sign Up (/register) returns 200 and loads","chromium","2026-05-05","passed","2026-05-05","Smoke: Public Pages Load","smoke.spec.ts","",""
"","1525","Forgot Password (/forgot-password) returns 200 and loads","mobile-chrome","2026-05-05","passed","2026-05-05","Smoke: Public Pages Load","smoke.spec.ts","",""
"","2423","Coral #E8735A used for section headers only — not CTA button fills (PB §10.2)","mobile-chrome","2026-05-05","passed","2026-05-05","PB: Home Screen Sections (PB §6.1)","product-bible.spec.ts","",""
"","1379","/register loads within 5 seconds","mobile-chrome","2026-05-05","passed","2026-05-05","Smoke: Response Times","smoke.spec.ts","",""
"","2052","Documents category page loads without error","mobile-chrome","2026-05-05","failed","2026-05-05","Browse: Discover Sub-Categories","browse.spec.ts","",""
"","15654","Homepage has a canonical URL","chromium","2026-05-05","failed","2026-05-05","SEO: Canonical URLs","seo.spec.ts","",""
"","1891","Discover Periodicals (/discover/periodicals) returns 200 and loads","chromium","2026-05-05","passed","2026-05-05","Smoke: Public Pages Load","smoke.spec.ts","",""
"","291","/dashboard/admin does not expose admin panel (PB §11.6)","chromium","2026-05-05","passed","2026-05-05","API: Admin Route Hardening (PB §11.6)","api.spec.ts","",""
"","11806","Sections use 'See More' / 'View All' links per PB §6.1 (max 10 per section)","chromium","2026-05-05","failed","2026-05-05","Browse: Homepage Sections (PB §6.1)","browse.spec.ts","",""
"","1164","Site serves over HTTPS","chromium","2026-05-05","passed","2026-05-05","Smoke: SSL & Security Headers","smoke.spec.ts","",""
"","1728","News (/news) returns 200 and loads","chromium","2026-05-05","passed","2026-05-05","Smoke: Public Pages Load","smoke.spec.ts","",""
"","1880","Forums require login — unauthenticated visitors redirected (login is CTA per PB Q14)","chromium","2026-05-05","passed","2026-05-05","PB: Forum Access Rules (PB §6.6, Q14)","product-bible.spec.ts","",""
"","1585","Junior add-on available to Free tier — not exclusive to paid tiers (PB §1.3, Q21)","chromium","2026-05-05","passed","2026-05-05","PB: Junior Add-On Model (PB §1.3, §2.3, Q21 — v4.6)","product-bible.spec.ts","",""
"","149","/help returns 200","chromium","2026-05-05","passed","2026-05-05","API: HTTP Status Codes","api.spec.ts","",""
"","6784","Homepage — Cumulative Layout Shift (CLS) < 0.1","chromium","2026-05-05","passed","2026-05-05","Performance: Web Vitals (via Navigation API)","performance.spec.ts","",""
"","15630","Forums page requires login — redirects unauthenticated users (PB §6.6, Q14)","chromium","2026-05-05","failed","2026-05-05","Browse: Authenticated User Flows","browse.spec.ts","",""
"","1794","Discover category navigation links are present","chromium","2026-05-05","passed","2026-05-05","Browse: Discover Screen (PB §6.8)","browse.spec.ts","",""
"","888","Register page renders key elements","chromium","2026-05-05","failed","2026-05-05","Auth: Registration Page UI","auth.spec.ts","",""
"","3485","Junior is NOT presented as a default-included benefit of any tier (PB §1.3, Q21)","mobile-chrome","2026-05-05","passed","2026-05-05","PB: Subscription Tiers in UI (PB §1.3, v4.6)","product-bible.spec.ts","",""
"","2136","Site title contains 'Paygees' (PB header)","mobile-chrome","2026-05-05","passed","2026-05-05","PB: Brand Identity (§10.1, §10.2)","product-bible.spec.ts","",""
"","2491","Author name is visible and clickable (Priority 1 per PB §6.3)","chromium","2026-05-05","failed","2026-05-05","Browse: Book Detail Page (PB §6.3)","browse.spec.ts","",""
"","11978","Homepage has at least one book card visible","chromium","2026-05-05","failed","2026-05-05","Browse: Homepage Sections (PB §6.1)","browse.spec.ts","",""
"","1672","Discover Comics & Illustrations (/discover/comics) returns 200 and loads","chromium","2026-05-05","passed","2026-05-05","Smoke: Public Pages Load","smoke.spec.ts","",""
"","15628","Clicking a book card navigates to book detail page","chromium","2026-05-05","failed","2026-05-05","Browse: Authenticated User Flows","browse.spec.ts","",""
"","166","/admin/users does not expose sensitive data","chromium","2026-05-05","passed","2026-05-05","Security: Admin Route Hardening (PB §11.6)","security.spec.ts","",""
"","1758","Book Detail — Full load within 5s","chromium","2026-05-05","passed","2026-05-05","Performance: Page Load Times","performance.spec.ts","",""
"","2321","Book title is visible (Priority 1 per PB §6.3)","mobile-chrome","2026-05-05","failed","2026-05-05","Browse: Book Detail Page (PB §6.3)","browse.spec.ts","",""
"","1726","Discover Documents & Research (/discover/documents) returns 200 and loads","mobile-chrome","2026-05-05","passed","2026-05-05","Smoke: Public Pages Load","smoke.spec.ts","",""
"","1355","Help Centre (/help) returns 200 and loads","mobile-chrome","2026-05-05","passed","2026-05-05","Smoke: Public Pages Load","smoke.spec.ts","",""
"","1446","/login loads within 5 seconds","mobile-chrome","2026-05-05","passed","2026-05-05","Smoke: Response Times","smoke.spec.ts","",""
"","13740","Discover section includes: Books, Audiobooks, Periodicals, Comics, Documents","mobile-chrome","2026-05-05","failed","2026-05-05","PB: Web Navigation Structure (PB §5.2)","product-bible.spec.ts","",""
"","10649","Homepage has a main landmark","chromium","2026-05-05","failed","2026-05-05","Accessibility: Semantic HTML","accessibility.spec.ts","",""
"","154","/login returns 200","chromium","2026-05-05","passed","2026-05-05","API: HTTP Status Codes","api.spec.ts","",""
"","775","Pick 3 genres flow is present for new users (mandatory per PB)","chromium","2026-05-05","passed","2026-05-05","Auth: Day 1 New User Flow (PB §4.7)","auth.spec.ts","",""
"","1848","Register — Full load within 5s","chromium","2026-05-05","passed","2026-05-05","Performance: Page Load Times","performance.spec.ts","",""
"","1305","About Paygees (/about) returns 200 and loads","mobile-chrome","2026-05-05","passed","2026-05-05","Smoke: Public Pages Load","smoke.spec.ts","",""
"","281","/news returns 200","chromium","2026-05-05","passed","2026-05-05","API: HTTP Status Codes","api.spec.ts","",""
"","743","Login redirect param to external domain is ignored","chromium","2026-05-05","failed","2026-05-05","Security: Open Redirect Prevention","security.spec.ts","",""
"","3463","Login with empty fields shows validation","chromium","2026-05-05","passed","2026-05-05","Auth: Login Page UI","auth.spec.ts","",""
"","2720","Price or Free label is displayed (Priority 2 per PB §6.3)","chromium","2026-05-05","passed","2026-05-05","Browse: Book Detail Page (PB §6.3)","browse.spec.ts","",""
"","934","/discover loads within 5 seconds","mobile-chrome","2026-05-05","passed","2026-05-05","Smoke: Response Times","smoke.spec.ts","",""
"","1069","Forgot password page renders email input and submit","chromium","2026-05-05","failed","2026-05-05","Auth: Forgot Password Flow","auth.spec.ts","",""
"","1816","Age rating is displayed (PB §2.4)","chromium","2026-05-05","failed","2026-05-05","Browse: Book Detail Page (PB §6.3)","browse.spec.ts","",""
"","3444","Discover Books (/discover/books) returns 200 and loads","chromium","2026-05-05","passed","2026-05-05","Smoke: Public Pages Load","smoke.spec.ts","",""
"","15627","Library page shows tabs: In Progress, Favorites, Finished, All My Books (PB §6.2)","chromium","2026-05-05","failed","2026-05-05","Browse: Authenticated User Flows","browse.spec.ts","",""
"","1586","All images have alt text","chromium","2026-05-05","passed","2026-05-05","Accessibility: Semantic HTML","accessibility.spec.ts","",""
"","1348","Privacy Policy (/privacy) returns 200 and loads","mobile-chrome","2026-05-05","passed","2026-05-05","Smoke: Public Pages Load","smoke.spec.ts","",""
"","5441","Bestsellers section is present on homepage","chromium","2026-05-05","failed","2026-05-05","PB: Home Screen Sections (PB §6.1)","product-bible.spec.ts","",""
"","187","Security response headers are present","mobile-chrome","2026-05-05","passed","2026-05-05","Smoke: SSL & Security Headers","smoke.spec.ts","",""
"","11938","Discover page loads and shows content","chromium","2026-05-05","failed","2026-05-05","Browse: Discover Screen (PB §6.8)","browse.spec.ts","",""
"","275","/discover/periodicals returns 200","chromium","2026-05-05","passed","2026-05-05","API: HTTP Status Codes","api.spec.ts","",""
"","3909","Section 'See More' links are present — max 10 per section (PB §6.1)","mobile-chrome","2026-05-05","failed","2026-05-05","PB: Home Screen Sections (PB §6.1)","product-bible.spec.ts","",""
"","1521","Periodicals category page loads without error","chromium","2026-05-05","failed","2026-05-05","Browse: Discover Sub-Categories","browse.spec.ts","",""
"","163","/admin does not expose admin panel (PB §11.6)","chromium","2026-05-05","passed","2026-05-05","API: Admin Route Hardening (PB §11.6)","api.spec.ts","",""
"","16230","Forums page requires login — redirects unauthenticated users (PB §6.6, Q14)","mobile-chrome","2026-05-05","failed","2026-05-05","Browse: Authenticated User Flows","browse.spec.ts","",""
"","1928","Home (/) returns 200 and loads","mobile-chrome","2026-05-05","passed","2026-05-05","Smoke: Public Pages Load","smoke.spec.ts","",""
"","15768","Valid credentials log in and redirect to app","chromium","2026-05-05","failed","2026-05-05","Auth: Successful Login Flow","auth.spec.ts","",""
"","968","Homepage has OG title","chromium","2026-05-05","passed","2026-05-05","SEO: Open Graph Tags","seo.spec.ts","",""
"","296","/ returns 200","chromium","2026-05-05","passed","2026-05-05","API: HTTP Status Codes","api.spec.ts","",""
"","1930","Footer shows payment method logos (PB §5.2)","mobile-chrome","2026-05-05","passed","2026-05-05","PB: Web Navigation Structure (PB §5.2)","product-bible.spec.ts","",""
"","1692","Sign Up (/register) returns 200 and loads","mobile-chrome","2026-05-05","passed","2026-05-05","Smoke: Public Pages Load","smoke.spec.ts","",""
"","286","/discover/comics returns 200","chromium","2026-05-05","passed","2026-05-05","API: HTTP Status Codes","api.spec.ts","",""
"","41","robots.txt is accessible","chromium","2026-05-05","passed","2026-05-05","API: Next.js Infrastructure","api.spec.ts","",""
"","2522","Homepage has a nav landmark","chromium","2026-05-05","passed","2026-05-05","Accessibility: Semantic HTML","accessibility.spec.ts","",""
"","3802","Each book card has a cover image","mobile-chrome","2026-05-05","passed","2026-05-05","Browse: Homepage Sections (PB §6.1)","browse.spec.ts","",""
"","150","/terms returns 200","chromium","2026-05-05","passed","2026-05-05","API: HTTP Status Codes","api.spec.ts","",""
"","1749","Curated section uses 'Editor's Picks' — not 'Staff Picks' or 'Paygees Picks'","chromium","2026-05-05","passed","2026-05-05","PB: Editor's Picks Naming Canonical Rule (PB §6.1)","product-bible.spec.ts","",""
"","12029","Discover page loads and shows content","mobile-chrome","2026-05-05","failed","2026-05-05","Browse: Discover Screen (PB §6.8)","browse.spec.ts","",""
"","2118","Junior is NOT presented as a default-included benefit of any tier (PB §1.3, Q21)","chromium","2026-05-05","passed","2026-05-05","PB: Subscription Tiers in UI (PB §1.3, v4.6)","product-bible.spec.ts","",""
"","3800","Book cards show content type label (Book/Comic/Audiobook)","chromium","2026-05-05","passed","2026-05-05","Browse: Homepage Sections (PB §6.1)","browse.spec.ts","",""
"","1228","Footer contains company and support links (PB §5.2)","chromium","2026-05-05","passed","2026-05-05","PB: Web Navigation Structure (PB §5.2)","product-bible.spec.ts","",""
"","566","Register — DOMContentLoaded within 3s","chromium","2026-05-05","passed","2026-05-05","Performance: Page Load Times","performance.spec.ts","",""
"","2190","Comics category page loads without error","mobile-chrome","2026-05-05","failed","2026-05-05","Browse: Discover Sub-Categories","browse.spec.ts","",""
"","1708","Login — Full load within 5s","chromium","2026-05-05","passed","2026-05-05","Performance: Page Load Times","performance.spec.ts","",""
"","880","/register loads within 5 seconds","chromium","2026-05-05","passed","2026-05-05","Smoke: Response Times","smoke.spec.ts","",""
"","2057","/library is protected — unauthenticated access redirects to login","chromium","2026-05-05","passed","2026-05-05","Security: Auth Protection","security.spec.ts","",""
"","3429","Primary colour #1EAEDB is used — banned #2CB5B5 must not appear (PB §10.2)","chromium","2026-05-05","passed","2026-05-05","PB: Brand Identity (§10.1, §10.2)","product-bible.spec.ts","",""
"","2760","Publisher Dashboard not linked from public homepage (PB §5.3)","mobile-chrome","2026-05-05","passed","2026-05-05","PB: Information Architecture (PB §5.3)","product-bible.spec.ts","",""
"","3962","Homepage renders Bestsellers section","chromium","2026-05-05","passed","2026-05-05","Browse: Homepage Sections (PB §6.1)","browse.spec.ts","",""
"","2141","Title and author displayed (Priority 1)","mobile-chrome","2026-05-05","failed","2026-05-05","PB: Book Detail Page Spec (PB §6.3)","product-bible.spec.ts","",""
"","2006","Books category page loads without error","mobile-chrome","2026-05-05","failed","2026-05-05","Browse: Discover Sub-Categories","browse.spec.ts","",""
"","2707","No EPUB / PDF / MP3 format names appear in UI (PB §10.5)","chromium","2026-05-05","passed","2026-05-05","PB: Home Screen Sections (PB §6.1)","product-bible.spec.ts","",""
"","2869","Submitting forgot password with valid email shows confirmation, not error","chromium","2026-05-05","failed","2026-05-05","Auth: Forgot Password Flow","auth.spec.ts","",""
"","1549","Careers (/careers) returns 200 and loads","mobile-chrome","2026-05-05","passed","2026-05-05","Smoke: Public Pages Load","smoke.spec.ts","",""
"","1528","Author profile pages use /author/ route (PB §6.10)","chromium","2026-05-05","passed","2026-05-05","PB: Author Profile Rules (PB §6.10, Q15, Q16)","product-bible.spec.ts","",""
"","16447","Library page has search within library (PB §6.2)","mobile-chrome","2026-05-05","failed","2026-05-05","Browse: Authenticated User Flows","browse.spec.ts","",""
"","5924","Homepage has correct title tag","chromium","2026-05-05","passed","2026-05-05","SEO: Meta Tags","seo.spec.ts","",""
"","261","/settings without auth returns 200 with login content or redirects","chromium","2026-05-05","passed","2026-05-05","API: Auth-Gated Routes Return Redirect (not 200)","api.spec.ts","",""
"","275","/careers returns 200","chromium","2026-05-05","passed","2026-05-05","API: HTTP Status Codes","api.spec.ts","",""
"","1862","No duplicate page titles across key pages","chromium","2026-05-05","failed","2026-05-05","SEO: Technical SEO","seo.spec.ts","",""
"","2286","Free label appears for free books (PB §1.3)","chromium","2026-05-05","failed","2026-05-05","PB: Book Detail Page Spec (PB §6.3)","product-bible.spec.ts","",""
"","273","/admin/* returns 404 (not a redirect hint) per PB §11.6","mobile-chrome","2026-05-05","passed","2026-05-05","Smoke: Admin Route Hardening","smoke.spec.ts","",""
"","299","/forums returns 200","chromium","2026-05-05","passed","2026-05-05","API: HTTP Status Codes","api.spec.ts","",""
"","1018","Error pages do not expose stack traces","chromium","2026-05-05","passed","2026-05-05","Security: Information Disclosure","security.spec.ts","",""
"","3204","Primary colour #1EAEDB is used — banned #2CB5B5 must not appear (PB §10.2)","mobile-chrome","2026-05-05","passed","2026-05-05","PB: Brand Identity (§10.1, §10.2)","product-bible.spec.ts","",""
"","2575","Homepage does not load excessive JavaScript (< 2MB total)","chromium","2026-05-05","passed","2026-05-05","Performance: Resource Loading","performance.spec.ts","",""
"","1891","Discover category navigation links are present","mobile-chrome","2026-05-05","passed","2026-05-05","Browse: Discover Screen (PB §6.8)","browse.spec.ts","",""
"","1814","Login form is navigable by keyboard","chromium","2026-05-05","failed","2026-05-05","Accessibility: Keyboard Navigation","accessibility.spec.ts","",""
"","1479","Body text is dark on light background (not low contrast)","chromium","2026-05-05","passed","2026-05-05","Accessibility: Colour Contrast","accessibility.spec.ts","",""
"","2393","Forums require login — unauthenticated visitors redirected (login is CTA per PB Q14)","mobile-chrome","2026-05-05","passed","2026-05-05","PB: Forum Access Rules (PB §6.6, Q14)","product-bible.spec.ts","",""
"","188","/privacy returns 200","chromium","2026-05-05","passed","2026-05-05","API: HTTP Status Codes","api.spec.ts","",""
"","223","Register responds within 5 seconds","chromium","2026-05-05","passed","2026-05-05","API: Response Time Benchmarks","api.spec.ts","",""
"","1696","Discover (/discover) returns 200 and loads","mobile-chrome","2026-05-05","passed","2026-05-05","Smoke: Public Pages Load","smoke.spec.ts","",""
"","481","/discover returns 200","chromium","2026-05-05","passed","2026-05-05","API: HTTP Status Codes","api.spec.ts","",""
"","15555","Login page has noindex or appropriate meta (auth pages shouldn't be indexed)","chromium","2026-05-05","failed","2026-05-05","SEO: Meta Tags","seo.spec.ts","",""
"","3611","Homepage renders Bestsellers section","mobile-chrome","2026-05-05","passed","2026-05-05","Browse: Homepage Sections (PB §6.1)","browse.spec.ts","",""
"","13530","Top navigation includes: Home, Library, News, Events, Forums","mobile-chrome","2026-05-05","failed","2026-05-05","PB: Web Navigation Structure (PB §5.2)","product-bible.spec.ts","",""
"","3541","Homepage — Full load within 5s","chromium","2026-05-05","passed","2026-05-05","Performance: Page Load Times","performance.spec.ts","",""
"","141","Homepage responds within 5 seconds","chromium","2026-05-05","passed","2026-05-05","API: Response Time Benchmarks","api.spec.ts","",""
"","1617","Forums (/forums) returns 200 and loads","chromium","2026-05-05","passed","2026-05-05","Smoke: Public Pages Load","smoke.spec.ts","",""
"","1728","Forgot Password (/forgot-password) returns 200 and loads","chromium","2026-05-05","passed","2026-05-05","Smoke: Public Pages Load","smoke.spec.ts","",""
"","156","Homepage includes content security or transport headers","chromium","2026-05-05","passed","2026-05-05","API: Security Headers","api.spec.ts","",""
"","1800","Log In (/login) returns 200 and loads","mobile-chrome","2026-05-05","passed","2026-05-05","Smoke: Public Pages Load","smoke.spec.ts","",""
"","4780","R2 signed URLs on homepage load successfully","chromium","2026-05-05","passed","2026-05-05","API: Cloudflare R2 Image Delivery","api.spec.ts","",""
"","2607","Junior add-on available to Free tier — not exclusive to paid tiers (PB §1.3, Q21)","mobile-chrome","2026-05-05","passed","2026-05-05","PB: Junior Add-On Model (PB §1.3, §2.3, Q21 — v4.6)","product-bible.spec.ts","",""
"","910","/library redirects unauthenticated user to /login","mobile-chrome","2026-05-05","passed","2026-05-05","Smoke: Auth-Gated Routes Redirect","smoke.spec.ts","",""
"","4780","Tagline 'Affordable | Accessible | Available' is present (PB §4.1)","chromium","2026-05-05","passed","2026-05-05","PB: Brand Identity (§10.1, §10.2)","product-bible.spec.ts","",""
"","1905","Pricing page (if exists) shows the 4 main tiers: Free, Basic, Standard, Premium","mobile-chrome","2026-05-05","failed","2026-05-05","PB: Subscription Tiers in UI (PB §1.3, v4.6)","product-bible.spec.ts","",""
"","1829","Terms of Service (/terms) returns 200 and loads","chromium","2026-05-05","passed","2026-05-05","Smoke: Public Pages Load","smoke.spec.ts","",""
"","15686","Login with wrong credentials shows error, not 500","chromium","2026-05-05","failed","2026-05-05","Auth: Login Page UI","auth.spec.ts","",""
"","15790","Logged-in Free user can access forums (PB Q14 — read + reply access)","mobile-chrome","2026-05-05","failed","2026-05-05","PB: Forum Access Rules (PB §6.6, Q14)","product-bible.spec.ts","",""
"","1583","Admin routes not linked from main site (PB §5.3, §11.6)","chromium","2026-05-05","passed","2026-05-05","PB: Information Architecture (PB §5.3)","product-bible.spec.ts","",""
"","4884","Homepage — Largest Contentful Paint (LCP) < 4s","chromium","2026-05-05","passed","2026-05-05","Performance: Web Vitals (via Navigation API)","performance.spec.ts","",""
"","2790","Logo reads 'PAYGEES' (PB §10.1)","chromium","2026-05-05","passed","2026-05-05","PB: Brand Identity (§10.1, §10.2)","product-bible.spec.ts","",""
"","1681","Age rating is displayed (PB §2.4)","mobile-chrome","2026-05-05","failed","2026-05-05","Browse: Book Detail Page (PB §6.3)","browse.spec.ts","",""
"","2295","Forums page does not return a 500 error","chromium","2026-05-05","failed","2026-05-05","PB: Forum Access Rules (PB §6.6, Q14)","product-bible.spec.ts","",""
"","2124","Logged-out users see marketing/landing content on homepage","mobile-chrome","2026-05-05","passed","2026-05-05","PB: Information Architecture (PB §5.3)","product-bible.spec.ts","",""
"","303","/wp-admin does not expose admin panel (PB §11.6)","chromium","2026-05-05","passed","2026-05-05","API: Admin Route Hardening (PB §11.6)","api.spec.ts","",""
"","1485","HTTP redirects to HTTPS","mobile-chrome","2026-05-05","passed","2026-05-05","Smoke: SSL & Security Headers","smoke.spec.ts","",""
"","796","/login loads within 5 seconds","chromium","2026-05-05","passed","2026-05-05","Smoke: Response Times","smoke.spec.ts","",""
"","914","/settings redirects unauthenticated user to /login","mobile-chrome","2026-05-05","passed","2026-05-05","Smoke: Auth-Gated Routes Redirect","smoke.spec.ts","",""
"","1982","Footer contains copyright notice for The Book Crunch Limited","mobile-chrome","2026-05-05","passed","2026-05-05","PB: Web Navigation Structure (PB §5.2)","product-bible.spec.ts","",""
"","1694","Register with invalid email shows validation","chromium","2026-05-05","passed","2026-05-05","Auth: Registration Page UI","auth.spec.ts","",""
"","1775","Cover image is large and prominent (Priority 1)","chromium","2026-05-05","passed","2026-05-05","PB: Book Detail Page Spec (PB §6.3)","product-bible.spec.ts","",""
"","1647","Content type shown as icon/label — NOT file format (PB §6.3, §10.5)","chromium","2026-05-05","passed","2026-05-05","Browse: Book Detail Page (PB §6.3)","browse.spec.ts","",""
"","2537","Homepage — DOMContentLoaded within 3s","chromium","2026-05-05","passed","2026-05-05","Performance: Page Load Times","performance.spec.ts","",""
"","353","/admin/* returns 404 (not a redirect hint) per PB §11.6","chromium","2026-05-05","passed","2026-05-05","Smoke: Admin Route Hardening","smoke.spec.ts","",""
