"DESCRIPTION","DURATION IN MS","NAME","PARENT SUITE","START TIME","STATUS","STOP TIME","SUB SUITE","SUITE","TEST CLASS","TEST METHOD"
"","1639","Contact Us (/contact) returns 200 and loads","mobile-chrome","2026-03-21","passed","2026-03-21","Smoke: Public Pages Load","smoke.spec.ts","",""
"","871","Clicking a book card navigates to book detail page","chromium","2026-03-21","failed","2026-03-21","Browse: Authenticated User Flows","browse.spec.ts","",""
"","1386","Free label appears for free books (PB §1.3)","chromium","2026-03-21","passed","2026-03-21","PB: Book Detail Page Spec (PB §6.3)","product-bible.spec.ts","",""
"","204","Homepage includes content security or transport headers","chromium","2026-03-21","passed","2026-03-21","API: Security Headers","api.spec.ts","",""
"","97","/admin/login does not expose admin panel (PB §11.6)","chromium","2026-03-21","passed","2026-03-21","API: Admin Route Hardening (PB §11.6)","api.spec.ts","",""
"","429","Login — DOMContentLoaded within 3s","chromium","2026-03-21","passed","2026-03-21","Performance: Page Load Times","performance.spec.ts","",""
"","2582","Author name is visible and clickable (Priority 1 per PB §6.3)","mobile-chrome","2026-03-21","passed","2026-03-21","Browse: Book Detail Page (PB §6.3)","browse.spec.ts","",""
"","3889","Home (/) returns 200 and loads","chromium","2026-03-21","passed","2026-03-21","Smoke: Public Pages Load","smoke.spec.ts","",""
"","2024","Forums require login — unauthenticated visitors redirected (login is CTA per PB Q14)","mobile-chrome","2026-03-21","failed","2026-03-21","PB: Forum Access Rules (PB §6.6, Q14)","product-bible.spec.ts","",""
"","765","Logged-in Free user can access forums (PB Q14 — read + reply access)","chromium","2026-03-21","failed","2026-03-21","PB: Forum Access Rules (PB §6.6, Q14)","product-bible.spec.ts","",""
"","15683","Login page has noindex or appropriate meta (auth pages shouldn't be indexed)","chromium","2026-03-21","failed","2026-03-21","SEO: Meta Tags","seo.spec.ts","",""
"","1636","Footer contains company and support links (PB §5.2)","chromium","2026-03-21","passed","2026-03-21","PB: Web Navigation Structure (PB §5.2)","product-bible.spec.ts","",""
"","1448","Footer shows payment method logos (PB §5.2)","chromium","2026-03-21","passed","2026-03-21","PB: Web Navigation Structure (PB §5.2)","product-bible.spec.ts","",""
"","2038","Curated section uses 'Editor's Picks' — not 'Staff Picks' or 'Paygees Picks'","mobile-chrome","2026-03-21","passed","2026-03-21","PB: Editor's Picks Naming Canonical Rule (PB §6.1)","product-bible.spec.ts","",""
"","485","/contact returns 200","chromium","2026-03-21","passed","2026-03-21","API: HTTP Status Codes","api.spec.ts","",""
"","93","/terms returns 200","chromium","2026-03-21","passed","2026-03-21","API: HTTP Status Codes","api.spec.ts","",""
"","2204","Periodicals category page loads without error","mobile-chrome","2026-03-21","failed","2026-03-21","Browse: Discover Sub-Categories","browse.spec.ts","",""
"","1740","Site serves over HTTPS","mobile-chrome","2026-03-21","passed","2026-03-21","Smoke: SSL & Security Headers","smoke.spec.ts","",""
"","1394","Valid credentials log in and redirect to app","chromium","2026-03-21","failed","2026-03-21","Auth: Successful Login Flow","auth.spec.ts","",""
"","311","Response headers do not expose server technology details","chromium","2026-03-21","passed","2026-03-21","Security: Information Disclosure","security.spec.ts","",""
"","2381","Book title is visible (Priority 1 per PB §6.3)","mobile-chrome","2026-03-21","passed","2026-03-21","Browse: Book Detail Page (PB §6.3)","browse.spec.ts","",""
"","3134","Homepage has a main landmark","chromium","2026-03-21","passed","2026-03-21","Accessibility: Semantic HTML","accessibility.spec.ts","",""
"","2037","Discover category navigation links are present","mobile-chrome","2026-03-21","passed","2026-03-21","Browse: Discover Screen (PB §6.8)","browse.spec.ts","",""
"","10554","/forums redirects unauthenticated user to /login","chromium","2026-03-21","failed","2026-03-21","Smoke: Auth-Gated Routes Redirect","smoke.spec.ts","",""
"","1311","Register — Full load within 5s","chromium","2026-03-21","passed","2026-03-21","Performance: Page Load Times","performance.spec.ts","",""
"","763","/discover loads within 5 seconds","mobile-chrome","2026-03-21","passed","2026-03-21","Smoke: Response Times","smoke.spec.ts","",""
"","1550","Section 'See More' links are present — max 10 per section (PB §6.1)","chromium","2026-03-21","passed","2026-03-21","PB: Home Screen Sections (PB §6.1)","product-bible.spec.ts","",""
"","10660","/forums redirects unauthenticated user to /login","mobile-chrome","2026-03-21","failed","2026-03-21","Smoke: Auth-Gated Routes Redirect","smoke.spec.ts","",""
"","2227","Content type shown as icon/label — NOT file format (PB §6.3, §10.5)","chromium","2026-03-21","failed","2026-03-21","Browse: Book Detail Page (PB §6.3)","browse.spec.ts","",""
"","15881","Homepage has OG description","chromium","2026-03-21","failed","2026-03-21","SEO: Open Graph Tags","seo.spec.ts","",""
"","99","/news returns 200","chromium","2026-03-21","passed","2026-03-21","API: HTTP Status Codes","api.spec.ts","",""
"","1650","Login — Full load within 5s","chromium","2026-03-21","passed","2026-03-21","Performance: Page Load Times","performance.spec.ts","",""
"","913","Site serves over HTTPS","chromium","2026-03-21","passed","2026-03-21","Smoke: SSL & Security Headers","smoke.spec.ts","",""
"","826","Pick 3 genres flow is present for new users (mandatory per PB)","chromium","2026-03-21","passed","2026-03-21","Auth: Day 1 New User Flow (PB §4.7)","auth.spec.ts","",""
"","3032","Navigation links are focusable with Tab","chromium","2026-03-21","passed","2026-03-21","Accessibility: Keyboard Navigation","accessibility.spec.ts","",""
"","296","/forums without auth returns 200 with login content or redirects","chromium","2026-03-21","failed","2026-03-21","API: Auth-Gated Routes Return Redirect (not 200)","api.spec.ts","",""
"","1612","Cover image is large and prominent (Priority 1 per PB §6.3)","chromium","2026-03-21","passed","2026-03-21","Browse: Book Detail Page (PB §6.3)","browse.spec.ts","",""
"","1465","Careers (/careers) returns 200 and loads","chromium","2026-03-21","passed","2026-03-21","Smoke: Public Pages Load","smoke.spec.ts","",""
"","33","favicon is served","chromium","2026-03-21","passed","2026-03-21","API: Next.js Infrastructure","api.spec.ts","",""
"","1714","Sections use 'See More' / 'View All' links per PB §6.1 (max 10 per section)","chromium","2026-03-21","passed","2026-03-21","Browse: Homepage Sections (PB §6.1)","browse.spec.ts","",""
"","35","robots.txt is accessible","chromium","2026-03-21","passed","2026-03-21","API: Next.js Infrastructure","api.spec.ts","",""
"","2764","No 500 errors on any public page","chromium","2026-03-21","passed","2026-03-21","API: Next.js Infrastructure","api.spec.ts","",""
"","1404","Terms of Service (/terms) returns 200 and loads","mobile-chrome","2026-03-21","passed","2026-03-21","Smoke: Public Pages Load","smoke.spec.ts","",""
"","1779","Comics category page loads without error","mobile-chrome","2026-03-21","failed","2026-03-21","Browse: Discover Sub-Categories","browse.spec.ts","",""
"","1919","Forums (/forums) returns 200 and loads","mobile-chrome","2026-03-21","passed","2026-03-21","Smoke: Public Pages Load","smoke.spec.ts","",""
"","840","Login form inputs have labels","chromium","2026-03-21","passed","2026-03-21","Accessibility: Semantic HTML","accessibility.spec.ts","",""
"","1500","News (/news) returns 200 and loads","chromium","2026-03-21","passed","2026-03-21","Smoke: Public Pages Load","smoke.spec.ts","",""
"","932","HTTP redirects to HTTPS","chromium","2026-03-21","passed","2026-03-21","Smoke: SSL & Security Headers","smoke.spec.ts","",""
"","2174","Home (/) returns 200 and loads","mobile-chrome","2026-03-21","passed","2026-03-21","Smoke: Public Pages Load","smoke.spec.ts","",""
"","16964","Book detail page has OG tags with book info","chromium","2026-03-21","failed","2026-03-21","SEO: Open Graph Tags","seo.spec.ts","",""
"","1832","Help Centre (/help) returns 200 and loads","mobile-chrome","2026-03-21","passed","2026-03-21","Smoke: Public Pages Load","smoke.spec.ts","",""
"","1438","Discover Periodicals (/discover/periodicals) returns 200 and loads","chromium","2026-03-21","passed","2026-03-21","Smoke: Public Pages Load","smoke.spec.ts","",""
"","1487","Preview/Sample button present (Priority 2 per PB §6.3 and §3.9)","chromium","2026-03-21","passed","2026-03-21","Browse: Book Detail Page (PB §6.3)","browse.spec.ts","",""
"","166","/admin/* returns 404 (not a redirect hint) per PB §11.6","mobile-chrome","2026-03-21","passed","2026-03-21","Smoke: Admin Route Hardening","smoke.spec.ts","",""
"","2045","Footer shows payment method logos (PB §5.2)","mobile-chrome","2026-03-21","passed","2026-03-21","PB: Web Navigation Structure (PB §5.2)","product-bible.spec.ts","",""
"","75","/login returns 200","chromium","2026-03-21","passed","2026-03-21","API: HTTP Status Codes","api.spec.ts","",""
"","643","/settings redirects unauthenticated user to /login","mobile-chrome","2026-03-21","passed","2026-03-21","Smoke: Auth-Gated Routes Redirect","smoke.spec.ts","",""
"","1606","Press (/press) returns 200 and loads","mobile-chrome","2026-03-21","passed","2026-03-21","Smoke: Public Pages Load","smoke.spec.ts","",""
"","4444","Primary colour #1EAEDB is used — banned #2CB5B5 must not appear (PB §10.2)","chromium","2026-03-21","passed","2026-03-21","PB: Brand Identity (§10.1, §10.2)","product-bible.spec.ts","",""
"","1665","About Paygees (/about) returns 200 and loads","chromium","2026-03-21","passed","2026-03-21","Smoke: Public Pages Load","smoke.spec.ts","",""
"","2763","Book cards show content type label (Book/Comic/Audiobook)","chromium","2026-03-21","passed","2026-03-21","Browse: Homepage Sections (PB §6.1)","browse.spec.ts","",""
"","835","No 'Publisher Profile' page — Publisher is internal-only (PB Q16)","chromium","2026-03-21","passed","2026-03-21","PB: Author Profile Rules (PB §6.10, Q15, Q16)","product-bible.spec.ts","",""
"","3025","Homepage has a nav landmark","chromium","2026-03-21","passed","2026-03-21","Accessibility: Semantic HTML","accessibility.spec.ts","",""
"","1561","Books category page loads without error","mobile-chrome","2026-03-21","failed","2026-03-21","Browse: Discover Sub-Categories","browse.spec.ts","",""
"","1641","Homepage has a meta description","chromium","2026-03-21","passed","2026-03-21","SEO: Meta Tags","seo.spec.ts","",""
"","1648","Price or Free label is displayed (Priority 2 per PB §6.3)","chromium","2026-03-21","passed","2026-03-21","Browse: Book Detail Page (PB §6.3)","browse.spec.ts","",""
"","900","Register page renders key elements","chromium","2026-03-21","failed","2026-03-21","Auth: Registration Page UI","auth.spec.ts","",""
"","2189","Homepage contains 'Discover More' or equivalent CTA","mobile-chrome","2026-03-21","passed","2026-03-21","Browse: Homepage Sections (PB §6.1)","browse.spec.ts","",""
"","1260","Logged-in Free user can access forums (PB Q14 — read + reply access)","mobile-chrome","2026-03-21","failed","2026-03-21","PB: Forum Access Rules (PB §6.6, Q14)","product-bible.spec.ts","",""
"","1458","Coral #E8735A used for section headers only — not CTA button fills (PB §10.2)","chromium","2026-03-21","passed","2026-03-21","PB: Home Screen Sections (PB §6.1)","product-bible.spec.ts","",""
"","3607","Logo reads 'PAYGEES' (PB §10.1)","chromium","2026-03-21","passed","2026-03-21","PB: Brand Identity (§10.1, §10.2)","product-bible.spec.ts","",""
"","524","/library redirects unauthenticated user to /login","mobile-chrome","2026-03-21","passed","2026-03-21","Smoke: Auth-Gated Routes Redirect","smoke.spec.ts","",""
"","2098","Free label appears for free books (PB §1.3)","mobile-chrome","2026-03-21","passed","2026-03-21","PB: Book Detail Page Spec (PB §6.3)","product-bible.spec.ts","",""
"","805","/ loads within 5 seconds","chromium","2026-03-21","passed","2026-03-21","Smoke: Response Times","smoke.spec.ts","",""
"","2859","Discover Audiobooks (/discover/audiobooks) returns 200 and loads","mobile-chrome","2026-03-21","passed","2026-03-21","Smoke: Public Pages Load","smoke.spec.ts","",""
"","2151","Logged-out users see marketing/landing content on homepage","mobile-chrome","2026-03-21","passed","2026-03-21","PB: Information Architecture (PB §5.3)","product-bible.spec.ts","",""
"","1701","Homepage has correct title tag","chromium","2026-03-21","passed","2026-03-21","SEO: Meta Tags","seo.spec.ts","",""
"","3200","Discover Audiobooks (/discover/audiobooks) returns 200 and loads","chromium","2026-03-21","passed","2026-03-21","Smoke: Public Pages Load","smoke.spec.ts","",""
"","608","Login form is navigable by keyboard","chromium","2026-03-21","failed","2026-03-21","Accessibility: Keyboard Navigation","accessibility.spec.ts","",""
"","3014","Submitting forgot password with valid email shows confirmation, not error","chromium","2026-03-21","failed","2026-03-21","Auth: Forgot Password Flow","auth.spec.ts","",""
"","319","/careers returns 200","chromium","2026-03-21","passed","2026-03-21","API: HTTP Status Codes","api.spec.ts","",""
"","327","/admin does not expose sensitive data","chromium","2026-03-21","passed","2026-03-21","Security: Admin Route Hardening (PB §11.6)","security.spec.ts","",""
"","348","robots.txt is present and allows crawling","chromium","2026-03-21","passed","2026-03-21","SEO: Technical SEO","seo.spec.ts","",""
"","2310","Author name is visible and clickable (Priority 1 per PB §6.3)","chromium","2026-03-21","failed","2026-03-21","Browse: Book Detail Page (PB §6.3)","browse.spec.ts","",""
"","1585","Top navigation includes: Home, Library, News, Events, Forums","chromium","2026-03-21","passed","2026-03-21","PB: Web Navigation Structure (PB §5.2)","product-bible.spec.ts","",""
"","4695","Homepage — Largest Contentful Paint (LCP) < 4s","chromium","2026-03-21","passed","2026-03-21","Performance: Web Vitals (via Navigation API)","performance.spec.ts","",""
"","176","/forums returns 200","chromium","2026-03-21","passed","2026-03-21","API: HTTP Status Codes","api.spec.ts","",""
"","1152","Library page has search within library (PB §6.2)","chromium","2026-03-21","failed","2026-03-21","Browse: Authenticated User Flows","browse.spec.ts","",""
"","1503","'Junior' terminology used — not 'Kids' or 'Children' (PB §1.3)","chromium","2026-03-21","passed","2026-03-21","PB: Subscription Tiers in UI (PB §1.3, v4.6)","product-bible.spec.ts","",""
"","2658","File format names do NOT appear — never show EPUB/PDF/MP3 (PB §6.3)","mobile-chrome","2026-03-21","failed","2026-03-21","PB: Book Detail Page Spec (PB §6.3)","product-bible.spec.ts","",""
"","1561","Blog (/blog) returns 200 and loads","chromium","2026-03-21","passed","2026-03-21","Smoke: Public Pages Load","smoke.spec.ts","",""
"","4456","Tagline 'Affordable | Accessible | Available' is present (PB §4.1)","chromium","2026-03-21","passed","2026-03-21","PB: Brand Identity (§10.1, §10.2)","product-bible.spec.ts","",""
"","1919","Footer contains copyright notice for The Book Crunch Limited","mobile-chrome","2026-03-21","passed","2026-03-21","PB: Web Navigation Structure (PB §5.2)","product-bible.spec.ts","",""
"","284","/press returns 200","chromium","2026-03-21","passed","2026-03-21","API: HTTP Status Codes","api.spec.ts","",""
"","2196","Discover Periodicals (/discover/periodicals) returns 200 and loads","mobile-chrome","2026-03-21","passed","2026-03-21","Smoke: Public Pages Load","smoke.spec.ts","",""
"","15883","Homepage has a canonical URL","chromium","2026-03-21","failed","2026-03-21","SEO: Canonical URLs","seo.spec.ts","",""
"","2038","Admin routes not linked from main site (PB §5.3, §11.6)","chromium","2026-03-21","passed","2026-03-21","PB: Information Architecture (PB §5.3)","product-bible.spec.ts","",""
"","1209","Forgot password page renders email input and submit","chromium","2026-03-21","failed","2026-03-21","Auth: Forgot Password Flow","auth.spec.ts","",""
"","760","Page has exactly one h1 tag","chromium","2026-03-21","failed","2026-03-21","Accessibility: Semantic HTML","accessibility.spec.ts","",""
"","2012","Primary colour #1EAEDB is used — banned #2CB5B5 must not appear (PB §10.2)","mobile-chrome","2026-03-21","passed","2026-03-21","PB: Brand Identity (§10.1, §10.2)","product-bible.spec.ts","",""
"","6752","Homepage — Cumulative Layout Shift (CLS) < 0.1","chromium","2026-03-21","passed","2026-03-21","Performance: Web Vitals (via Navigation API)","performance.spec.ts","",""
"","1583","Logged-out users see marketing/landing content on homepage","chromium","2026-03-21","passed","2026-03-21","PB: Information Architecture (PB §5.3)","product-bible.spec.ts","",""
"","1927","Footer contains company and support links (PB §5.2)","mobile-chrome","2026-03-21","passed","2026-03-21","PB: Web Navigation Structure (PB §5.2)","product-bible.spec.ts","",""
"","2198","Junior is NOT presented as a default-included benefit of any tier (PB §1.3, Q21)","mobile-chrome","2026-03-21","passed","2026-03-21","PB: Subscription Tiers in UI (PB §1.3, v4.6)","product-bible.spec.ts","",""
"","1857","Guardian Dashboard is not linked to logged-out users (PB §5.3)","chromium","2026-03-21","passed","2026-03-21","PB: Junior Add-On Model (PB §1.3, §2.3, Q21 — v4.6)","product-bible.spec.ts","",""
"","1664","Register with invalid email shows validation","chromium","2026-03-21","passed","2026-03-21","Auth: Registration Page UI","auth.spec.ts","",""
"","1399","Terms of Service (/terms) returns 200 and loads","chromium","2026-03-21","passed","2026-03-21","Smoke: Public Pages Load","smoke.spec.ts","",""
"","1527","Library page has search within library (PB §6.2)","mobile-chrome","2026-03-21","failed","2026-03-21","Browse: Authenticated User Flows","browse.spec.ts","",""
"","571","/login loads within 5 seconds","mobile-chrome","2026-03-21","passed","2026-03-21","Smoke: Response Times","smoke.spec.ts","",""
"","1518","Homepage — First Contentful Paint (FCP) < 3s","chromium","2026-03-21","passed","2026-03-21","Performance: Web Vitals (via Navigation API)","performance.spec.ts","",""
"","107","/discover/documents returns 200","chromium","2026-03-21","passed","2026-03-21","API: HTTP Status Codes","api.spec.ts","",""
"","1921","Book title is visible (Priority 1 per PB §6.3)","chromium","2026-03-21","passed","2026-03-21","Browse: Book Detail Page (PB §6.3)","browse.spec.ts","",""
"","2163","Discover — DOMContentLoaded within 3s","chromium","2026-03-21","passed","2026-03-21","Performance: Page Load Times","performance.spec.ts","",""
"","2590","Audiobooks category page loads without error","mobile-chrome","2026-03-21","failed","2026-03-21","Browse: Discover Sub-Categories","browse.spec.ts","",""
"","690","Homepage loads on simulated slow 3G (African market priority — PB §4.5)","chromium","2026-03-21","passed","2026-03-21","Performance: Resource Loading","performance.spec.ts","",""
"","1696","Book Detail — Full load within 5s","chromium","2026-03-21","passed","2026-03-21","Performance: Page Load Times","performance.spec.ts","",""
"","1359","Bestsellers section is present on homepage","chromium","2026-03-21","passed","2026-03-21","PB: Home Screen Sections (PB §6.1)","product-bible.spec.ts","",""
"","655","/discover loads within 5 seconds","chromium","2026-03-21","passed","2026-03-21","Smoke: Response Times","smoke.spec.ts","",""
"","1261","Sign up link navigates to /register","chromium","2026-03-21","passed","2026-03-21","Auth: Login Page UI","auth.spec.ts","",""
"","1345","Forgot password link navigates to /forgot-password","chromium","2026-03-21","passed","2026-03-21","Auth: Login Page UI","auth.spec.ts","",""
"","1637","Age rating is displayed (PB §2.4)","chromium","2026-03-21","passed","2026-03-21","Browse: Book Detail Page (PB §6.3)","browse.spec.ts","",""
"","914","Login page includes Terms & Conditions and Privacy Policy links","chromium","2026-03-21","failed","2026-03-21","Auth: Login Page UI","auth.spec.ts","",""
"","148","/discover/periodicals returns 200","chromium","2026-03-21","passed","2026-03-21","API: HTTP Status Codes","api.spec.ts","",""
"","1343","Sign Up (/register) returns 200 and loads","chromium","2026-03-21","passed","2026-03-21","Smoke: Public Pages Load","smoke.spec.ts","",""
"","1702","About Paygees (/about) returns 200 and loads","mobile-chrome","2026-03-21","passed","2026-03-21","Smoke: Public Pages Load","smoke.spec.ts","",""
"","616","Register page includes T&C consent text per PB","chromium","2026-03-21","passed","2026-03-21","Auth: Registration Page UI","auth.spec.ts","",""
"","110","/api/admin does not expose sensitive data","chromium","2026-03-21","passed","2026-03-21","Security: Admin Route Hardening (PB §11.6)","security.spec.ts","",""
"","1887","Discover Documents & Research (/discover/documents) returns 200 and loads","mobile-chrome","2026-03-21","passed","2026-03-21","Smoke: Public Pages Load","smoke.spec.ts","",""
"","2234","Age rating is displayed (PB §2.4)","mobile-chrome","2026-03-21","passed","2026-03-21","Browse: Book Detail Page (PB §6.3)","browse.spec.ts","",""
"","2101","Discover page loads and shows content","mobile-chrome","2026-03-21","passed","2026-03-21","Browse: Discover Screen (PB §6.8)","browse.spec.ts","",""
"","3791","Discover (/discover) returns 200 and loads","chromium","2026-03-21","passed","2026-03-21","Smoke: Public Pages Load","smoke.spec.ts","",""
"","2527","Homepage does not load excessive JavaScript (< 2MB total)","chromium","2026-03-21","passed","2026-03-21","Performance: Resource Loading","performance.spec.ts","",""
"","535","Security response headers are present","chromium","2026-03-21","passed","2026-03-21","Smoke: SSL & Security Headers","smoke.spec.ts","",""
"","3503","Homepage renders Bestsellers section","mobile-chrome","2026-03-21","passed","2026-03-21","Browse: Homepage Sections (PB §6.1)","browse.spec.ts","",""
"","745","Forums page requires login — redirects unauthenticated users (PB §6.6, Q14)","chromium","2026-03-21","failed","2026-03-21","Browse: Authenticated User Flows","browse.spec.ts","",""
"","1885","Homepage book cover images load from R2","chromium","2026-03-21","passed","2026-03-21","Smoke: Image Delivery (Cloudflare R2)","smoke.spec.ts","",""
"","1972","Coral #E8735A used for section headers only — not CTA button fills (PB §10.2)","mobile-chrome","2026-03-21","passed","2026-03-21","PB: Home Screen Sections (PB §6.1)","product-bible.spec.ts","",""
"","84","Login responds within 5 seconds","chromium","2026-03-21","passed","2026-03-21","API: Response Time Benchmarks","api.spec.ts","",""
"","2256","Junior is not presented as a comparable standalone subscription tier","mobile-chrome","2026-03-21","passed","2026-03-21","PB: Junior Add-On Model (PB §1.3, §2.3, Q21 — v4.6)","product-bible.spec.ts","",""
"","1751","Curated section uses 'Editor's Picks' — not 'Staff Picks' or 'Paygees Picks'","chromium","2026-03-21","passed","2026-03-21","PB: Editor's Picks Naming Canonical Rule (PB §6.1)","product-bible.spec.ts","",""
"","15980","Homepage has OG image","chromium","2026-03-21","failed","2026-03-21","SEO: Open Graph Tags","seo.spec.ts","",""
"","1917","Events (/events) returns 200 and loads","mobile-chrome","2026-03-21","passed","2026-03-21","Smoke: Public Pages Load","smoke.spec.ts","",""
"","1124","Sign Out is in profile dropdown only — not in top bar directly (PB §5.2)","mobile-chrome","2026-03-21","failed","2026-03-21","PB: Information Architecture (PB §5.3)","product-bible.spec.ts","",""
"","186","/cms does not expose admin panel (PB §11.6)","chromium","2026-03-21","passed","2026-03-21","API: Admin Route Hardening (PB §11.6)","api.spec.ts","",""
"","239","sitemap.xml is valid XML if present","chromium","2026-03-21","passed","2026-03-21","SEO: Technical SEO","seo.spec.ts","",""
"","1640","Discover category navigation links are present","chromium","2026-03-21","passed","2026-03-21","Browse: Discover Screen (PB §6.8)","browse.spec.ts","",""
"","1541","'Creator' term does not appear in UI — banned platform-wide per PB Q16","chromium","2026-03-21","passed","2026-03-21","PB: Brand Identity (§10.1, §10.2)","product-bible.spec.ts","",""
"","2288","Tagline 'Affordable | Accessible | Available' is present (PB §4.1)","mobile-chrome","2026-03-21","passed","2026-03-21","PB: Brand Identity (§10.1, §10.2)","product-bible.spec.ts","",""
"","85","/register returns 200","chromium","2026-03-21","passed","2026-03-21","API: HTTP Status Codes","api.spec.ts","",""
"","1503","Discover Comics & Illustrations (/discover/comics) returns 200 and loads","chromium","2026-03-21","passed","2026-03-21","Smoke: Public Pages Load","smoke.spec.ts","",""
"","2233","'Creator' term does not appear in UI — banned platform-wide per PB Q16","mobile-chrome","2026-03-21","passed","2026-03-21","PB: Brand Identity (§10.1, §10.2)","product-bible.spec.ts","",""
"","90","/.env does not expose sensitive data","chromium","2026-03-21","passed","2026-03-21","Security: Admin Route Hardening (PB §11.6)","security.spec.ts","",""
"","1992","All images have alt text","chromium","2026-03-21","passed","2026-03-21","Accessibility: Semantic HTML","accessibility.spec.ts","",""
"","2263","Homepage — DOMContentLoaded within 3s","chromium","2026-03-21","passed","2026-03-21","Performance: Page Load Times","performance.spec.ts","",""
"","1814","Cover image is large and prominent (Priority 1)","mobile-chrome","2026-03-21","passed","2026-03-21","PB: Book Detail Page Spec (PB §6.3)","product-bible.spec.ts","",""
"","1544","Forgot Password (/forgot-password) returns 200 and loads","chromium","2026-03-21","passed","2026-03-21","Smoke: Public Pages Load","smoke.spec.ts","",""
