"DESCRIPTION","DURATION IN MS","NAME","PARENT SUITE","START TIME","STATUS","STOP TIME","SUB SUITE","SUITE","TEST CLASS","TEST METHOD"
"","1989","Junior is NOT presented as a default-included benefit of any tier (PB §1.3, Q21)","chromium","2026-04-26","passed","2026-04-26","PB: Subscription Tiers in UI (PB §1.3, v4.6)","product-bible.spec.ts","",""
"","998","Sign up link navigates to /register","chromium","2026-04-26","passed","2026-04-26","Auth: Login Page UI","auth.spec.ts","",""
"","953","Login form is navigable by keyboard","chromium","2026-04-26","failed","2026-04-26","Accessibility: Keyboard Navigation","accessibility.spec.ts","",""
"","778","HTTP redirects to HTTPS","chromium","2026-04-26","passed","2026-04-26","Smoke: SSL & Security Headers","smoke.spec.ts","",""
"","431","/news returns 200","chromium","2026-04-26","passed","2026-04-26","API: HTTP Status Codes","api.spec.ts","",""
"","2127","Discover category navigation links are present","mobile-chrome","2026-04-26","passed","2026-04-26","Browse: Discover Screen (PB §6.8)","browse.spec.ts","",""
"","2963","Curated section uses 'Editor's Picks' — not 'Staff Picks' or 'Paygees Picks'","mobile-chrome","2026-04-26","passed","2026-04-26","PB: Editor's Picks Naming Canonical Rule (PB §6.1)","product-bible.spec.ts","",""
"","16316","Clicking a book card navigates to book detail page","mobile-chrome","2026-04-26","failed","2026-04-26","Browse: Authenticated User Flows","browse.spec.ts","",""
"","16087","Library page has search within library (PB §6.2)","mobile-chrome","2026-04-26","failed","2026-04-26","Browse: Authenticated User Flows","browse.spec.ts","",""
"","92","/.env.local does not expose sensitive data","chromium","2026-04-26","passed","2026-04-26","Security: Admin Route Hardening (PB §11.6)","security.spec.ts","",""
"","3316","Home (/) returns 200 and loads","chromium","2026-04-26","passed","2026-04-26","Smoke: Public Pages Load","smoke.spec.ts","",""
"","423","/discover/audiobooks returns 200","chromium","2026-04-26","passed","2026-04-26","API: HTTP Status Codes","api.spec.ts","",""
"","1352","/discover loads within 5 seconds","mobile-chrome","2026-04-26","passed","2026-04-26","Smoke: Response Times","smoke.spec.ts","",""
"","1489","Discover category navigation links are present","chromium","2026-04-26","passed","2026-04-26","Browse: Discover Screen (PB §6.8)","browse.spec.ts","",""
"","1233","Forgot password link navigates to /forgot-password","chromium","2026-04-26","passed","2026-04-26","Auth: Login Page UI","auth.spec.ts","",""
"","2622","Book cards show content type label (Book/Comic/Audiobook)","chromium","2026-04-26","passed","2026-04-26","Browse: Homepage Sections (PB §6.1)","browse.spec.ts","",""
"","1649","Documents category page loads without error","mobile-chrome","2026-04-26","failed","2026-04-26","Browse: Discover Sub-Categories","browse.spec.ts","",""
"","2016","Forums (/forums) returns 200 and loads","mobile-chrome","2026-04-26","passed","2026-04-26","Smoke: Public Pages Load","smoke.spec.ts","",""
"","2748","Book title is visible (Priority 1 per PB §6.3)","mobile-chrome","2026-04-26","failed","2026-04-26","Browse: Book Detail Page (PB §6.3)","browse.spec.ts","",""
"","3302","Guardian Dashboard is not linked to logged-out users (PB §5.3)","mobile-chrome","2026-04-26","passed","2026-04-26","PB: Junior Add-On Model (PB §1.3, §2.3, Q21 — v4.6)","product-bible.spec.ts","",""
"","1226","Footer contains copyright notice for The Book Crunch Limited","chromium","2026-04-26","passed","2026-04-26","PB: Web Navigation Structure (PB §5.2)","product-bible.spec.ts","",""
"","1292","/forums redirects unauthenticated user to /login","mobile-chrome","2026-04-26","passed","2026-04-26","Smoke: Auth-Gated Routes Redirect","smoke.spec.ts","",""
"","1955","Preview/Sample button present (Priority 2 per PB §6.3 and §3.9)","chromium","2026-04-26","passed","2026-04-26","Browse: Book Detail Page (PB §6.3)","browse.spec.ts","",""
"","313","Security response headers are present","mobile-chrome","2026-04-26","passed","2026-04-26","Smoke: SSL & Security Headers","smoke.spec.ts","",""
"","140","Login responds within 5 seconds","chromium","2026-04-26","passed","2026-04-26","API: Response Time Benchmarks","api.spec.ts","",""
"","499","Homepage loads on simulated slow 3G (African market priority — PB §4.5)","chromium","2026-04-26","passed","2026-04-26","Performance: Resource Loading","performance.spec.ts","",""
"","1513","Coral #E8735A used for section headers only — not CTA button fills (PB §10.2)","chromium","2026-04-26","passed","2026-04-26","PB: Home Screen Sections (PB §6.1)","product-bible.spec.ts","",""
"","1648","Register with invalid email shows validation","chromium","2026-04-26","passed","2026-04-26","Auth: Registration Page UI","auth.spec.ts","",""
"","1936","Events (/events) returns 200 and loads","mobile-chrome","2026-04-26","passed","2026-04-26","Smoke: Public Pages Load","smoke.spec.ts","",""
"","132","sitemap.xml is valid XML if present","chromium","2026-04-26","passed","2026-04-26","SEO: Technical SEO","seo.spec.ts","",""
"","2439","Author profile pages use /author/ route (PB §6.10)","mobile-chrome","2026-04-26","passed","2026-04-26","PB: Author Profile Rules (PB §6.10, Q15, Q16)","product-bible.spec.ts","",""
"","1235","Body text is dark on light background (not low contrast)","chromium","2026-04-26","passed","2026-04-26","Accessibility: Colour Contrast","accessibility.spec.ts","",""
"","2240","Book detail page loads and is not a 404","chromium","2026-04-26","passed","2026-04-26","Browse: Book Detail Page (PB §6.3)","browse.spec.ts","",""
"","3072","/forums is protected — unauthenticated access redirects to login","chromium","2026-04-26","passed","2026-04-26","Security: Auth Protection","security.spec.ts","",""
"","12574","Homepage has at least one book card visible","mobile-chrome","2026-04-26","failed","2026-04-26","Browse: Homepage Sections (PB §6.1)","browse.spec.ts","",""
"","155","robots.txt is present and allows crawling","chromium","2026-04-26","passed","2026-04-26","SEO: Technical SEO","seo.spec.ts","",""
"","196","/login returns 200","chromium","2026-04-26","passed","2026-04-26","API: HTTP Status Codes","api.spec.ts","",""
"","1982","Logo reads 'PAYGEES' (PB §10.1)","mobile-chrome","2026-04-26","passed","2026-04-26","PB: Brand Identity (§10.1, §10.2)","product-bible.spec.ts","",""
"","2172","/library is protected — unauthenticated access redirects to login","chromium","2026-04-26","passed","2026-04-26","Security: Auth Protection","security.spec.ts","",""
"","3005","Admin routes not linked from main site (PB §5.3, §11.6)","mobile-chrome","2026-04-26","passed","2026-04-26","PB: Information Architecture (PB §5.3)","product-bible.spec.ts","",""
"","1641","Age rating appears on book detail (PB §2.4)","chromium","2026-04-26","failed","2026-04-26","PB: Book Detail Page Spec (PB §6.3)","product-bible.spec.ts","",""
"","2448","Primary colour #1EAEDB is used — banned #2CB5B5 must not appear (PB §10.2)","mobile-chrome","2026-04-26","passed","2026-04-26","PB: Brand Identity (§10.1, §10.2)","product-bible.spec.ts","",""
"","133","/admin/finance does not expose sensitive data","chromium","2026-04-26","passed","2026-04-26","Security: Admin Route Hardening (PB §11.6)","security.spec.ts","",""
"","1845","Content type shown as icon/label — NOT file format (PB §6.3, §10.5)","chromium","2026-04-26","passed","2026-04-26","Browse: Book Detail Page (PB §6.3)","browse.spec.ts","",""
"","980","Error pages do not expose stack traces","chromium","2026-04-26","passed","2026-04-26","Security: Information Disclosure","security.spec.ts","",""
"","134","/register returns 200","chromium","2026-04-26","passed","2026-04-26","API: HTTP Status Codes","api.spec.ts","",""
"","15639","Valid credentials log in and redirect to app","chromium","2026-04-26","failed","2026-04-26","Auth: Successful Login Flow","auth.spec.ts","",""
"","1505","Site title contains 'Paygees' (PB header)","mobile-chrome","2026-04-26","passed","2026-04-26","PB: Brand Identity (§10.1, §10.2)","product-bible.spec.ts","",""
"","2006","Discover (/discover) returns 200 and loads","mobile-chrome","2026-04-26","passed","2026-04-26","Smoke: Public Pages Load","smoke.spec.ts","",""
"","1522","Homepage — First Contentful Paint (FCP) < 3s","chromium","2026-04-26","passed","2026-04-26","Performance: Web Vitals (via Navigation API)","performance.spec.ts","",""
"","2066","Author name is visible and clickable (Priority 1 per PB §6.3)","chromium","2026-04-26","failed","2026-04-26","Browse: Book Detail Page (PB §6.3)","browse.spec.ts","",""
"","900","Pick 3 genres flow is present for new users (mandatory per PB)","chromium","2026-04-26","passed","2026-04-26","Auth: Day 1 New User Flow (PB §4.7)","auth.spec.ts","",""
"","1494","Forgot Password (/forgot-password) returns 200 and loads","chromium","2026-04-26","passed","2026-04-26","Smoke: Public Pages Load","smoke.spec.ts","",""
"","153","/contact returns 200","chromium","2026-04-26","passed","2026-04-26","API: HTTP Status Codes","api.spec.ts","",""
"","698","/forums redirects unauthenticated user to /login","chromium","2026-04-26","passed","2026-04-26","Smoke: Auth-Gated Routes Redirect","smoke.spec.ts","",""
"","2280","Title and author displayed (Priority 1)","mobile-chrome","2026-04-26","failed","2026-04-26","PB: Book Detail Page Spec (PB §6.3)","product-bible.spec.ts","",""
"","15604","Forums page requires login — redirects unauthenticated users (PB §6.6, Q14)","chromium","2026-04-26","failed","2026-04-26","Browse: Authenticated User Flows","browse.spec.ts","",""
"","2279","Publisher Dashboard not linked from public homepage (PB §5.3)","mobile-chrome","2026-04-26","passed","2026-04-26","PB: Information Architecture (PB §5.3)","product-bible.spec.ts","",""
"","1209","/register loads within 5 seconds","mobile-chrome","2026-04-26","passed","2026-04-26","Smoke: Response Times","smoke.spec.ts","",""
"","3434","Site serves over HTTPS","mobile-chrome","2026-04-26","passed","2026-04-26","Smoke: SSL & Security Headers","smoke.spec.ts","",""
"","2266","All internal links use HTTPS or relative paths","chromium","2026-04-26","passed","2026-04-26","Security: HTTPS Enforcement","security.spec.ts","",""
"","232","/careers returns 200","chromium","2026-04-26","passed","2026-04-26","API: HTTP Status Codes","api.spec.ts","",""
"","242","/discover/comics returns 200","chromium","2026-04-26","passed","2026-04-26","API: HTTP Status Codes","api.spec.ts","",""
"","1990","'Junior' terminology used — not 'Kids' or 'Children' (PB §1.3)","chromium","2026-04-26","passed","2026-04-26","PB: Subscription Tiers in UI (PB §1.3, v4.6)","product-bible.spec.ts","",""
"","12932","Discover section includes: Books, Audiobooks, Periodicals, Comics, Documents","mobile-chrome","2026-04-26","failed","2026-04-26","PB: Web Navigation Structure (PB §5.2)","product-bible.spec.ts","",""
"","1653","Age rating is displayed (PB §2.4)","chromium","2026-04-26","failed","2026-04-26","Browse: Book Detail Page (PB §6.3)","browse.spec.ts","",""
"","668","No 'Publisher Profile' page — Publisher is internal-only (PB Q16)","chromium","2026-04-26","passed","2026-04-26","PB: Author Profile Rules (PB §6.10, Q15, Q16)","product-bible.spec.ts","",""
"","2135","Navigation links are focusable with Tab","chromium","2026-04-26","passed","2026-04-26","Accessibility: Keyboard Navigation","accessibility.spec.ts","",""
"","1441","All internal links use consistent domain (no mixed domains)","chromium","2026-04-26","passed","2026-04-26","SEO: Technical SEO","seo.spec.ts","",""
"","2311","Tagline 'Affordable | Accessible | Available' is present (PB §4.1)","mobile-chrome","2026-04-26","passed","2026-04-26","PB: Brand Identity (§10.1, §10.2)","product-bible.spec.ts","",""
"","2466","Junior is not presented as a comparable standalone subscription tier","chromium","2026-04-26","passed","2026-04-26","PB: Junior Add-On Model (PB §1.3, §2.3, Q21 — v4.6)","product-bible.spec.ts","",""
"","11913","Top navigation includes: Home, Library, News, Events, Forums","chromium","2026-04-26","failed","2026-04-26","PB: Web Navigation Structure (PB §5.2)","product-bible.spec.ts","",""
"","1786","Terms of Service (/terms) returns 200 and loads","mobile-chrome","2026-04-26","passed","2026-04-26","Smoke: Public Pages Load","smoke.spec.ts","",""
"","1133","/discover loads within 5 seconds","chromium","2026-04-26","passed","2026-04-26","Smoke: Response Times","smoke.spec.ts","",""
"","1405","No 'Publisher Profile' page — Publisher is internal-only (PB Q16)","mobile-chrome","2026-04-26","passed","2026-04-26","PB: Author Profile Rules (PB §6.10, Q15, Q16)","product-bible.spec.ts","",""
"","800","Login redirect param to external domain is ignored","chromium","2026-04-26","failed","2026-04-26","Security: Open Redirect Prevention","security.spec.ts","",""
"","203","/library without auth returns 200 with login content or redirects","chromium","2026-04-26","passed","2026-04-26","API: Auth-Gated Routes Return Redirect (not 200)","api.spec.ts","",""
"","2728","Homepage has a meta description","chromium","2026-04-26","passed","2026-04-26","SEO: Meta Tags","seo.spec.ts","",""
"","450","/discover/books returns 200","chromium","2026-04-26","passed","2026-04-26","API: HTTP Status Codes","api.spec.ts","",""
"","1576","Help Centre (/help) returns 200 and loads","mobile-chrome","2026-04-26","passed","2026-04-26","Smoke: Public Pages Load","smoke.spec.ts","",""
"","4788","R2 signed URLs on homepage load successfully","chromium","2026-04-26","passed","2026-04-26","API: Cloudflare R2 Image Delivery","api.spec.ts","",""
"","2112","Discover Books (/discover/books) returns 200 and loads","mobile-chrome","2026-04-26","passed","2026-04-26","Smoke: Public Pages Load","smoke.spec.ts","",""
"","326","Discover responds within 5 seconds","chromium","2026-04-26","passed","2026-04-26","API: Response Time Benchmarks","api.spec.ts","",""
"","1404","No console errors on homepage","chromium","2026-04-26","failed","2026-04-26","Performance: Resource Loading","performance.spec.ts","",""
"","15800","Library page shows tabs: In Progress, Favorites, Finished, All My Books (PB §6.2)","chromium","2026-04-26","failed","2026-04-26","Browse: Authenticated User Flows","browse.spec.ts","",""
"","16563","'Creator' term does not appear in UI — banned platform-wide per PB Q16","chromium","2026-04-26","passed","2026-04-26","PB: Brand Identity (§10.1, §10.2)","product-bible.spec.ts","",""
"","148","/api/admin does not expose sensitive data","chromium","2026-04-26","passed","2026-04-26","Security: Admin Route Hardening (PB §11.6)","security.spec.ts","",""
"","1667","Discover Comics & Illustrations (/discover/comics) returns 200 and loads","chromium","2026-04-26","passed","2026-04-26","Smoke: Public Pages Load","smoke.spec.ts","",""
"","2961","Section 'See More' links are present — max 10 per section (PB §6.1)","mobile-chrome","2026-04-26","failed","2026-04-26","PB: Home Screen Sections (PB §6.1)","product-bible.spec.ts","",""
"","873","Login redirect param cannot be used to redirect to external site","chromium","2026-04-26","failed","2026-04-26","Security: Open Redirect Prevention","security.spec.ts","",""
"","757","Site serves over HTTPS","chromium","2026-04-26","passed","2026-04-26","Smoke: SSL & Security Headers","smoke.spec.ts","",""
"","1604","Periodicals category page loads without error","chromium","2026-04-26","failed","2026-04-26","Browse: Discover Sub-Categories","browse.spec.ts","",""
"","15875","Sign Out is in profile dropdown only — not in top bar directly (PB §5.2)","mobile-chrome","2026-04-26","failed","2026-04-26","PB: Information Architecture (PB §5.3)","product-bible.spec.ts","",""
"","2983","Price or Free label is displayed (Priority 2 per PB §6.3)","mobile-chrome","2026-04-26","passed","2026-04-26","Browse: Book Detail Page (PB §6.3)","browse.spec.ts","",""
"","3532","Book detail page has a meta description","chromium","2026-04-26","passed","2026-04-26","SEO: Meta Tags","seo.spec.ts","",""
"","1408","No 500 errors on any public page","chromium","2026-04-26","passed","2026-04-26","API: Next.js Infrastructure","api.spec.ts","",""
"","1558","Privacy Policy (/privacy) returns 200 and loads","chromium","2026-04-26","passed","2026-04-26","Smoke: Public Pages Load","smoke.spec.ts","",""
"","2271","Periodicals category page loads without error","mobile-chrome","2026-04-26","failed","2026-04-26","Browse: Discover Sub-Categories","browse.spec.ts","",""
"","1708","Homepage book cover images load from R2","chromium","2026-04-26","passed","2026-04-26","Smoke: Image Delivery (Cloudflare R2)","smoke.spec.ts","",""
"","2043","Footer shows payment method logos (PB §5.2)","mobile-chrome","2026-04-26","passed","2026-04-26","PB: Web Navigation Structure (PB §5.2)","product-bible.spec.ts","",""
"","202","/blog returns 200","chromium","2026-04-26","passed","2026-04-26","API: HTTP Status Codes","api.spec.ts","",""
"","15577","After login, Sign Out is in profile dropdown only per PB §5.2","chromium","2026-04-26","failed","2026-04-26","Auth: Successful Login Flow","auth.spec.ts","",""
"","3090","Cookies have appropriate flags","chromium","2026-04-26","passed","2026-04-26","API: Security Headers","api.spec.ts","",""
"","2386","/settings is protected — unauthenticated access redirects to login","chromium","2026-04-26","passed","2026-04-26","Security: Auth Protection","security.spec.ts","",""
"","3052","Discover — Full load within 5s","chromium","2026-04-26","passed","2026-04-26","Performance: Page Load Times","performance.spec.ts","",""
"","3875","Homepage — Full load within 5s","chromium","2026-04-26","passed","2026-04-26","Performance: Page Load Times","performance.spec.ts","",""
"","618","/library redirects unauthenticated user to /login","chromium","2026-04-26","passed","2026-04-26","Smoke: Auth-Gated Routes Redirect","smoke.spec.ts","",""
"","3243","No EPUB / PDF / MP3 format names appear in UI (PB §10.5)","mobile-chrome","2026-04-26","passed","2026-04-26","PB: Home Screen Sections (PB §6.1)","product-bible.spec.ts","",""
"","659","Book Detail — DOMContentLoaded within 3s","chromium","2026-04-26","passed","2026-04-26","Performance: Page Load Times","performance.spec.ts","",""
"","1803","Discover Documents & Research (/discover/documents) returns 200 and loads","chromium","2026-04-26","passed","2026-04-26","Smoke: Public Pages Load","smoke.spec.ts","",""
"","144","/forgot-password returns 200","chromium","2026-04-26","passed","2026-04-26","API: HTTP Status Codes","api.spec.ts","",""
"","210","/terms returns 200","chromium","2026-04-26","passed","2026-04-26","API: HTTP Status Codes","api.spec.ts","",""
"","10580","Homepage has a main landmark","chromium","2026-04-26","failed","2026-04-26","Accessibility: Semantic HTML","accessibility.spec.ts","",""
"","41","favicon is served","chromium","2026-04-26","passed","2026-04-26","API: Next.js Infrastructure","api.spec.ts","",""
"","1303","Junior add-on available to Free tier — not exclusive to paid tiers (PB §1.3, Q21)","chromium","2026-04-26","passed","2026-04-26","PB: Junior Add-On Model (PB §1.3, §2.3, Q21 — v4.6)","product-bible.spec.ts","",""
"","352","/admin/* returns 404 (not a redirect hint) per PB §11.6","mobile-chrome","2026-04-26","passed","2026-04-26","Smoke: Admin Route Hardening","smoke.spec.ts","",""
"","1906","Sign Up (/register) returns 200 and loads","mobile-chrome","2026-04-26","passed","2026-04-26","Smoke: Public Pages Load","smoke.spec.ts","",""
"","2175","Cover image is large and prominent (Priority 1 per PB §6.3)","chromium","2026-04-26","failed","2026-04-26","Browse: Book Detail Page (PB §6.3)","browse.spec.ts","",""
"","1599","Cover image is large and prominent (Priority 1)","chromium","2026-04-26","passed","2026-04-26","PB: Book Detail Page Spec (PB §6.3)","product-bible.spec.ts","",""
"","190","/dashboard/admin does not expose admin panel (PB §11.6)","chromium","2026-04-26","passed","2026-04-26","API: Admin Route Hardening (PB §11.6)","api.spec.ts","",""
"","1883","Blog (/blog) returns 200 and loads","mobile-chrome","2026-04-26","passed","2026-04-26","Smoke: Public Pages Load","smoke.spec.ts","",""
"","15875","Library page shows tabs: In Progress, Favorites, Finished, All My Books (PB §6.2)","mobile-chrome","2026-04-26","failed","2026-04-26","Browse: Authenticated User Flows","browse.spec.ts","",""
"","1495","Press (/press) returns 200 and loads","chromium","2026-04-26","passed","2026-04-26","Smoke: Public Pages Load","smoke.spec.ts","",""
"","248","/forums without auth returns 200 with login content or redirects","chromium","2026-04-26","passed","2026-04-26","API: Auth-Gated Routes Return Redirect (not 200)","api.spec.ts","",""
"","1164","Homepage has OG title","chromium","2026-04-26","passed","2026-04-26","SEO: Open Graph Tags","seo.spec.ts","",""
"","1708","Books category page loads without error","chromium","2026-04-26","failed","2026-04-26","Browse: Discover Sub-Categories","browse.spec.ts","",""
"","12855","Homepage contains 'Discover More' or equivalent CTA","mobile-chrome","2026-04-26","failed","2026-04-26","Browse: Homepage Sections (PB §6.1)","browse.spec.ts","",""
"","15706","Library page has search within library (PB §6.2)","chromium","2026-04-26","failed","2026-04-26","Browse: Authenticated User Flows","browse.spec.ts","",""
"","2847","Homepage book cover images load from R2","mobile-chrome","2026-04-26","passed","2026-04-26","Smoke: Image Delivery (Cloudflare R2)","smoke.spec.ts","",""
"","1498","Events (/events) returns 200 and loads","chromium","2026-04-26","passed","2026-04-26","Smoke: Public Pages Load","smoke.spec.ts","",""
"","136","Register responds within 5 seconds","chromium","2026-04-26","passed","2026-04-26","API: Response Time Benchmarks","api.spec.ts","",""
"","1516","Blog (/blog) returns 200 and loads","chromium","2026-04-26","passed","2026-04-26","Smoke: Public Pages Load","smoke.spec.ts","",""
"","2165","Homepage has a nav landmark","chromium","2026-04-26","passed","2026-04-26","Accessibility: Semantic HTML","accessibility.spec.ts","",""
"","2866","Each book card has a cover image","chromium","2026-04-26","passed","2026-04-26","Browse: Homepage Sections (PB §6.1)","browse.spec.ts","",""
"","3483","Discover (/discover) returns 200 and loads","chromium","2026-04-26","passed","2026-04-26","Smoke: Public Pages Load","smoke.spec.ts","",""
"","1379","Audiobooks category page loads without error","chromium","2026-04-26","failed","2026-04-26","Browse: Discover Sub-Categories","browse.spec.ts","",""
"","76","robots.txt is accessible","chromium","2026-04-26","passed","2026-04-26","API: Next.js Infrastructure","api.spec.ts","",""
"","2375","Site title contains 'Paygees' (PB header)","chromium","2026-04-26","passed","2026-04-26","PB: Brand Identity (§10.1, §10.2)","product-bible.spec.ts","",""
"","2128","Discover Comics & Illustrations (/discover/comics) returns 200 and loads","mobile-chrome","2026-04-26","passed","2026-04-26","Smoke: Public Pages Load","smoke.spec.ts","",""
"","152","Homepage responds within 5 seconds","chromium","2026-04-26","passed","2026-04-26","API: Response Time Benchmarks","api.spec.ts","",""
"","2749","Cover image is large and prominent (Priority 1)","mobile-chrome","2026-04-26","passed","2026-04-26","PB: Book Detail Page Spec (PB §6.3)","product-bible.spec.ts","",""
"","2192","Home (/) returns 200 and loads","mobile-chrome","2026-04-26","passed","2026-04-26","Smoke: Public Pages Load","smoke.spec.ts","",""
"","1107","Page has exactly one h1 tag","chromium","2026-04-26","passed","2026-04-26","Accessibility: Semantic HTML","accessibility.spec.ts","",""
"","753","/settings redirects unauthenticated user to /login","chromium","2026-04-26","passed","2026-04-26","Smoke: Auth-Gated Routes Redirect","smoke.spec.ts","",""
"","2679","Homepage has correct title tag","chromium","2026-04-26","passed","2026-04-26","SEO: Meta Tags","seo.spec.ts","",""
"","12117","Homepage contains 'Discover More' or equivalent CTA","chromium","2026-04-26","failed","2026-04-26","Browse: Homepage Sections (PB §6.1)","browse.spec.ts","",""
"","16346","Logged-in Free user can access forums (PB Q14 — read + reply access)","mobile-chrome","2026-04-26","failed","2026-04-26","PB: Forum Access Rules (PB §6.6, Q14)","product-bible.spec.ts","",""
"","2190","Footer contains company and support links (PB §5.2)","mobile-chrome","2026-04-26","passed","2026-04-26","PB: Web Navigation Structure (PB §5.2)","product-bible.spec.ts","",""
"","1419","/login loads within 5 seconds","mobile-chrome","2026-04-26","passed","2026-04-26","Smoke: Response Times","smoke.spec.ts","",""
"","2453","Content type shown as icon/label — NOT file format (PB §6.3, §10.5)","mobile-chrome","2026-04-26","passed","2026-04-26","Browse: Book Detail Page (PB §6.3)","browse.spec.ts","",""
"","1516","Forums (/forums) returns 200 and loads","chromium","2026-04-26","passed","2026-04-26","Smoke: Public Pages Load","smoke.spec.ts","",""
"","1991","Discover Audiobooks (/discover/audiobooks) returns 200 and loads","mobile-chrome","2026-04-26","passed","2026-04-26","Smoke: Public Pages Load","smoke.spec.ts","",""
"","1488","Documents category page loads without error","chromium","2026-04-26","failed","2026-04-26","Browse: Discover Sub-Categories","browse.spec.ts","",""
"","818","Login form inputs have labels","chromium","2026-04-26","failed","2026-04-26","Accessibility: Semantic HTML","accessibility.spec.ts","",""
"","1904","Careers (/careers) returns 200 and loads","mobile-chrome","2026-04-26","passed","2026-04-26","Smoke: Public Pages Load","smoke.spec.ts","",""
"","15934","Forums page requires login — redirects unauthenticated users (PB §6.6, Q14)","mobile-chrome","2026-04-26","failed","2026-04-26","Browse: Authenticated User Flows","browse.spec.ts","",""
