"DESCRIPTION","DURATION IN MS","NAME","PARENT SUITE","START TIME","STATUS","STOP TIME","SUB SUITE","SUITE","TEST CLASS","TEST METHOD"
"","2593","Junior add-on available to Free tier — not exclusive to paid tiers (PB §1.3, Q21)","mobile-chrome","2026-05-02","passed","2026-05-02","PB: Junior Add-On Model (PB §1.3, §2.3, Q21 — v4.6)","product-bible.spec.ts","",""
"","581","Homepage loads on simulated slow 3G (African market priority — PB §4.5)","chromium","2026-05-02","passed","2026-05-02","Performance: Resource Loading","performance.spec.ts","",""
"","1002","Site serves over HTTPS","chromium","2026-05-02","passed","2026-05-02","Smoke: SSL & Security Headers","smoke.spec.ts","",""
"","15570","Homepage has OG image","chromium","2026-05-02","failed","2026-05-02","SEO: Open Graph Tags","seo.spec.ts","",""
"","2214","Homepage has correct title tag","chromium","2026-05-02","passed","2026-05-02","SEO: Meta Tags","seo.spec.ts","",""
"","1731","Periodicals category page loads without error","chromium","2026-05-02","failed","2026-05-02","Browse: Discover Sub-Categories","browse.spec.ts","",""
"","15866","Library page shows tabs: In Progress, Favorites, Finished, All My Books (PB §6.2)","chromium","2026-05-02","failed","2026-05-02","Browse: Authenticated User Flows","browse.spec.ts","",""
"","16101","Clicking a book card navigates to book detail page","mobile-chrome","2026-05-02","failed","2026-05-02","Browse: Authenticated User Flows","browse.spec.ts","",""
"","1463","Homepage — First Contentful Paint (FCP) < 3s","chromium","2026-05-02","passed","2026-05-02","Performance: Web Vitals (via Navigation API)","performance.spec.ts","",""
"","3232","Tagline 'Affordable | Accessible | Available' is present (PB §4.1)","mobile-chrome","2026-05-02","passed","2026-05-02","PB: Brand Identity (§10.1, §10.2)","product-bible.spec.ts","",""
"","1612","Card details are never displayed in any page response (PB §11.5)","chromium","2026-05-02","passed","2026-05-02","Security: Cookie Configuration (PB §11.5)","security.spec.ts","",""
"","1033","Page has exactly one h1 tag","chromium","2026-05-02","passed","2026-05-02","Accessibility: Semantic HTML","accessibility.spec.ts","",""
"","124","/.env does not expose sensitive data","chromium","2026-05-02","passed","2026-05-02","Security: Admin Route Hardening (PB §11.6)","security.spec.ts","",""
"","2790","Cover image is large and prominent (Priority 1 per PB §6.3)","mobile-chrome","2026-05-02","failed","2026-05-02","Browse: Book Detail Page (PB §6.3)","browse.spec.ts","",""
"","2164","No EPUB / PDF / MP3 format names appear in UI (PB §10.5)","mobile-chrome","2026-05-02","passed","2026-05-02","PB: Home Screen Sections (PB §6.1)","product-bible.spec.ts","",""
"","1034","/forums redirects unauthenticated user to /login","chromium","2026-05-02","passed","2026-05-02","Smoke: Auth-Gated Routes Redirect","smoke.spec.ts","",""
"","3469","Tagline 'Affordable | Accessible | Available' is present (PB §4.1)","chromium","2026-05-02","passed","2026-05-02","PB: Brand Identity (§10.1, §10.2)","product-bible.spec.ts","",""
"","2987","Discover Audiobooks (/discover/audiobooks) returns 200 and loads","chromium","2026-05-02","passed","2026-05-02","Smoke: Public Pages Load","smoke.spec.ts","",""
"","1675","Discover Comics & Illustrations (/discover/comics) returns 200 and loads","mobile-chrome","2026-05-02","passed","2026-05-02","Smoke: Public Pages Load","smoke.spec.ts","",""
"","1534","Bestsellers section is present on homepage","chromium","2026-05-02","failed","2026-05-02","PB: Home Screen Sections (PB §6.1)","product-bible.spec.ts","",""
"","1731","Free label appears for free books (PB §1.3)","chromium","2026-05-02","failed","2026-05-02","PB: Book Detail Page Spec (PB §6.3)","product-bible.spec.ts","",""
"","307","/discover/documents returns 200","chromium","2026-05-02","passed","2026-05-02","API: HTTP Status Codes","api.spec.ts","",""
"","2022","Discover Comics & Illustrations (/discover/comics) returns 200 and loads","chromium","2026-05-02","passed","2026-05-02","Smoke: Public Pages Load","smoke.spec.ts","",""
"","3481","Logo reads 'PAYGEES' (PB §10.1)","chromium","2026-05-02","passed","2026-05-02","PB: Brand Identity (§10.1, §10.2)","product-bible.spec.ts","",""
"","2431","Guardian Dashboard is not linked to logged-out users (PB §5.3)","chromium","2026-05-02","passed","2026-05-02","PB: Junior Add-On Model (PB §1.3, §2.3, Q21 — v4.6)","product-bible.spec.ts","",""
"","249","/forums returns 200","chromium","2026-05-02","passed","2026-05-02","API: HTTP Status Codes","api.spec.ts","",""
"","2091","Homepage book cover images load from R2","chromium","2026-05-02","passed","2026-05-02","Smoke: Image Delivery (Cloudflare R2)","smoke.spec.ts","",""
"","398","/ returns 200","chromium","2026-05-02","passed","2026-05-02","API: HTTP Status Codes","api.spec.ts","",""
"","1830","Preview/Sample button present (Priority 2 per PB §6.3 and §3.9)","chromium","2026-05-02","passed","2026-05-02","Browse: Book Detail Page (PB §6.3)","browse.spec.ts","",""
"","1860","Forums (/forums) returns 200 and loads","chromium","2026-05-02","passed","2026-05-02","Smoke: Public Pages Load","smoke.spec.ts","",""
"","1923","Forums page does not return a 500 error","mobile-chrome","2026-05-02","failed","2026-05-02","PB: Forum Access Rules (PB §6.6, Q14)","product-bible.spec.ts","",""
"","964","Interactive elements show visible focus ring","chromium","2026-05-02","passed","2026-05-02","Accessibility: Focus Indicators","accessibility.spec.ts","",""
"","1510","Privacy Policy (/privacy) returns 200 and loads","mobile-chrome","2026-05-02","passed","2026-05-02","Smoke: Public Pages Load","smoke.spec.ts","",""
"","1279","Forgot password page renders email input and submit","chromium","2026-05-02","failed","2026-05-02","Auth: Forgot Password Flow","auth.spec.ts","",""
"","1494","Author profile pages use /author/ route (PB §6.10)","chromium","2026-05-02","passed","2026-05-02","PB: Author Profile Rules (PB §6.10, Q15, Q16)","product-bible.spec.ts","",""
"","100","Response headers do not expose server technology details","chromium","2026-05-02","passed","2026-05-02","Security: Information Disclosure","security.spec.ts","",""
"","596","No 'Publisher Profile' page — Publisher is internal-only (PB Q16)","chromium","2026-05-02","passed","2026-05-02","PB: Author Profile Rules (PB §6.10, Q15, Q16)","product-bible.spec.ts","",""
"","1691","Publisher Dashboard not linked from public homepage (PB §5.3)","chromium","2026-05-02","passed","2026-05-02","PB: Information Architecture (PB §5.3)","product-bible.spec.ts","",""
"","301","/press returns 200","chromium","2026-05-02","passed","2026-05-02","API: HTTP Status Codes","api.spec.ts","",""
"","2024","Discover Documents & Research (/discover/documents) returns 200 and loads","chromium","2026-05-02","passed","2026-05-02","Smoke: Public Pages Load","smoke.spec.ts","",""
"","15834","Sign Out is in profile dropdown only — not in top bar directly (PB §5.2)","mobile-chrome","2026-05-02","failed","2026-05-02","PB: Information Architecture (PB §5.3)","product-bible.spec.ts","",""
"","1294","Footer shows payment method logos (PB §5.2)","chromium","2026-05-02","passed","2026-05-02","PB: Web Navigation Structure (PB §5.2)","product-bible.spec.ts","",""
"","1964","About Paygees (/about) returns 200 and loads","chromium","2026-05-02","passed","2026-05-02","Smoke: Public Pages Load","smoke.spec.ts","",""
"","1940","Book title is visible (Priority 1 per PB §6.3)","chromium","2026-05-02","failed","2026-05-02","Browse: Book Detail Page (PB §6.3)","browse.spec.ts","",""
"","16125","Library page has search within library (PB §6.2)","mobile-chrome","2026-05-02","failed","2026-05-02","Browse: Authenticated User Flows","browse.spec.ts","",""
"","2606","Audiobooks category page loads without error","mobile-chrome","2026-05-02","failed","2026-05-02","Browse: Discover Sub-Categories","browse.spec.ts","",""
"","1678","All images have alt text","chromium","2026-05-02","passed","2026-05-02","Accessibility: Semantic HTML","accessibility.spec.ts","",""
"","1874","Title and author displayed (Priority 1)","mobile-chrome","2026-05-02","failed","2026-05-02","PB: Book Detail Page Spec (PB §6.3)","product-bible.spec.ts","",""
"","602","Register page includes T&C consent text per PB","chromium","2026-05-02","passed","2026-05-02","Auth: Registration Page UI","auth.spec.ts","",""
"","619","/register loads within 5 seconds","chromium","2026-05-02","passed","2026-05-02","Smoke: Response Times","smoke.spec.ts","",""
"","1550","HTTP redirects to HTTPS","chromium","2026-05-02","passed","2026-05-02","Smoke: SSL & Security Headers","smoke.spec.ts","",""
"","2099","Book detail page loads and is not a 404","chromium","2026-05-02","passed","2026-05-02","Browse: Book Detail Page (PB §6.3)","browse.spec.ts","",""
"","1312","No console errors on homepage","chromium","2026-05-02","failed","2026-05-02","Performance: Resource Loading","performance.spec.ts","",""
"","255","/discover/comics returns 200","chromium","2026-05-02","passed","2026-05-02","API: HTTP Status Codes","api.spec.ts","",""
"","1779","Discover Periodicals (/discover/periodicals) returns 200 and loads","mobile-chrome","2026-05-02","passed","2026-05-02","Smoke: Public Pages Load","smoke.spec.ts","",""
"","780","/library redirects unauthenticated user to /login","chromium","2026-05-02","passed","2026-05-02","Smoke: Auth-Gated Routes Redirect","smoke.spec.ts","",""
"","11954","Discover page loads and shows content","chromium","2026-05-02","failed","2026-05-02","Browse: Discover Screen (PB §6.8)","browse.spec.ts","",""
"","1523","Cookies have appropriate flags","chromium","2026-05-02","passed","2026-05-02","API: Security Headers","api.spec.ts","",""
"","1655","Contact Us (/contact) returns 200 and loads","mobile-chrome","2026-05-02","passed","2026-05-02","Smoke: Public Pages Load","smoke.spec.ts","",""
"","1906","Comics category page loads without error","chromium","2026-05-02","failed","2026-05-02","Browse: Discover Sub-Categories","browse.spec.ts","",""
"","1490","/settings is protected — unauthenticated access redirects to login","chromium","2026-05-02","passed","2026-05-02","Security: Auth Protection","security.spec.ts","",""
"","406","/admin does not expose sensitive data","chromium","2026-05-02","passed","2026-05-02","Security: Admin Route Hardening (PB §11.6)","security.spec.ts","",""
"","332","/library without auth returns 200 with login content or redirects","chromium","2026-05-02","passed","2026-05-02","API: Auth-Gated Routes Return Redirect (not 200)","api.spec.ts","",""
"","3682","Junior is NOT presented as a default-included benefit of any tier (PB §1.3, Q21)","mobile-chrome","2026-05-02","passed","2026-05-02","PB: Subscription Tiers in UI (PB §1.3, v4.6)","product-bible.spec.ts","",""
"","2954","Price or Free label is displayed (Priority 2 per PB §6.3)","mobile-chrome","2026-05-02","passed","2026-05-02","Browse: Book Detail Page (PB §6.3)","browse.spec.ts","",""
"","2328","Homepage does not load excessive JavaScript (< 2MB total)","chromium","2026-05-02","passed","2026-05-02","Performance: Resource Loading","performance.spec.ts","",""
"","1291","Help Centre (/help) returns 200 and loads","mobile-chrome","2026-05-02","passed","2026-05-02","Smoke: Public Pages Load","smoke.spec.ts","",""
"","1634","Discover Documents & Research (/discover/documents) returns 200 and loads","mobile-chrome","2026-05-02","passed","2026-05-02","Smoke: Public Pages Load","smoke.spec.ts","",""
"","2253","Junior is not presented as a comparable standalone subscription tier","chromium","2026-05-02","passed","2026-05-02","PB: Junior Add-On Model (PB §1.3, §2.3, Q21 — v4.6)","product-bible.spec.ts","",""
"","1259","Body text is dark on light background (not low contrast)","chromium","2026-05-02","passed","2026-05-02","Accessibility: Colour Contrast","accessibility.spec.ts","",""
"","2314","Homepage book cover images load from R2","mobile-chrome","2026-05-02","passed","2026-05-02","Smoke: Image Delivery (Cloudflare R2)","smoke.spec.ts","",""
"","904","/settings redirects unauthenticated user to /login","mobile-chrome","2026-05-02","passed","2026-05-02","Smoke: Auth-Gated Routes Redirect","smoke.spec.ts","",""
"","1954","Comics category page loads without error","mobile-chrome","2026-05-02","failed","2026-05-02","Browse: Discover Sub-Categories","browse.spec.ts","",""
"","11371","Homepage has at least one book card visible","chromium","2026-05-02","failed","2026-05-02","Browse: Homepage Sections (PB §6.1)","browse.spec.ts","",""
"","330","Discover responds within 5 seconds","chromium","2026-05-02","passed","2026-05-02","API: Response Time Benchmarks","api.spec.ts","",""
"","1215","Footer contains copyright notice for The Book Crunch Limited","chromium","2026-05-02","passed","2026-05-02","PB: Web Navigation Structure (PB §5.2)","product-bible.spec.ts","",""
"","2953","Login with empty fields shows validation","chromium","2026-05-02","passed","2026-05-02","Auth: Login Page UI","auth.spec.ts","",""
"","912","Login redirect param cannot be used to redirect to external site","chromium","2026-05-02","failed","2026-05-02","Security: Open Redirect Prevention","security.spec.ts","",""
"","3542","Discover — Full load within 5s","chromium","2026-05-02","passed","2026-05-02","Performance: Page Load Times","performance.spec.ts","",""
"","15808","Login page has noindex or appropriate meta (auth pages shouldn't be indexed)","chromium","2026-05-02","failed","2026-05-02","SEO: Meta Tags","seo.spec.ts","",""
"","1593","Events (/events) returns 200 and loads","mobile-chrome","2026-05-02","passed","2026-05-02","Smoke: Public Pages Load","smoke.spec.ts","",""
"","2150","Forums require login — unauthenticated visitors redirected (login is CTA per PB Q14)","mobile-chrome","2026-05-02","passed","2026-05-02","PB: Forum Access Rules (PB §6.6, Q14)","product-bible.spec.ts","",""
"","1210","Sign up link navigates to /register","chromium","2026-05-02","passed","2026-05-02","Auth: Login Page UI","auth.spec.ts","",""
"","4982","R2 signed URLs on homepage load successfully","chromium","2026-05-02","passed","2026-05-02","API: Cloudflare R2 Image Delivery","api.spec.ts","",""
"","13390","Top navigation includes: Home, Library, News, Events, Forums","mobile-chrome","2026-05-02","failed","2026-05-02","PB: Web Navigation Structure (PB §5.2)","product-bible.spec.ts","",""
"","2882","Each book card has a cover image","chromium","2026-05-02","passed","2026-05-02","Browse: Homepage Sections (PB §6.1)","browse.spec.ts","",""
"","156","/blog returns 200","chromium","2026-05-02","passed","2026-05-02","API: HTTP Status Codes","api.spec.ts","",""
"","1726","Site serves over HTTPS","mobile-chrome","2026-05-02","passed","2026-05-02","Smoke: SSL & Security Headers","smoke.spec.ts","",""
"","1837","News (/news) returns 200 and loads","chromium","2026-05-02","passed","2026-05-02","Smoke: Public Pages Load","smoke.spec.ts","",""
"","3465","Section 'See More' links are present — max 10 per section (PB §6.1)","mobile-chrome","2026-05-02","failed","2026-05-02","PB: Home Screen Sections (PB §6.1)","product-bible.spec.ts","",""
"","10513","Homepage has a main landmark","chromium","2026-05-02","failed","2026-05-02","Accessibility: Semantic HTML","accessibility.spec.ts","",""
"","1520","Login — Full load within 5s","chromium","2026-05-02","passed","2026-05-02","Performance: Page Load Times","performance.spec.ts","",""
"","466","/discover returns 200","chromium","2026-05-02","passed","2026-05-02","API: HTTP Status Codes","api.spec.ts","",""
"","206","/admin/* returns 404 (not a redirect hint) per PB §11.6","chromium","2026-05-02","passed","2026-05-02","Smoke: Admin Route Hardening","smoke.spec.ts","",""
"","246","/news returns 200","chromium","2026-05-02","passed","2026-05-02","API: HTTP Status Codes","api.spec.ts","",""
"","1038","Error pages do not expose stack traces","chromium","2026-05-02","passed","2026-05-02","Security: Information Disclosure","security.spec.ts","",""
"","13147","Sections use 'See More' / 'View All' links per PB §6.1 (max 10 per section)","mobile-chrome","2026-05-02","failed","2026-05-02","Browse: Homepage Sections (PB §6.1)","browse.spec.ts","",""
"","1775","Age rating is displayed (PB §2.4)","mobile-chrome","2026-05-02","failed","2026-05-02","Browse: Book Detail Page (PB §6.3)","browse.spec.ts","",""
"","5469","Each book card has a cover image","mobile-chrome","2026-05-02","passed","2026-05-02","Browse: Homepage Sections (PB §6.1)","browse.spec.ts","",""
"","155","Homepage responds within 5 seconds","chromium","2026-05-02","passed","2026-05-02","API: Response Time Benchmarks","api.spec.ts","",""
"","5556","Book cards show content type label (Book/Comic/Audiobook)","mobile-chrome","2026-05-02","passed","2026-05-02","Browse: Homepage Sections (PB §6.1)","browse.spec.ts","",""
"","244","/careers returns 200","chromium","2026-05-02","passed","2026-05-02","API: HTTP Status Codes","api.spec.ts","",""
"","2692","Free label appears for free books (PB §1.3)","mobile-chrome","2026-05-02","failed","2026-05-02","PB: Book Detail Page Spec (PB §6.3)","product-bible.spec.ts","",""
"","2004","Discover Books (/discover/books) returns 200 and loads","chromium","2026-05-02","passed","2026-05-02","Smoke: Public Pages Load","smoke.spec.ts","",""
"","1052","/discover loads within 5 seconds","chromium","2026-05-02","passed","2026-05-02","Smoke: Response Times","smoke.spec.ts","",""
"","158","/terms returns 200","chromium","2026-05-02","passed","2026-05-02","API: HTTP Status Codes","api.spec.ts","",""
"","1768","Help Centre (/help) returns 200 and loads","chromium","2026-05-02","passed","2026-05-02","Smoke: Public Pages Load","smoke.spec.ts","",""
"","248","/cms does not expose admin panel (PB §11.6)","chromium","2026-05-02","passed","2026-05-02","API: Admin Route Hardening (PB §11.6)","api.spec.ts","",""
"","160","Register responds within 5 seconds","chromium","2026-05-02","passed","2026-05-02","API: Response Time Benchmarks","api.spec.ts","",""
"","1414","Cover image is large and prominent (Priority 1)","chromium","2026-05-02","passed","2026-05-02","PB: Book Detail Page Spec (PB §6.3)","product-bible.spec.ts","",""
"","763","Register — DOMContentLoaded within 3s","chromium","2026-05-02","passed","2026-05-02","Performance: Page Load Times","performance.spec.ts","",""
"","262","/admin/login does not expose sensitive data","chromium","2026-05-02","passed","2026-05-02","Security: Admin Route Hardening (PB §11.6)","security.spec.ts","",""
"","1690","Logged-out users see marketing/landing content on homepage","chromium","2026-05-02","passed","2026-05-02","PB: Information Architecture (PB §5.3)","product-bible.spec.ts","",""
"","64","sitemap.xml is accessible","chromium","2026-05-02","passed","2026-05-02","API: Next.js Infrastructure","api.spec.ts","",""
"","2740","Admin routes not linked from main site (PB §5.3, §11.6)","mobile-chrome","2026-05-02","passed","2026-05-02","PB: Information Architecture (PB §5.3)","product-bible.spec.ts","",""
"","1339","/forums redirects unauthenticated user to /login","mobile-chrome","2026-05-02","passed","2026-05-02","Smoke: Auth-Gated Routes Redirect","smoke.spec.ts","",""
"","2138","Homepage — DOMContentLoaded within 3s","chromium","2026-05-02","passed","2026-05-02","Performance: Page Load Times","performance.spec.ts","",""
"","841","Register page renders key elements","chromium","2026-05-02","failed","2026-05-02","Auth: Registration Page UI","auth.spec.ts","",""
"","1730","Footer contains company and support links (PB §5.2)","chromium","2026-05-02","passed","2026-05-02","PB: Web Navigation Structure (PB §5.2)","product-bible.spec.ts","",""
"","1826","Blog (/blog) returns 200 and loads","chromium","2026-05-02","passed","2026-05-02","Smoke: Public Pages Load","smoke.spec.ts","",""
"","2103","Site title contains 'Paygees' (PB header)","mobile-chrome","2026-05-02","passed","2026-05-02","PB: Brand Identity (§10.1, §10.2)","product-bible.spec.ts","",""
"","1539","Content type shown as icon/label — NOT file format (PB §6.3, §10.5)","chromium","2026-05-02","passed","2026-05-02","Browse: Book Detail Page (PB §6.3)","browse.spec.ts","",""
"","6633","Homepage — Cumulative Layout Shift (CLS) < 0.1","chromium","2026-05-02","passed","2026-05-02","Performance: Web Vitals (via Navigation API)","performance.spec.ts","",""
"","1632","Cover image is large and prominent (Priority 1)","mobile-chrome","2026-05-02","passed","2026-05-02","PB: Book Detail Page Spec (PB §6.3)","product-bible.spec.ts","",""
"","2313","Title and author displayed (Priority 1)","chromium","2026-05-02","failed","2026-05-02","PB: Book Detail Page Spec (PB §6.3)","product-bible.spec.ts","",""
"","170","/admin/* returns 404 (not a redirect hint) per PB §11.6","mobile-chrome","2026-05-02","passed","2026-05-02","Smoke: Admin Route Hardening","smoke.spec.ts","",""
"","557","/discover/periodicals returns 200","chromium","2026-05-02","passed","2026-05-02","API: HTTP Status Codes","api.spec.ts","",""
"","4389","Navigation links are focusable with Tab","chromium","2026-05-02","passed","2026-05-02","Accessibility: Keyboard Navigation","accessibility.spec.ts","",""
"","1366","About Paygees (/about) returns 200 and loads","mobile-chrome","2026-05-02","passed","2026-05-02","Smoke: Public Pages Load","smoke.spec.ts","",""
"","13535","Homepage contains 'Discover More' or equivalent CTA","mobile-chrome","2026-05-02","failed","2026-05-02","Browse: Homepage Sections (PB §6.1)","browse.spec.ts","",""
"","1773","Privacy Policy (/privacy) returns 200 and loads","chromium","2026-05-02","passed","2026-05-02","Smoke: Public Pages Load","smoke.spec.ts","",""
"","201","/admin does not expose admin panel (PB §11.6)","chromium","2026-05-02","passed","2026-05-02","API: Admin Route Hardening (PB §11.6)","api.spec.ts","",""
"","2714","Primary colour #1EAEDB is used — banned #2CB5B5 must not appear (PB §10.2)","mobile-chrome","2026-05-02","passed","2026-05-02","PB: Brand Identity (§10.1, §10.2)","product-bible.spec.ts","",""
"","2635","Books category page loads without error","mobile-chrome","2026-05-02","failed","2026-05-02","Browse: Discover Sub-Categories","browse.spec.ts","",""
"","2695","Bestsellers section is present on homepage","mobile-chrome","2026-05-02","failed","2026-05-02","PB: Home Screen Sections (PB §6.1)","product-bible.spec.ts","",""
"","80","favicon is served","chromium","2026-05-02","passed","2026-05-02","API: Next.js Infrastructure","api.spec.ts","",""
"","11928","Discover page loads and shows content","mobile-chrome","2026-05-02","failed","2026-05-02","Browse: Discover Screen (PB §6.8)","browse.spec.ts","",""
"","2264","Footer contains company and support links (PB §5.2)","mobile-chrome","2026-05-02","passed","2026-05-02","PB: Web Navigation Structure (PB §5.2)","product-bible.spec.ts","",""
"","2066","Content type shown as icon/label — NOT file format (PB §6.3, §10.5)","mobile-chrome","2026-05-02","passed","2026-05-02","Browse: Book Detail Page (PB §6.3)","browse.spec.ts","",""
"","15607","Homepage has a canonical URL","chromium","2026-05-02","failed","2026-05-02","SEO: Canonical URLs","seo.spec.ts","",""
"","528","Book Detail — DOMContentLoaded within 3s","chromium","2026-05-02","passed","2026-05-02","Performance: Page Load Times","performance.spec.ts","",""
"","15650","Login with wrong credentials shows error, not 500","chromium","2026-05-02","failed","2026-05-02","Auth: Login Page UI","auth.spec.ts","",""
"","1485","Book detail page has OG tags with book info","chromium","2026-05-02","passed","2026-05-02","SEO: Open Graph Tags","seo.spec.ts","",""
"","1538","Terms of Service (/terms) returns 200 and loads","mobile-chrome","2026-05-02","passed","2026-05-02","Smoke: Public Pages Load","smoke.spec.ts","",""
"","2780","Submitting forgot password with valid email shows confirmation, not error","chromium","2026-05-02","failed","2026-05-02","Auth: Forgot Password Flow","auth.spec.ts","",""
"","2166","Preview/Sample button present (Priority 2 per PB §6.3 and §3.9)","mobile-chrome","2026-05-02","passed","2026-05-02","Browse: Book Detail Page (PB §6.3)","browse.spec.ts","",""
"","2559","Logo reads 'PAYGEES' (PB §10.1)","mobile-chrome","2026-05-02","passed","2026-05-02","PB: Brand Identity (§10.1, §10.2)","product-bible.spec.ts","",""
"","837","Login redirect param to external domain is ignored","chromium","2026-05-02","failed","2026-05-02","Security: Open Redirect Prevention","security.spec.ts","",""
"","745","Login form is navigable by keyboard","chromium","2026-05-02","failed","2026-05-02","Accessibility: Keyboard Navigation","accessibility.spec.ts","",""
"","2060","Author name is visible and clickable (Priority 1 per PB §6.3)","chromium","2026-05-02","failed","2026-05-02","Browse: Book Detail Page (PB §6.3)","browse.spec.ts","",""
"","1828","Forgot Password (/forgot-password) returns 200 and loads","chromium","2026-05-02","passed","2026-05-02","Smoke: Public Pages Load","smoke.spec.ts","",""
"","15545","Logged-in Free user can access forums (PB Q14 — read + reply access)","chromium","2026-05-02","failed","2026-05-02","PB: Forum Access Rules (PB §6.6, Q14)","product-bible.spec.ts","",""
"","1408","Documents category page loads without error","chromium","2026-05-02","failed","2026-05-02","Browse: Discover Sub-Categories","browse.spec.ts","",""
"","2368","Homepage — Full load within 5s","chromium","2026-05-02","passed","2026-05-02","Performance: Page Load Times","performance.spec.ts","",""
"","155","robots.txt is present and allows crawling","chromium","2026-05-02","passed","2026-05-02","SEO: Technical SEO","seo.spec.ts","",""
"","101","/.env.local does not expose sensitive data","chromium","2026-05-02","passed","2026-05-02","Security: Admin Route Hardening (PB §11.6)","security.spec.ts","",""
