"DESCRIPTION","DURATION IN MS","NAME","PARENT SUITE","START TIME","STATUS","STOP TIME","SUB SUITE","SUITE","TEST CLASS","TEST METHOD"
"","135","/about returns 200","chromium","2026-04-21","passed","2026-04-21","API: HTTP Status Codes","api.spec.ts","",""
"","3157","Section 'See More' links are present — max 10 per section (PB §6.1)","mobile-chrome","2026-04-21","failed","2026-04-21","PB: Home Screen Sections (PB §6.1)","product-bible.spec.ts","",""
"","90","/blog returns 200","chromium","2026-04-21","passed","2026-04-21","API: HTTP Status Codes","api.spec.ts","",""
"","359","/admin/* returns 404 (not a redirect hint) per PB §11.6","mobile-chrome","2026-04-21","passed","2026-04-21","Smoke: Admin Route Hardening","smoke.spec.ts","",""
"","1785","Cover image is large and prominent (Priority 1)","chromium","2026-04-21","passed","2026-04-21","PB: Book Detail Page Spec (PB §6.3)","product-bible.spec.ts","",""
"","1781","Discover (/discover) returns 200 and loads","mobile-chrome","2026-04-21","passed","2026-04-21","Smoke: Public Pages Load","smoke.spec.ts","",""
"","725","/settings redirects unauthenticated user to /login","chromium","2026-04-21","passed","2026-04-21","Smoke: Auth-Gated Routes Redirect","smoke.spec.ts","",""
"","16820","'Creator' term does not appear in UI — banned platform-wide per PB Q16","chromium","2026-04-21","passed","2026-04-21","PB: Brand Identity (§10.1, §10.2)","product-bible.spec.ts","",""
"","15778","Logged-in Free user can access forums (PB Q14 — read + reply access)","mobile-chrome","2026-04-21","failed","2026-04-21","PB: Forum Access Rules (PB §6.6, Q14)","product-bible.spec.ts","",""
"","94","/privacy returns 200","chromium","2026-04-21","passed","2026-04-21","API: HTTP Status Codes","api.spec.ts","",""
"","679","/library redirects unauthenticated user to /login","chromium","2026-04-21","passed","2026-04-21","Smoke: Auth-Gated Routes Redirect","smoke.spec.ts","",""
"","941","Pick 3 genres flow is present for new users (mandatory per PB)","chromium","2026-04-21","passed","2026-04-21","Auth: Day 1 New User Flow (PB §4.7)","auth.spec.ts","",""
"","82","/register returns 200","chromium","2026-04-21","passed","2026-04-21","API: HTTP Status Codes","api.spec.ts","",""
"","1084","No 'Publisher Profile' page — Publisher is internal-only (PB Q16)","mobile-chrome","2026-04-21","passed","2026-04-21","PB: Author Profile Rules (PB §6.10, Q15, Q16)","product-bible.spec.ts","",""
"","1102","Documents category page loads without error","chromium","2026-04-21","failed","2026-04-21","Browse: Discover Sub-Categories","browse.spec.ts","",""
"","281","/admin/* returns 404 (not a redirect hint) per PB §11.6","chromium","2026-04-21","passed","2026-04-21","Smoke: Admin Route Hardening","smoke.spec.ts","",""
"","145","sitemap.xml is accessible","chromium","2026-04-21","passed","2026-04-21","API: Next.js Infrastructure","api.spec.ts","",""
"","3397","Homepage has a meta description","chromium","2026-04-21","passed","2026-04-21","SEO: Meta Tags","seo.spec.ts","",""
"","15651","Library page shows tabs: In Progress, Favorites, Finished, All My Books (PB §6.2)","chromium","2026-04-21","failed","2026-04-21","Browse: Authenticated User Flows","browse.spec.ts","",""
"","10743","Login page renders all required elements","chromium","2026-04-21","failed","2026-04-21","Auth: Login Page UI","auth.spec.ts","",""
"","318","Register responds within 5 seconds","chromium","2026-04-21","passed","2026-04-21","API: Response Time Benchmarks","api.spec.ts","",""
"","1676","/forums is protected — unauthenticated access redirects to login","chromium","2026-04-21","passed","2026-04-21","Security: Auth Protection","security.spec.ts","",""
"","1552","Discover Documents & Research (/discover/documents) returns 200 and loads","chromium","2026-04-21","passed","2026-04-21","Smoke: Public Pages Load","smoke.spec.ts","",""
"","1216","Junior add-on available to Free tier — not exclusive to paid tiers (PB §1.3, Q21)","chromium","2026-04-21","passed","2026-04-21","PB: Junior Add-On Model (PB §1.3, §2.3, Q21 — v4.6)","product-bible.spec.ts","",""
"","1398","Contact Us (/contact) returns 200 and loads","chromium","2026-04-21","passed","2026-04-21","Smoke: Public Pages Load","smoke.spec.ts","",""
"","230","/cms does not expose admin panel (PB §11.6)","chromium","2026-04-21","passed","2026-04-21","API: Admin Route Hardening (PB §11.6)","api.spec.ts","",""
"","1894","Footer contains company and support links (PB §5.2)","mobile-chrome","2026-04-21","passed","2026-04-21","PB: Web Navigation Structure (PB §5.2)","product-bible.spec.ts","",""
"","78","/forgot-password returns 200","chromium","2026-04-21","passed","2026-04-21","API: HTTP Status Codes","api.spec.ts","",""
"","776","Book Detail — DOMContentLoaded within 3s","chromium","2026-04-21","passed","2026-04-21","Performance: Page Load Times","performance.spec.ts","",""
"","681","Homepage loads on simulated slow 3G (African market priority — PB §4.5)","chromium","2026-04-21","passed","2026-04-21","Performance: Resource Loading","performance.spec.ts","",""
"","11768","Homepage has at least one book card visible","chromium","2026-04-21","failed","2026-04-21","Browse: Homepage Sections (PB §6.1)","browse.spec.ts","",""
"","15691","Logged-in Free user can access forums (PB Q14 — read + reply access)","chromium","2026-04-21","failed","2026-04-21","PB: Forum Access Rules (PB §6.6, Q14)","product-bible.spec.ts","",""
"","948","Body text is dark on light background (not low contrast)","chromium","2026-04-21","passed","2026-04-21","Accessibility: Colour Contrast","accessibility.spec.ts","",""
"","6165","Discover Books (/discover/books) returns 200 and loads","chromium","2026-04-21","passed","2026-04-21","Smoke: Public Pages Load","smoke.spec.ts","",""
"","2022","Junior is NOT presented as a default-included benefit of any tier (PB §1.3, Q21)","chromium","2026-04-21","passed","2026-04-21","PB: Subscription Tiers in UI (PB §1.3, v4.6)","product-bible.spec.ts","",""
"","863","/forums redirects unauthenticated user to /login","chromium","2026-04-21","passed","2026-04-21","Smoke: Auth-Gated Routes Redirect","smoke.spec.ts","",""
"","641","Login form inputs have labels","chromium","2026-04-21","failed","2026-04-21","Accessibility: Semantic HTML","accessibility.spec.ts","",""
"","2366","Author name is visible and clickable (Priority 1 per PB §6.3)","mobile-chrome","2026-04-21","failed","2026-04-21","Browse: Book Detail Page (PB §6.3)","browse.spec.ts","",""
"","1930","Blog (/blog) returns 200 and loads","mobile-chrome","2026-04-21","passed","2026-04-21","Smoke: Public Pages Load","smoke.spec.ts","",""
"","152","/settings without auth returns 200 with login content or redirects","chromium","2026-04-21","passed","2026-04-21","API: Auth-Gated Routes Return Redirect (not 200)","api.spec.ts","",""
"","993","Login — DOMContentLoaded within 3s","chromium","2026-04-21","passed","2026-04-21","Performance: Page Load Times","performance.spec.ts","",""
"","15547","Forums page requires login — redirects unauthenticated users (PB §6.6, Q14)","chromium","2026-04-21","failed","2026-04-21","Browse: Authenticated User Flows","browse.spec.ts","",""
"","114","robots.txt is present and allows crawling","chromium","2026-04-21","passed","2026-04-21","SEO: Technical SEO","seo.spec.ts","",""
"","4735","R2 signed URLs on homepage load successfully","chromium","2026-04-21","passed","2026-04-21","API: Cloudflare R2 Image Delivery","api.spec.ts","",""
"","169","/news returns 200","chromium","2026-04-21","passed","2026-04-21","API: HTTP Status Codes","api.spec.ts","",""
"","1709","Books category page loads without error","chromium","2026-04-21","failed","2026-04-21","Browse: Discover Sub-Categories","browse.spec.ts","",""
"","1766","News (/news) returns 200 and loads","mobile-chrome","2026-04-21","passed","2026-04-21","Smoke: Public Pages Load","smoke.spec.ts","",""
"","2691","Price or Free label is displayed (Priority 2 per PB §6.3)","mobile-chrome","2026-04-21","passed","2026-04-21","Browse: Book Detail Page (PB §6.3)","browse.spec.ts","",""
"","199","/discover/documents returns 200","chromium","2026-04-21","passed","2026-04-21","API: HTTP Status Codes","api.spec.ts","",""
"","1578","Careers (/careers) returns 200 and loads","mobile-chrome","2026-04-21","passed","2026-04-21","Smoke: Public Pages Load","smoke.spec.ts","",""
"","1628","Discover Books (/discover/books) returns 200 and loads","mobile-chrome","2026-04-21","passed","2026-04-21","Smoke: Public Pages Load","smoke.spec.ts","",""
"","977","Register — DOMContentLoaded within 3s","chromium","2026-04-21","passed","2026-04-21","Performance: Page Load Times","performance.spec.ts","",""
"","13204","Discover section includes: Books, Audiobooks, Periodicals, Comics, Documents","mobile-chrome","2026-04-21","failed","2026-04-21","PB: Web Navigation Structure (PB §5.2)","product-bible.spec.ts","",""
"","6893","Homepage — Cumulative Layout Shift (CLS) < 0.1","chromium","2026-04-21","passed","2026-04-21","Performance: Web Vitals (via Navigation API)","performance.spec.ts","",""
"","3080","Login with empty fields shows validation","chromium","2026-04-21","passed","2026-04-21","Auth: Login Page UI","auth.spec.ts","",""
"","1565","Forgot Password (/forgot-password) returns 200 and loads","mobile-chrome","2026-04-21","passed","2026-04-21","Smoke: Public Pages Load","smoke.spec.ts","",""
"","869","Site serves over HTTPS","chromium","2026-04-21","passed","2026-04-21","Smoke: SSL & Security Headers","smoke.spec.ts","",""
"","105","/contact returns 200","chromium","2026-04-21","passed","2026-04-21","API: HTTP Status Codes","api.spec.ts","",""
"","3559","Homepage renders Bestsellers section","mobile-chrome","2026-04-21","passed","2026-04-21","Browse: Homepage Sections (PB §6.1)","browse.spec.ts","",""
"","1945","Forums require login — unauthenticated visitors redirected (login is CTA per PB Q14)","mobile-chrome","2026-04-21","passed","2026-04-21","PB: Forum Access Rules (PB §6.6, Q14)","product-bible.spec.ts","",""
"","15723","Valid credentials log in and redirect to app","chromium","2026-04-21","failed","2026-04-21","Auth: Successful Login Flow","auth.spec.ts","",""
"","12044","Discover page loads and shows content","mobile-chrome","2026-04-21","failed","2026-04-21","Browse: Discover Screen (PB §6.8)","browse.spec.ts","",""
"","1875","Log In (/login) returns 200 and loads","mobile-chrome","2026-04-21","passed","2026-04-21","Smoke: Public Pages Load","smoke.spec.ts","",""
"","1997","Discover Periodicals (/discover/periodicals) returns 200 and loads","chromium","2026-04-21","passed","2026-04-21","Smoke: Public Pages Load","smoke.spec.ts","",""
"","394","/api/admin does not expose sensitive data","chromium","2026-04-21","passed","2026-04-21","Security: Admin Route Hardening (PB §11.6)","security.spec.ts","",""
"","1373","Terms of Service (/terms) returns 200 and loads","mobile-chrome","2026-04-21","passed","2026-04-21","Smoke: Public Pages Load","smoke.spec.ts","",""
"","11777","Discover page loads and shows content","chromium","2026-04-21","failed","2026-04-21","Browse: Discover Screen (PB §6.8)","browse.spec.ts","",""
"","1577","Sign Up (/register) returns 200 and loads","mobile-chrome","2026-04-21","passed","2026-04-21","Smoke: Public Pages Load","smoke.spec.ts","",""
"","2230","Book title is visible (Priority 1 per PB §6.3)","mobile-chrome","2026-04-21","failed","2026-04-21","Browse: Book Detail Page (PB §6.3)","browse.spec.ts","",""
"","2254","Preview/Sample button present (Priority 2 per PB §6.3 and §3.9)","mobile-chrome","2026-04-21","passed","2026-04-21","Browse: Book Detail Page (PB §6.3)","browse.spec.ts","",""
"","3483","Homepage has correct title tag","chromium","2026-04-21","passed","2026-04-21","SEO: Meta Tags","seo.spec.ts","",""
"","178","/press returns 200","chromium","2026-04-21","passed","2026-04-21","API: HTTP Status Codes","api.spec.ts","",""
"","1997","Cover image is large and prominent (Priority 1 per PB §6.3)","chromium","2026-04-21","failed","2026-04-21","Browse: Book Detail Page (PB §6.3)","browse.spec.ts","",""
"","2987","Primary colour #1EAEDB is used — banned #2CB5B5 must not appear (PB §10.2)","mobile-chrome","2026-04-21","passed","2026-04-21","PB: Brand Identity (§10.1, §10.2)","product-bible.spec.ts","",""
"","1820","Footer shows payment method logos (PB §5.2)","mobile-chrome","2026-04-21","passed","2026-04-21","PB: Web Navigation Structure (PB §5.2)","product-bible.spec.ts","",""
"","2034","Register — Full load within 5s","chromium","2026-04-21","passed","2026-04-21","Performance: Page Load Times","performance.spec.ts","",""
"","2257","Coral #E8735A used for section headers only — not CTA button fills (PB §10.2)","mobile-chrome","2026-04-21","passed","2026-04-21","PB: Home Screen Sections (PB §6.1)","product-bible.spec.ts","",""
"","11885","Sections use 'See More' / 'View All' links per PB §6.1 (max 10 per section)","chromium","2026-04-21","failed","2026-04-21","Browse: Homepage Sections (PB §6.1)","browse.spec.ts","",""
"","808","Login redirect param to external domain is ignored","chromium","2026-04-21","failed","2026-04-21","Security: Open Redirect Prevention","security.spec.ts","",""
"","1751","No 500 errors on any public page","chromium","2026-04-21","passed","2026-04-21","API: Next.js Infrastructure","api.spec.ts","",""
"","3361","Each book card has a cover image","mobile-chrome","2026-04-21","passed","2026-04-21","Browse: Homepage Sections (PB §6.1)","browse.spec.ts","",""
"","2018","Book detail page loads and is not a 404","chromium","2026-04-21","passed","2026-04-21","Browse: Book Detail Page (PB §6.3)","browse.spec.ts","",""
"","3108","'Junior' terminology used — not 'Kids' or 'Children' (PB §1.3)","mobile-chrome","2026-04-21","passed","2026-04-21","PB: Subscription Tiers in UI (PB §1.3, v4.6)","product-bible.spec.ts","",""
"","5655","Book cards show content type label (Book/Comic/Audiobook)","chromium","2026-04-21","passed","2026-04-21","Browse: Homepage Sections (PB §6.1)","browse.spec.ts","",""
"","148","Discover responds within 5 seconds","chromium","2026-04-21","passed","2026-04-21","API: Response Time Benchmarks","api.spec.ts","",""
"","13031","Homepage contains 'Discover More' or equivalent CTA","mobile-chrome","2026-04-21","failed","2026-04-21","Browse: Homepage Sections (PB §6.1)","browse.spec.ts","",""
"","5039","Homepage — Largest Contentful Paint (LCP) < 4s","chromium","2026-04-21","passed","2026-04-21","Performance: Web Vitals (via Navigation API)","performance.spec.ts","",""
"","1574","Discover Periodicals (/discover/periodicals) returns 200 and loads","mobile-chrome","2026-04-21","passed","2026-04-21","Smoke: Public Pages Load","smoke.spec.ts","",""
"","244","/.env.local does not expose sensitive data","chromium","2026-04-21","passed","2026-04-21","Security: Admin Route Hardening (PB §11.6)","security.spec.ts","",""
"","1075","/settings redirects unauthenticated user to /login","mobile-chrome","2026-04-21","passed","2026-04-21","Smoke: Auth-Gated Routes Redirect","smoke.spec.ts","",""
"","938","/discover loads within 5 seconds","chromium","2026-04-21","passed","2026-04-21","Smoke: Response Times","smoke.spec.ts","",""
"","854","HTTP redirects to HTTPS","chromium","2026-04-21","passed","2026-04-21","Smoke: SSL & Security Headers","smoke.spec.ts","",""
"","16412","Forums page requires login — redirects unauthenticated users (PB §6.6, Q14)","mobile-chrome","2026-04-21","failed","2026-04-21","Browse: Authenticated User Flows","browse.spec.ts","",""
"","301","/careers returns 200","chromium","2026-04-21","passed","2026-04-21","API: HTTP Status Codes","api.spec.ts","",""
"","1984","Guardian Dashboard is not linked to logged-out users (PB §5.3)","chromium","2026-04-21","passed","2026-04-21","PB: Junior Add-On Model (PB §1.3, §2.3, Q21 — v4.6)","product-bible.spec.ts","",""
"","1965","All images have alt text","chromium","2026-04-21","passed","2026-04-21","Accessibility: Semantic HTML","accessibility.spec.ts","",""
"","2706","Logo reads 'PAYGEES' (PB §10.1)","chromium","2026-04-21","passed","2026-04-21","PB: Brand Identity (§10.1, §10.2)","product-bible.spec.ts","",""
"","773","Page has exactly one h1 tag","chromium","2026-04-21","passed","2026-04-21","Accessibility: Semantic HTML","accessibility.spec.ts","",""
"","1919","Title and author displayed (Priority 1)","mobile-chrome","2026-04-21","failed","2026-04-21","PB: Book Detail Page Spec (PB §6.3)","product-bible.spec.ts","",""
"","43","robots.txt is accessible","chromium","2026-04-21","passed","2026-04-21","API: Next.js Infrastructure","api.spec.ts","",""
"","1733","Age rating appears on book detail (PB §2.4)","chromium","2026-04-21","failed","2026-04-21","PB: Book Detail Page Spec (PB §6.3)","product-bible.spec.ts","",""
"","837","No 'Publisher Profile' page — Publisher is internal-only (PB Q16)","chromium","2026-04-21","passed","2026-04-21","PB: Author Profile Rules (PB §6.10, Q15, Q16)","product-bible.spec.ts","",""
"","2443","Comics category page loads without error","mobile-chrome","2026-04-21","failed","2026-04-21","Browse: Discover Sub-Categories","browse.spec.ts","",""
"","1598","Press (/press) returns 200 and loads","chromium","2026-04-21","passed","2026-04-21","Smoke: Public Pages Load","smoke.spec.ts","",""
"","1538","Homepage — First Contentful Paint (FCP) < 3s","chromium","2026-04-21","passed","2026-04-21","Performance: Web Vitals (via Navigation API)","performance.spec.ts","",""
"","12934","Top navigation includes: Home, Library, News, Events, Forums","mobile-chrome","2026-04-21","failed","2026-04-21","PB: Web Navigation Structure (PB §5.2)","product-bible.spec.ts","",""
"","166","Response headers do not expose server technology details","chromium","2026-04-21","passed","2026-04-21","Security: Information Disclosure","security.spec.ts","",""
"","3153","Curated section uses 'Editor's Picks' — not 'Staff Picks' or 'Paygees Picks'","mobile-chrome","2026-04-21","passed","2026-04-21","PB: Editor's Picks Naming Canonical Rule (PB §6.1)","product-bible.spec.ts","",""
"","3272","Book detail page has a meta description","chromium","2026-04-21","passed","2026-04-21","SEO: Meta Tags","seo.spec.ts","",""
"","820","/ loads within 5 seconds","chromium","2026-04-21","passed","2026-04-21","Smoke: Response Times","smoke.spec.ts","",""
"","2255","File format names do NOT appear — never show EPUB/PDF/MP3 (PB §6.3)","mobile-chrome","2026-04-21","passed","2026-04-21","PB: Book Detail Page Spec (PB §6.3)","product-bible.spec.ts","",""
"","3041","Tagline 'Affordable | Accessible | Available' is present (PB §4.1)","mobile-chrome","2026-04-21","passed","2026-04-21","PB: Brand Identity (§10.1, §10.2)","product-bible.spec.ts","",""
"","1543","Forums page does not return a 500 error","chromium","2026-04-21","failed","2026-04-21","PB: Forum Access Rules (PB §6.6, Q14)","product-bible.spec.ts","",""
"","953","Register page includes T&C consent text per PB","chromium","2026-04-21","passed","2026-04-21","Auth: Registration Page UI","auth.spec.ts","",""
"","1229","All internal links use consistent domain (no mixed domains)","chromium","2026-04-21","passed","2026-04-21","SEO: Technical SEO","seo.spec.ts","",""
"","11806","Homepage contains 'Discover More' or equivalent CTA","chromium","2026-04-21","failed","2026-04-21","Browse: Homepage Sections (PB §6.1)","browse.spec.ts","",""
"","2073","Homepage book cover images load from R2","mobile-chrome","2026-04-21","passed","2026-04-21","Smoke: Image Delivery (Cloudflare R2)","smoke.spec.ts","",""
"","142","Security response headers are present","mobile-chrome","2026-04-21","passed","2026-04-21","Smoke: SSL & Security Headers","smoke.spec.ts","",""
"","1540","Contact Us (/contact) returns 200 and loads","mobile-chrome","2026-04-21","passed","2026-04-21","Smoke: Public Pages Load","smoke.spec.ts","",""
"","138","/wp-admin does not expose admin panel (PB §11.6)","chromium","2026-04-21","passed","2026-04-21","API: Admin Route Hardening (PB §11.6)","api.spec.ts","",""
"","2734","Admin routes not linked from main site (PB §5.3, §11.6)","mobile-chrome","2026-04-21","passed","2026-04-21","PB: Information Architecture (PB §5.3)","product-bible.spec.ts","",""
"","1841","Site title contains 'Paygees' (PB header)","chromium","2026-04-21","passed","2026-04-21","PB: Brand Identity (§10.1, §10.2)","product-bible.spec.ts","",""
"","1377","Privacy Policy (/privacy) returns 200 and loads","mobile-chrome","2026-04-21","passed","2026-04-21","Smoke: Public Pages Load","smoke.spec.ts","",""
"","1109","Login page includes Terms & Conditions and Privacy Policy links","chromium","2026-04-21","failed","2026-04-21","Auth: Login Page UI","auth.spec.ts","",""
"","2471","Homepage does not load excessive JavaScript (< 2MB total)","chromium","2026-04-21","passed","2026-04-21","Performance: Resource Loading","performance.spec.ts","",""
"","171","/discover/periodicals returns 200","chromium","2026-04-21","passed","2026-04-21","API: HTTP Status Codes","api.spec.ts","",""
"","2535","Junior add-on available to Free tier — not exclusive to paid tiers (PB §1.3, Q21)","mobile-chrome","2026-04-21","passed","2026-04-21","PB: Junior Add-On Model (PB §1.3, §2.3, Q21 — v4.6)","product-bible.spec.ts","",""
"","2336","Logged-out users see marketing/landing content on homepage","mobile-chrome","2026-04-21","passed","2026-04-21","PB: Information Architecture (PB §5.3)","product-bible.spec.ts","",""
"","1603","Logged-out users see marketing/landing content on homepage","chromium","2026-04-21","passed","2026-04-21","PB: Information Architecture (PB §5.3)","product-bible.spec.ts","",""
"","15747","Homepage has a canonical URL","chromium","2026-04-21","failed","2026-04-21","SEO: Canonical URLs","seo.spec.ts","",""
"","2017","Book title is visible (Priority 1 per PB §6.3)","chromium","2026-04-21","failed","2026-04-21","Browse: Book Detail Page (PB §6.3)","browse.spec.ts","",""
"","1253","Footer shows payment method logos (PB §5.2)","chromium","2026-04-21","passed","2026-04-21","PB: Web Navigation Structure (PB §5.2)","product-bible.spec.ts","",""
"","1613","No console errors on homepage","chromium","2026-04-21","failed","2026-04-21","Performance: Resource Loading","performance.spec.ts","",""
"","1468","Blog (/blog) returns 200 and loads","chromium","2026-04-21","passed","2026-04-21","Smoke: Public Pages Load","smoke.spec.ts","",""
"","1455","Section 'See More' links are present — max 10 per section (PB §6.1)","chromium","2026-04-21","failed","2026-04-21","PB: Home Screen Sections (PB §6.1)","product-bible.spec.ts","",""
"","299","/discover returns 200","chromium","2026-04-21","passed","2026-04-21","API: HTTP Status Codes","api.spec.ts","",""
"","15677","Login with wrong credentials shows error, not 500","chromium","2026-04-21","failed","2026-04-21","Auth: Login Page UI","auth.spec.ts","",""
"","744","Login redirect param cannot be used to redirect to external site","chromium","2026-04-21","failed","2026-04-21","Security: Open Redirect Prevention","security.spec.ts","",""
"","1402","Coral #E8735A used for section headers only — not CTA button fills (PB §10.2)","chromium","2026-04-21","passed","2026-04-21","PB: Home Screen Sections (PB §6.1)","product-bible.spec.ts","",""
"","135","/library without auth returns 200 with login content or redirects","chromium","2026-04-21","passed","2026-04-21","API: Auth-Gated Routes Return Redirect (not 200)","api.spec.ts","",""
"","1484","Publisher Dashboard not linked from public homepage (PB §5.3)","chromium","2026-04-21","passed","2026-04-21","PB: Information Architecture (PB §5.3)","product-bible.spec.ts","",""
"","1958","Junior is not presented as a comparable standalone subscription tier","chromium","2026-04-21","passed","2026-04-21","PB: Junior Add-On Model (PB §1.3, §2.3, Q21 — v4.6)","product-bible.spec.ts","",""
"","3532","Home (/) returns 200 and loads","chromium","2026-04-21","passed","2026-04-21","Smoke: Public Pages Load","smoke.spec.ts","",""
"","15796","Login page has noindex or appropriate meta (auth pages shouldn't be indexed)","chromium","2026-04-21","failed","2026-04-21","SEO: Meta Tags","seo.spec.ts","",""
"","1601","Discover Comics & Illustrations (/discover/comics) returns 200 and loads","mobile-chrome","2026-04-21","passed","2026-04-21","Smoke: Public Pages Load","smoke.spec.ts","",""
"","3030","Discover — Full load within 5s","chromium","2026-04-21","passed","2026-04-21","Performance: Page Load Times","performance.spec.ts","",""
"","3446","Tagline 'Affordable | Accessible | Available' is present (PB §4.1)","chromium","2026-04-21","passed","2026-04-21","PB: Brand Identity (§10.1, §10.2)","product-bible.spec.ts","",""
"","1211","Homepage has OG title","chromium","2026-04-21","passed","2026-04-21","SEO: Open Graph Tags","seo.spec.ts","",""
"","3471","Book cards show content type label (Book/Comic/Audiobook)","mobile-chrome","2026-04-21","passed","2026-04-21","Browse: Homepage Sections (PB §6.1)","browse.spec.ts","",""
"","3062","Homepage — Full load within 5s","chromium","2026-04-21","passed","2026-04-21","Performance: Page Load Times","performance.spec.ts","",""
"","2097","Navigation links are focusable with Tab","chromium","2026-04-21","passed","2026-04-21","Accessibility: Keyboard Navigation","accessibility.spec.ts","",""
"","15760","Sign Out is in profile dropdown only — not in top bar directly (PB §5.2)","mobile-chrome","2026-04-21","failed","2026-04-21","PB: Information Architecture (PB §5.3)","product-bible.spec.ts","",""
"","1427","Documents category page loads without error","mobile-chrome","2026-04-21","failed","2026-04-21","Browse: Discover Sub-Categories","browse.spec.ts","",""
"","1034","/forums redirects unauthenticated user to /login","mobile-chrome","2026-04-21","passed","2026-04-21","Smoke: Auth-Gated Routes Redirect","smoke.spec.ts","",""
