"DESCRIPTION","DURATION IN MS","NAME","PARENT SUITE","START TIME","STATUS","STOP TIME","SUB SUITE","SUITE","TEST CLASS","TEST METHOD"
"","3446","Book detail page has a meta description","chromium","2026-03-28","passed","2026-03-28","SEO: Meta Tags","seo.spec.ts","",""
"","1656","Discover category navigation links are present","mobile-chrome","2026-03-28","passed","2026-03-28","Browse: Discover Screen (PB §6.8)","browse.spec.ts","",""
"","1819","Contact Us (/contact) returns 200 and loads","chromium","2026-03-28","passed","2026-03-28","Smoke: Public Pages Load","smoke.spec.ts","",""
"","5350","Discover (/discover) returns 200 and loads","chromium","2026-03-28","passed","2026-03-28","Smoke: Public Pages Load","smoke.spec.ts","",""
"","1336","Forgot Password (/forgot-password) returns 200 and loads","mobile-chrome","2026-03-28","passed","2026-03-28","Smoke: Public Pages Load","smoke.spec.ts","",""
"","11930","Sections use 'See More' / 'View All' links per PB §6.1 (max 10 per section)","chromium","2026-03-28","failed","2026-03-28","Browse: Homepage Sections (PB §6.1)","browse.spec.ts","",""
"","326","/discover/documents returns 200","chromium","2026-03-28","passed","2026-03-28","API: HTTP Status Codes","api.spec.ts","",""
"","3771","/library is protected — unauthenticated access redirects to login","chromium","2026-03-28","passed","2026-03-28","Security: Auth Protection","security.spec.ts","",""
"","1107","Library page has search within library (PB §6.2)","mobile-chrome","2026-03-28","failed","2026-03-28","Browse: Authenticated User Flows","browse.spec.ts","",""
"","2575","'Junior' terminology used — not 'Kids' or 'Children' (PB §1.3)","mobile-chrome","2026-03-28","passed","2026-03-28","PB: Subscription Tiers in UI (PB §1.3, v4.6)","product-bible.spec.ts","",""
"","283","/forums without auth returns 200 with login content or redirects","chromium","2026-03-28","passed","2026-03-28","API: Auth-Gated Routes Return Redirect (not 200)","api.spec.ts","",""
"","168","/.env does not expose sensitive data","chromium","2026-03-28","passed","2026-03-28","Security: Admin Route Hardening (PB §11.6)","security.spec.ts","",""
"","1735","Free label appears for free books (PB §1.3)","mobile-chrome","2026-03-28","failed","2026-03-28","PB: Book Detail Page Spec (PB §6.3)","product-bible.spec.ts","",""
"","1383","Privacy Policy (/privacy) returns 200 and loads","mobile-chrome","2026-03-28","passed","2026-03-28","Smoke: Public Pages Load","smoke.spec.ts","",""
"","1625","Blog (/blog) returns 200 and loads","chromium","2026-03-28","passed","2026-03-28","Smoke: Public Pages Load","smoke.spec.ts","",""
"","1555","Guardian Dashboard is not linked to logged-out users (PB §5.3)","chromium","2026-03-28","passed","2026-03-28","PB: Junior Add-On Model (PB §1.3, §2.3, Q21 — v4.6)","product-bible.spec.ts","",""
"","1783","Age rating appears on book detail (PB §2.4)","mobile-chrome","2026-03-28","failed","2026-03-28","PB: Book Detail Page Spec (PB §6.3)","product-bible.spec.ts","",""
"","128","/admin/finance does not expose sensitive data","chromium","2026-03-28","passed","2026-03-28","Security: Admin Route Hardening (PB §11.6)","security.spec.ts","",""
"","37","favicon is served","chromium","2026-03-28","passed","2026-03-28","API: Next.js Infrastructure","api.spec.ts","",""
"","2511","Discover — DOMContentLoaded within 3s","chromium","2026-03-28","passed","2026-03-28","Performance: Page Load Times","performance.spec.ts","",""
"","239","/privacy returns 200","chromium","2026-03-28","passed","2026-03-28","API: HTTP Status Codes","api.spec.ts","",""
"","1811","Sign Up (/register) returns 200 and loads","chromium","2026-03-28","passed","2026-03-28","Smoke: Public Pages Load","smoke.spec.ts","",""
"","1494","All images have alt text","chromium","2026-03-28","passed","2026-03-28","Accessibility: Semantic HTML","accessibility.spec.ts","",""
"","1939","Discover Documents & Research (/discover/documents) returns 200 and loads","chromium","2026-03-28","passed","2026-03-28","Smoke: Public Pages Load","smoke.spec.ts","",""
"","12047","Cover image is large and prominent (Priority 1)","mobile-chrome","2026-03-28","failed","2026-03-28","PB: Book Detail Page Spec (PB §6.3)","product-bible.spec.ts","",""
"","3314","/ loads within 5 seconds","mobile-chrome","2026-03-28","passed","2026-03-28","Smoke: Response Times","smoke.spec.ts","",""
"","278","/settings without auth returns 200 with login content or redirects","chromium","2026-03-28","passed","2026-03-28","API: Auth-Gated Routes Return Redirect (not 200)","api.spec.ts","",""
"","1277","Books category page loads without error","mobile-chrome","2026-03-28","failed","2026-03-28","Browse: Discover Sub-Categories","browse.spec.ts","",""
"","168","/blog returns 200","chromium","2026-03-28","passed","2026-03-28","API: HTTP Status Codes","api.spec.ts","",""
"","1094","Library page shows tabs: In Progress, Favorites, Finished, All My Books (PB §6.2)","mobile-chrome","2026-03-28","failed","2026-03-28","Browse: Authenticated User Flows","browse.spec.ts","",""
"","11963","Homepage contains 'Discover More' or equivalent CTA","chromium","2026-03-28","failed","2026-03-28","Browse: Homepage Sections (PB §6.1)","browse.spec.ts","",""
"","1635","Curated section uses 'Editor's Picks' — not 'Staff Picks' or 'Paygees Picks'","chromium","2026-03-28","passed","2026-03-28","PB: Editor's Picks Naming Canonical Rule (PB §6.1)","product-bible.spec.ts","",""
"","11378","Homepage has at least one book card visible","chromium","2026-03-28","failed","2026-03-28","Browse: Homepage Sections (PB §6.1)","browse.spec.ts","",""
"","564","Book Detail — DOMContentLoaded within 3s","chromium","2026-03-28","passed","2026-03-28","Performance: Page Load Times","performance.spec.ts","",""
"","662","/library redirects unauthenticated user to /login","mobile-chrome","2026-03-28","passed","2026-03-28","Smoke: Auth-Gated Routes Redirect","smoke.spec.ts","",""
"","11801","Top navigation includes: Home, Library, News, Events, Forums","chromium","2026-03-28","failed","2026-03-28","PB: Web Navigation Structure (PB §5.2)","product-bible.spec.ts","",""
"","1379","Audiobooks category page loads without error","mobile-chrome","2026-03-28","failed","2026-03-28","Browse: Discover Sub-Categories","browse.spec.ts","",""
"","1318","Periodicals category page loads without error","chromium","2026-03-28","failed","2026-03-28","Browse: Discover Sub-Categories","browse.spec.ts","",""
"","625","Sign Out is in profile dropdown only — not in top bar directly (PB §5.2)","chromium","2026-03-28","failed","2026-03-28","PB: Information Architecture (PB §5.3)","product-bible.spec.ts","",""
"","645","Register — DOMContentLoaded within 3s","chromium","2026-03-28","passed","2026-03-28","Performance: Page Load Times","performance.spec.ts","",""
"","854","Error pages do not expose stack traces","chromium","2026-03-28","passed","2026-03-28","Security: Information Disclosure","security.spec.ts","",""
"","2092","Cookies have appropriate flags","chromium","2026-03-28","passed","2026-03-28","API: Security Headers","api.spec.ts","",""
"","1314","Forgot password page renders email input and submit","chromium","2026-03-28","failed","2026-03-28","Auth: Forgot Password Flow","auth.spec.ts","",""
"","1724","Discover Books (/discover/books) returns 200 and loads","mobile-chrome","2026-03-28","passed","2026-03-28","Smoke: Public Pages Load","smoke.spec.ts","",""
"","2312","Homepage has a meta description","chromium","2026-03-28","passed","2026-03-28","SEO: Meta Tags","seo.spec.ts","",""
"","170","Homepage includes content security or transport headers","chromium","2026-03-28","passed","2026-03-28","API: Security Headers","api.spec.ts","",""
"","314","/press returns 200","chromium","2026-03-28","passed","2026-03-28","API: HTTP Status Codes","api.spec.ts","",""
"","2377","All internal links use HTTPS or relative paths","chromium","2026-03-28","passed","2026-03-28","Security: HTTPS Enforcement","security.spec.ts","",""
"","161","/.env.local does not expose sensitive data","chromium","2026-03-28","passed","2026-03-28","Security: Admin Route Hardening (PB §11.6)","security.spec.ts","",""
"","1229","Sign Out is in profile dropdown only — not in top bar directly (PB §5.2)","mobile-chrome","2026-03-28","failed","2026-03-28","PB: Information Architecture (PB §5.3)","product-bible.spec.ts","",""
"","1423","Forums (/forums) returns 200 and loads","mobile-chrome","2026-03-28","passed","2026-03-28","Smoke: Public Pages Load","smoke.spec.ts","",""
"","1719","Forgot Password (/forgot-password) returns 200 and loads","chromium","2026-03-28","passed","2026-03-28","Smoke: Public Pages Load","smoke.spec.ts","",""
"","240","/dashboard/admin does not expose admin panel (PB §11.6)","chromium","2026-03-28","passed","2026-03-28","API: Admin Route Hardening (PB §11.6)","api.spec.ts","",""
"","268","Discover responds within 5 seconds","chromium","2026-03-28","passed","2026-03-28","API: Response Time Benchmarks","api.spec.ts","",""
"","787","Login redirect param to external domain is ignored","chromium","2026-03-28","failed","2026-03-28","Security: Open Redirect Prevention","security.spec.ts","",""
"","12904","Sections use 'See More' / 'View All' links per PB §6.1 (max 10 per section)","mobile-chrome","2026-03-28","failed","2026-03-28","Browse: Homepage Sections (PB §6.1)","browse.spec.ts","",""
"","1584","Title and author displayed (Priority 1)","chromium","2026-03-28","failed","2026-03-28","PB: Book Detail Page Spec (PB §6.3)","product-bible.spec.ts","",""
"","11690","Discover page loads and shows content","mobile-chrome","2026-03-28","failed","2026-03-28","Browse: Discover Screen (PB §6.8)","browse.spec.ts","",""
"","2619","Primary colour #1EAEDB is used — banned #2CB5B5 must not appear (PB §10.2)","mobile-chrome","2026-03-28","passed","2026-03-28","PB: Brand Identity (§10.1, §10.2)","product-bible.spec.ts","",""
"","442","/discover returns 200","chromium","2026-03-28","passed","2026-03-28","API: HTTP Status Codes","api.spec.ts","",""
"","334","Security response headers are present","chromium","2026-03-28","passed","2026-03-28","Smoke: SSL & Security Headers","smoke.spec.ts","",""
"","3879","Primary colour #1EAEDB is used — banned #2CB5B5 must not appear (PB §10.2)","chromium","2026-03-28","passed","2026-03-28","PB: Brand Identity (§10.1, §10.2)","product-bible.spec.ts","",""
"","1663","Book title is visible (Priority 1 per PB §6.3)","chromium","2026-03-28","failed","2026-03-28","Browse: Book Detail Page (PB §6.3)","browse.spec.ts","",""
"","2100","Search input does not reflect raw HTML (basic XSS check)","chromium","2026-03-28","passed","2026-03-28","Security: XSS Prevention","security.spec.ts","",""
"","1660","Forums page does not return a 500 error","chromium","2026-03-28","failed","2026-03-28","PB: Forum Access Rules (PB §6.6, Q14)","product-bible.spec.ts","",""
"","1709","Discover Periodicals (/discover/periodicals) returns 200 and loads","mobile-chrome","2026-03-28","passed","2026-03-28","Smoke: Public Pages Load","smoke.spec.ts","",""
"","268","/discover/periodicals returns 200","chromium","2026-03-28","passed","2026-03-28","API: HTTP Status Codes","api.spec.ts","",""
"","1966","Tagline 'Affordable | Accessible | Available' is present (PB §4.1)","mobile-chrome","2026-03-28","failed","2026-03-28","PB: Brand Identity (§10.1, §10.2)","product-bible.spec.ts","",""
"","1472","Discover category navigation links are present","chromium","2026-03-28","passed","2026-03-28","Browse: Discover Screen (PB §6.8)","browse.spec.ts","",""
"","1015","/register loads within 5 seconds","chromium","2026-03-28","passed","2026-03-28","Smoke: Response Times","smoke.spec.ts","",""
"","13248","Top navigation includes: Home, Library, News, Events, Forums","mobile-chrome","2026-03-28","failed","2026-03-28","PB: Web Navigation Structure (PB §5.2)","product-bible.spec.ts","",""
"","16566","'Creator' term does not appear in UI — banned platform-wide per PB Q16","chromium","2026-03-28","passed","2026-03-28","PB: Brand Identity (§10.1, §10.2)","product-bible.spec.ts","",""
"","1566","Footer shows payment method logos (PB §5.2)","chromium","2026-03-28","failed","2026-03-28","PB: Web Navigation Structure (PB §5.2)","product-bible.spec.ts","",""
"","10513","Homepage has a main landmark","chromium","2026-03-28","failed","2026-03-28","Accessibility: Semantic HTML","accessibility.spec.ts","",""
"","1523","Forums require login — unauthenticated visitors redirected (login is CTA per PB Q14)","mobile-chrome","2026-03-28","passed","2026-03-28","PB: Forum Access Rules (PB §6.6, Q14)","product-bible.spec.ts","",""
"","1118","Junior add-on available to Free tier — not exclusive to paid tiers (PB §1.3, Q21)","chromium","2026-03-28","passed","2026-03-28","PB: Junior Add-On Model (PB §1.3, §2.3, Q21 — v4.6)","product-bible.spec.ts","",""
"","5070","Discover Books (/discover/books) returns 200 and loads","chromium","2026-03-28","passed","2026-03-28","Smoke: Public Pages Load","smoke.spec.ts","",""
"","2812","Submitting forgot password with valid email shows confirmation, not error","chromium","2026-03-28","failed","2026-03-28","Auth: Forgot Password Flow","auth.spec.ts","",""
"","2200","Homepage has correct title tag","chromium","2026-03-28","passed","2026-03-28","SEO: Meta Tags","seo.spec.ts","",""
"","1886","Forums page does not return a 500 error","mobile-chrome","2026-03-28","failed","2026-03-28","PB: Forum Access Rules (PB §6.6, Q14)","product-bible.spec.ts","",""
"","1592","Discover Documents & Research (/discover/documents) returns 200 and loads","mobile-chrome","2026-03-28","passed","2026-03-28","Smoke: Public Pages Load","smoke.spec.ts","",""
"","1336","Log In (/login) returns 200 and loads","mobile-chrome","2026-03-28","passed","2026-03-28","Smoke: Public Pages Load","smoke.spec.ts","",""
"","768","Login redirect param cannot be used to redirect to external site","chromium","2026-03-28","failed","2026-03-28","Security: Open Redirect Prevention","security.spec.ts","",""
"","2056","Footer contains company and support links (PB §5.2)","mobile-chrome","2026-03-28","passed","2026-03-28","PB: Web Navigation Structure (PB §5.2)","product-bible.spec.ts","",""
"","1702","Logged-out users see marketing/landing content on homepage","chromium","2026-03-28","passed","2026-03-28","PB: Information Architecture (PB §5.3)","product-bible.spec.ts","",""
"","1979","Footer contains copyright notice for The Book Crunch Limited","mobile-chrome","2026-03-28","passed","2026-03-28","PB: Web Navigation Structure (PB §5.2)","product-bible.spec.ts","",""
"","423","/admin/* returns 404 (not a redirect hint) per PB §11.6","chromium","2026-03-28","passed","2026-03-28","Smoke: Admin Route Hardening","smoke.spec.ts","",""
"","3204","Junior is not presented as a comparable standalone subscription tier","mobile-chrome","2026-03-28","passed","2026-03-28","PB: Junior Add-On Model (PB §1.3, §2.3, Q21 — v4.6)","product-bible.spec.ts","",""
"","1709","Author profile pages use /author/ route (PB §6.10)","chromium","2026-03-28","passed","2026-03-28","PB: Author Profile Rules (PB §6.10, Q15, Q16)","product-bible.spec.ts","",""
"","1929","Careers (/careers) returns 200 and loads","chromium","2026-03-28","passed","2026-03-28","Smoke: Public Pages Load","smoke.spec.ts","",""
"","1605","After login, Sign Out is in profile dropdown only per PB §5.2","chromium","2026-03-28","failed","2026-03-28","Auth: Successful Login Flow","auth.spec.ts","",""
"","1371","Login page includes Terms & Conditions and Privacy Policy links","chromium","2026-03-28","failed","2026-03-28","Auth: Login Page UI","auth.spec.ts","",""
"","1029","Documents category page loads without error","chromium","2026-03-28","failed","2026-03-28","Browse: Discover Sub-Categories","browse.spec.ts","",""
"","566","Forums page requires login — redirects unauthenticated users (PB §6.6, Q14)","chromium","2026-03-28","failed","2026-03-28","Browse: Authenticated User Flows","browse.spec.ts","",""
"","984","Valid credentials log in and redirect to app","chromium","2026-03-28","failed","2026-03-28","Auth: Successful Login Flow","auth.spec.ts","",""
"","587","Login form is navigable by keyboard","chromium","2026-03-28","failed","2026-03-28","Accessibility: Keyboard Navigation","accessibility.spec.ts","",""
"","11345","Cover image is large and prominent (Priority 1 per PB §6.3)","chromium","2026-03-28","failed","2026-03-28","Browse: Book Detail Page (PB §6.3)","browse.spec.ts","",""
"","398","/forums returns 200","chromium","2026-03-28","passed","2026-03-28","API: HTTP Status Codes","api.spec.ts","",""
"","440","/admin/* returns 404 (not a redirect hint) per PB §11.6","mobile-chrome","2026-03-28","passed","2026-03-28","Smoke: Admin Route Hardening","smoke.spec.ts","",""
"","1650","Card details are never displayed in any page response (PB §11.5)","chromium","2026-03-28","passed","2026-03-28","Security: Cookie Configuration (PB §11.5)","security.spec.ts","",""
"","1702","Register — Full load within 5s","chromium","2026-03-28","passed","2026-03-28","Performance: Page Load Times","performance.spec.ts","",""
"","164","/login returns 200","chromium","2026-03-28","passed","2026-03-28","API: HTTP Status Codes","api.spec.ts","",""
"","1154","Logged-in Free user can access forums (PB Q14 — read + reply access)","mobile-chrome","2026-03-28","failed","2026-03-28","PB: Forum Access Rules (PB §6.6, Q14)","product-bible.spec.ts","",""
"","1145","Homepage has OG title","chromium","2026-03-28","passed","2026-03-28","SEO: Open Graph Tags","seo.spec.ts","",""
"","11848","Cover image is large and prominent (Priority 1)","chromium","2026-03-28","failed","2026-03-28","PB: Book Detail Page Spec (PB §6.3)","product-bible.spec.ts","",""
"","435","/discover/books returns 200","chromium","2026-03-28","passed","2026-03-28","API: HTTP Status Codes","api.spec.ts","",""
"","1785","Forums require login — unauthenticated visitors redirected (login is CTA per PB Q14)","chromium","2026-03-28","passed","2026-03-28","PB: Forum Access Rules (PB §6.6, Q14)","product-bible.spec.ts","",""
"","811","Interactive elements show visible focus ring","chromium","2026-03-28","passed","2026-03-28","Accessibility: Focus Indicators","accessibility.spec.ts","",""
"","11932","Homepage has at least one book card visible","mobile-chrome","2026-03-28","failed","2026-03-28","Browse: Homepage Sections (PB §6.1)","browse.spec.ts","",""
"","1286","HTTP redirects to HTTPS","chromium","2026-03-28","passed","2026-03-28","Smoke: SSL & Security Headers","smoke.spec.ts","",""
"","1842","Free label appears for free books (PB §1.3)","chromium","2026-03-28","failed","2026-03-28","PB: Book Detail Page Spec (PB §6.3)","product-bible.spec.ts","",""
"","3353","Logo reads 'PAYGEES' (PB §10.1)","chromium","2026-03-28","passed","2026-03-28","PB: Brand Identity (§10.1, §10.2)","product-bible.spec.ts","",""
"","1240","Site serves over HTTPS","chromium","2026-03-28","passed","2026-03-28","Smoke: SSL & Security Headers","smoke.spec.ts","",""
"","1693","'Junior' terminology used — not 'Kids' or 'Children' (PB §1.3)","chromium","2026-03-28","passed","2026-03-28","PB: Subscription Tiers in UI (PB §1.3, v4.6)","product-bible.spec.ts","",""
"","2306","Junior is NOT presented as a default-included benefit of any tier (PB §1.3, Q21)","mobile-chrome","2026-03-28","passed","2026-03-28","PB: Subscription Tiers in UI (PB §1.3, v4.6)","product-bible.spec.ts","",""
"","1353","Preview/Sample button present (Priority 2 per PB §6.3 and §3.9)","chromium","2026-03-28","passed","2026-03-28","Browse: Book Detail Page (PB §6.3)","browse.spec.ts","",""
"","2023","Book detail page loads and is not a 404","mobile-chrome","2026-03-28","passed","2026-03-28","Browse: Book Detail Page (PB §6.3)","browse.spec.ts","",""
"","3597","Login with empty fields shows validation","chromium","2026-03-28","passed","2026-03-28","Auth: Login Page UI","auth.spec.ts","",""
"","1880","No 500 errors on any public page","chromium","2026-03-28","passed","2026-03-28","API: Next.js Infrastructure","api.spec.ts","",""
"","1237","Forgot password link navigates to /forgot-password","chromium","2026-03-28","passed","2026-03-28","Auth: Login Page UI","auth.spec.ts","",""
"","872","Pricing page (if exists) shows the 4 main tiers: Free, Basic, Standard, Premium","chromium","2026-03-28","failed","2026-03-28","PB: Subscription Tiers in UI (PB §1.3, v4.6)","product-bible.spec.ts","",""
"","17027","Book detail page has OG tags with book info","chromium","2026-03-28","failed","2026-03-28","SEO: Open Graph Tags","seo.spec.ts","",""
"","1812","Log In (/login) returns 200 and loads","chromium","2026-03-28","passed","2026-03-28","Smoke: Public Pages Load","smoke.spec.ts","",""
"","3003","Publisher Dashboard not linked from public homepage (PB §5.3)","mobile-chrome","2026-03-28","passed","2026-03-28","PB: Information Architecture (PB §5.3)","product-bible.spec.ts","",""
"","1602","Book title is visible (Priority 1 per PB §6.3)","mobile-chrome","2026-03-28","failed","2026-03-28","Browse: Book Detail Page (PB §6.3)","browse.spec.ts","",""
"","1672","Admin routes not linked from main site (PB §5.3, §11.6)","chromium","2026-03-28","passed","2026-03-28","PB: Information Architecture (PB §5.3)","product-bible.spec.ts","",""
"","2589","No EPUB / PDF / MP3 format names appear in UI (PB §10.5)","mobile-chrome","2026-03-28","passed","2026-03-28","PB: Home Screen Sections (PB §6.1)","product-bible.spec.ts","",""
"","165","Homepage responds within 5 seconds","chromium","2026-03-28","passed","2026-03-28","API: Response Time Benchmarks","api.spec.ts","",""
"","982","Clicking a book card navigates to book detail page","chromium","2026-03-28","failed","2026-03-28","Browse: Authenticated User Flows","browse.spec.ts","",""
"","6548","Homepage — Cumulative Layout Shift (CLS) < 0.1","chromium","2026-03-28","passed","2026-03-28","Performance: Web Vitals (via Navigation API)","performance.spec.ts","",""
"","1716","Book Detail — Full load within 5s","chromium","2026-03-28","passed","2026-03-28","Performance: Page Load Times","performance.spec.ts","",""
"","2013","Homepage — DOMContentLoaded within 3s","chromium","2026-03-28","passed","2026-03-28","Performance: Page Load Times","performance.spec.ts","",""
"","1319","Comics category page loads without error","mobile-chrome","2026-03-28","failed","2026-03-28","Browse: Discover Sub-Categories","browse.spec.ts","",""
"","3547","Book cards show content type label (Book/Comic/Audiobook)","mobile-chrome","2026-03-28","passed","2026-03-28","Browse: Homepage Sections (PB §6.1)","browse.spec.ts","",""
"","2965","Guardian Dashboard is not linked to logged-out users (PB §5.3)","mobile-chrome","2026-03-28","passed","2026-03-28","PB: Junior Add-On Model (PB §1.3, §2.3, Q21 — v4.6)","product-bible.spec.ts","",""
"","1617","Login — Full load within 5s","chromium","2026-03-28","passed","2026-03-28","Performance: Page Load Times","performance.spec.ts","",""
"","1851","No EPUB / PDF / MP3 format names appear in UI (PB §10.5)","chromium","2026-03-28","passed","2026-03-28","PB: Home Screen Sections (PB §6.1)","product-bible.spec.ts","",""
"","3376","Site title contains 'Paygees' (PB header)","chromium","2026-03-28","passed","2026-03-28","PB: Brand Identity (§10.1, §10.2)","product-bible.spec.ts","",""
"","401","/discover/audiobooks returns 200","chromium","2026-03-28","passed","2026-03-28","API: HTTP Status Codes","api.spec.ts","",""
