"DESCRIPTION","DURATION IN MS","NAME","PARENT SUITE","START TIME","STATUS","STOP TIME","SUB SUITE","SUITE","TEST CLASS","TEST METHOD"
"","154","/forums without auth returns 200 with login content or redirects","chromium","2026-04-21","passed","2026-04-21","API: Auth-Gated Routes Return Redirect (not 200)","api.spec.ts","",""
"","1957","/library is protected — unauthenticated access redirects to login","chromium","2026-04-21","passed","2026-04-21","Security: Auth Protection","security.spec.ts","",""
"","12934","Sections use 'See More' / 'View All' links per PB §6.1 (max 10 per section)","mobile-chrome","2026-04-21","failed","2026-04-21","Browse: Homepage Sections (PB §6.1)","browse.spec.ts","",""
"","1869","Forums page does not return a 500 error","mobile-chrome","2026-04-21","failed","2026-04-21","PB: Forum Access Rules (PB §6.6, Q14)","product-bible.spec.ts","",""
"","153","/forums returns 200","chromium","2026-04-21","passed","2026-04-21","API: HTTP Status Codes","api.spec.ts","",""
"","2134","Search input does not reflect raw HTML (basic XSS check)","chromium","2026-04-21","passed","2026-04-21","Security: XSS Prevention","security.spec.ts","",""
"","1628","Forgot password link navigates to /forgot-password","chromium","2026-04-21","passed","2026-04-21","Auth: Login Page UI","auth.spec.ts","",""
"","16190","Library page shows tabs: In Progress, Favorites, Finished, All My Books (PB §6.2)","mobile-chrome","2026-04-21","failed","2026-04-21","Browse: Authenticated User Flows","browse.spec.ts","",""
"","1633","Content type shown as icon/label — NOT file format (PB §6.3, §10.5)","chromium","2026-04-21","passed","2026-04-21","Browse: Book Detail Page (PB §6.3)","browse.spec.ts","",""
"","1700","Footer contains copyright notice for The Book Crunch Limited","mobile-chrome","2026-04-21","passed","2026-04-21","PB: Web Navigation Structure (PB §5.2)","product-bible.spec.ts","",""
"","1638","Age rating is displayed (PB §2.4)","mobile-chrome","2026-04-21","failed","2026-04-21","Browse: Book Detail Page (PB §6.3)","browse.spec.ts","",""
"","1419","About Paygees (/about) returns 200 and loads","mobile-chrome","2026-04-21","passed","2026-04-21","Smoke: Public Pages Load","smoke.spec.ts","",""
"","2827","Submitting forgot password with valid email shows confirmation, not error","chromium","2026-04-21","failed","2026-04-21","Auth: Forgot Password Flow","auth.spec.ts","",""
"","11852","Homepage has at least one book card visible","mobile-chrome","2026-04-21","failed","2026-04-21","Browse: Homepage Sections (PB §6.1)","browse.spec.ts","",""
"","137","Homepage responds within 5 seconds","chromium","2026-04-21","passed","2026-04-21","API: Response Time Benchmarks","api.spec.ts","",""
"","869","Interactive elements show visible focus ring","chromium","2026-04-21","passed","2026-04-21","Accessibility: Focus Indicators","accessibility.spec.ts","",""
"","1429","Discover category navigation links are present","chromium","2026-04-21","passed","2026-04-21","Browse: Discover Screen (PB §6.8)","browse.spec.ts","",""
"","1782","Author profile pages use /author/ route (PB §6.10)","chromium","2026-04-21","passed","2026-04-21","PB: Author Profile Rules (PB §6.10, Q15, Q16)","product-bible.spec.ts","",""
"","307","Security response headers are present","chromium","2026-04-21","passed","2026-04-21","Smoke: SSL & Security Headers","smoke.spec.ts","",""
"","10542","Homepage has a main landmark","chromium","2026-04-21","failed","2026-04-21","Accessibility: Semantic HTML","accessibility.spec.ts","",""
"","1974","Curated section uses 'Editor's Picks' — not 'Staff Picks' or 'Paygees Picks'","chromium","2026-04-21","passed","2026-04-21","PB: Editor's Picks Naming Canonical Rule (PB §6.1)","product-bible.spec.ts","",""
"","1211","Footer contains copyright notice for The Book Crunch Limited","chromium","2026-04-21","passed","2026-04-21","PB: Web Navigation Structure (PB §5.2)","product-bible.spec.ts","",""
"","1379","/login loads within 5 seconds","mobile-chrome","2026-04-21","passed","2026-04-21","Smoke: Response Times","smoke.spec.ts","",""
"","2296","Site title contains 'Paygees' (PB header)","mobile-chrome","2026-04-21","passed","2026-04-21","PB: Brand Identity (§10.1, §10.2)","product-bible.spec.ts","",""
"","87","/admin does not expose admin panel (PB §11.6)","chromium","2026-04-21","passed","2026-04-21","API: Admin Route Hardening (PB §11.6)","api.spec.ts","",""
"","5617","Discover (/discover) returns 200 and loads","chromium","2026-04-21","passed","2026-04-21","Smoke: Public Pages Load","smoke.spec.ts","",""
"","147","/login returns 200","chromium","2026-04-21","passed","2026-04-21","API: HTTP Status Codes","api.spec.ts","",""
"","107","Login responds within 5 seconds","chromium","2026-04-21","passed","2026-04-21","API: Response Time Benchmarks","api.spec.ts","",""
"","15654","Sign Out is in profile dropdown only — not in top bar directly (PB §5.2)","chromium","2026-04-21","failed","2026-04-21","PB: Information Architecture (PB §5.3)","product-bible.spec.ts","",""
"","1770","Preview/Sample button present (Priority 2 per PB §6.3 and §3.9)","chromium","2026-04-21","passed","2026-04-21","Browse: Book Detail Page (PB §6.3)","browse.spec.ts","",""
"","1065","Cookies have appropriate flags","chromium","2026-04-21","passed","2026-04-21","API: Security Headers","api.spec.ts","",""
"","765","/register loads within 5 seconds","chromium","2026-04-21","passed","2026-04-21","Smoke: Response Times","smoke.spec.ts","",""
"","1061","Error pages do not expose stack traces","chromium","2026-04-21","passed","2026-04-21","Security: Information Disclosure","security.spec.ts","",""
"","15596","Clicking a book card navigates to book detail page","chromium","2026-04-21","failed","2026-04-21","Browse: Authenticated User Flows","browse.spec.ts","",""
"","1081","/login loads within 5 seconds","chromium","2026-04-21","passed","2026-04-21","Smoke: Response Times","smoke.spec.ts","",""
"","1602","Cover image is large and prominent (Priority 1)","mobile-chrome","2026-04-21","passed","2026-04-21","PB: Book Detail Page Spec (PB §6.3)","product-bible.spec.ts","",""
"","164","/dashboard/admin does not expose admin panel (PB §11.6)","chromium","2026-04-21","passed","2026-04-21","API: Admin Route Hardening (PB §11.6)","api.spec.ts","",""
"","1574","Footer contains company and support links (PB §5.2)","chromium","2026-04-21","passed","2026-04-21","PB: Web Navigation Structure (PB §5.2)","product-bible.spec.ts","",""
"","1641","'Junior' terminology used — not 'Kids' or 'Children' (PB §1.3)","chromium","2026-04-21","passed","2026-04-21","PB: Subscription Tiers in UI (PB §1.3, v4.6)","product-bible.spec.ts","",""
"","1307","Privacy Policy (/privacy) returns 200 and loads","chromium","2026-04-21","passed","2026-04-21","Smoke: Public Pages Load","smoke.spec.ts","",""
"","2278","Price or Free label is displayed (Priority 2 per PB §6.3)","chromium","2026-04-21","passed","2026-04-21","Browse: Book Detail Page (PB §6.3)","browse.spec.ts","",""
"","1460","Terms of Service (/terms) returns 200 and loads","chromium","2026-04-21","passed","2026-04-21","Smoke: Public Pages Load","smoke.spec.ts","",""
"","797","/library redirects unauthenticated user to /login","mobile-chrome","2026-04-21","passed","2026-04-21","Smoke: Auth-Gated Routes Redirect","smoke.spec.ts","",""
"","1301","Help Centre (/help) returns 200 and loads","mobile-chrome","2026-04-21","passed","2026-04-21","Smoke: Public Pages Load","smoke.spec.ts","",""
"","1673","Admin routes not linked from main site (PB §5.3, §11.6)","chromium","2026-04-21","passed","2026-04-21","PB: Information Architecture (PB §5.3)","product-bible.spec.ts","",""
"","1844","Homepage book cover images load from R2","chromium","2026-04-21","passed","2026-04-21","Smoke: Image Delivery (Cloudflare R2)","smoke.spec.ts","",""
"","2057","Site serves over HTTPS","mobile-chrome","2026-04-21","passed","2026-04-21","Smoke: SSL & Security Headers","smoke.spec.ts","",""
"","12141","Discover section includes: Books, Audiobooks, Periodicals, Comics, Documents","chromium","2026-04-21","failed","2026-04-21","PB: Web Navigation Structure (PB §5.2)","product-bible.spec.ts","",""
"","1504","About Paygees (/about) returns 200 and loads","chromium","2026-04-21","passed","2026-04-21","Smoke: Public Pages Load","smoke.spec.ts","",""
"","819","Register page renders key elements","chromium","2026-04-21","failed","2026-04-21","Auth: Registration Page UI","auth.spec.ts","",""
"","5614","Each book card has a cover image","chromium","2026-04-21","passed","2026-04-21","Browse: Homepage Sections (PB §6.1)","browse.spec.ts","",""
"","2257","Forums require login — unauthenticated visitors redirected (login is CTA per PB Q14)","chromium","2026-04-21","passed","2026-04-21","PB: Forum Access Rules (PB §6.6, Q14)","product-bible.spec.ts","",""
"","1909","Free label appears for free books (PB §1.3)","chromium","2026-04-21","failed","2026-04-21","PB: Book Detail Page Spec (PB §6.3)","product-bible.spec.ts","",""
"","179","/discover/comics returns 200","chromium","2026-04-21","passed","2026-04-21","API: HTTP Status Codes","api.spec.ts","",""
"","1798","Login — Full load within 5s","chromium","2026-04-21","passed","2026-04-21","Performance: Page Load Times","performance.spec.ts","",""
"","168","/admin/finance does not expose sensitive data","chromium","2026-04-21","passed","2026-04-21","Security: Admin Route Hardening (PB §11.6)","security.spec.ts","",""
"","1900","Events (/events) returns 200 and loads","mobile-chrome","2026-04-21","passed","2026-04-21","Smoke: Public Pages Load","smoke.spec.ts","",""
"","2623","Primary colour #1EAEDB is used — banned #2CB5B5 must not appear (PB §10.2)","chromium","2026-04-21","passed","2026-04-21","PB: Brand Identity (§10.1, §10.2)","product-bible.spec.ts","",""
"","320","/admin/login does not expose sensitive data","chromium","2026-04-21","passed","2026-04-21","Security: Admin Route Hardening (PB §11.6)","security.spec.ts","",""
"","12120","Top navigation includes: Home, Library, News, Events, Forums","chromium","2026-04-21","failed","2026-04-21","PB: Web Navigation Structure (PB §5.2)","product-bible.spec.ts","",""
"","2452","Periodicals category page loads without error","mobile-chrome","2026-04-21","failed","2026-04-21","Browse: Discover Sub-Categories","browse.spec.ts","",""
"","1246","/register loads within 5 seconds","mobile-chrome","2026-04-21","passed","2026-04-21","Smoke: Response Times","smoke.spec.ts","",""
"","2240","/ loads within 5 seconds","mobile-chrome","2026-04-21","passed","2026-04-21","Smoke: Response Times","smoke.spec.ts","",""
"","1641","Press (/press) returns 200 and loads","mobile-chrome","2026-04-21","passed","2026-04-21","Smoke: Public Pages Load","smoke.spec.ts","",""
"","426","/ returns 200","chromium","2026-04-21","passed","2026-04-21","API: HTTP Status Codes","api.spec.ts","",""
"","2512","Logo reads 'PAYGEES' (PB §10.1)","mobile-chrome","2026-04-21","passed","2026-04-21","PB: Brand Identity (§10.1, §10.2)","product-bible.spec.ts","",""
"","16497","Library page has search within library (PB §6.2)","mobile-chrome","2026-04-21","failed","2026-04-21","Browse: Authenticated User Flows","browse.spec.ts","",""
"","3011","Free label appears for free books (PB §1.3)","mobile-chrome","2026-04-21","failed","2026-04-21","PB: Book Detail Page Spec (PB §6.3)","product-bible.spec.ts","",""
"","2798","Book detail page loads and is not a 404","mobile-chrome","2026-04-21","passed","2026-04-21","Browse: Book Detail Page (PB §6.3)","browse.spec.ts","",""
"","2120","Discover — DOMContentLoaded within 3s","chromium","2026-04-21","passed","2026-04-21","Performance: Page Load Times","performance.spec.ts","",""
"","1636","Discover category navigation links are present","mobile-chrome","2026-04-21","passed","2026-04-21","Browse: Discover Screen (PB §6.8)","browse.spec.ts","",""
"","120","/terms returns 200","chromium","2026-04-21","passed","2026-04-21","API: HTTP Status Codes","api.spec.ts","",""
"","1552","Book detail page has OG tags with book info","chromium","2026-04-21","passed","2026-04-21","SEO: Open Graph Tags","seo.spec.ts","",""
"","1766","Discover Comics & Illustrations (/discover/comics) returns 200 and loads","chromium","2026-04-21","passed","2026-04-21","Smoke: Public Pages Load","smoke.spec.ts","",""
"","1626","Forums (/forums) returns 200 and loads","chromium","2026-04-21","passed","2026-04-21","Smoke: Public Pages Load","smoke.spec.ts","",""
"","15656","After login, Sign Out is in profile dropdown only per PB §5.2","chromium","2026-04-21","failed","2026-04-21","Auth: Successful Login Flow","auth.spec.ts","",""
"","5459","Homepage renders Bestsellers section","chromium","2026-04-21","passed","2026-04-21","Browse: Homepage Sections (PB §6.1)","browse.spec.ts","",""
"","15619","Library page has search within library (PB §6.2)","chromium","2026-04-21","failed","2026-04-21","Browse: Authenticated User Flows","browse.spec.ts","",""
"","2148","Homepage has a nav landmark","chromium","2026-04-21","passed","2026-04-21","Accessibility: Semantic HTML","accessibility.spec.ts","",""
"","1543","No EPUB / PDF / MP3 format names appear in UI (PB §10.5)","chromium","2026-04-21","passed","2026-04-21","PB: Home Screen Sections (PB §6.1)","product-bible.spec.ts","",""
"","16105","Clicking a book card navigates to book detail page","mobile-chrome","2026-04-21","failed","2026-04-21","Browse: Authenticated User Flows","browse.spec.ts","",""
"","2401","Bestsellers section is present on homepage","mobile-chrome","2026-04-21","failed","2026-04-21","PB: Home Screen Sections (PB §6.1)","product-bible.spec.ts","",""
"","190","/admin/users does not expose sensitive data","chromium","2026-04-21","passed","2026-04-21","Security: Admin Route Hardening (PB §11.6)","security.spec.ts","",""
"","1758","/settings is protected — unauthenticated access redirects to login","chromium","2026-04-21","passed","2026-04-21","Security: Auth Protection","security.spec.ts","",""
"","1412","Log In (/login) returns 200 and loads","chromium","2026-04-21","passed","2026-04-21","Smoke: Public Pages Load","smoke.spec.ts","",""
"","5911","Discover Audiobooks (/discover/audiobooks) returns 200 and loads","chromium","2026-04-21","passed","2026-04-21","Smoke: Public Pages Load","smoke.spec.ts","",""
"","2820","Guardian Dashboard is not linked to logged-out users (PB §5.3)","mobile-chrome","2026-04-21","passed","2026-04-21","PB: Junior Add-On Model (PB §1.3, §2.3, Q21 — v4.6)","product-bible.spec.ts","",""
"","99","/help returns 200","chromium","2026-04-21","passed","2026-04-21","API: HTTP Status Codes","api.spec.ts","",""
"","1509","Careers (/careers) returns 200 and loads","chromium","2026-04-21","passed","2026-04-21","Smoke: Public Pages Load","smoke.spec.ts","",""
"","87","Homepage includes content security or transport headers","chromium","2026-04-21","passed","2026-04-21","API: Security Headers","api.spec.ts","",""
"","2280","Publisher Dashboard not linked from public homepage (PB §5.3)","mobile-chrome","2026-04-21","passed","2026-04-21","PB: Information Architecture (PB §5.3)","product-bible.spec.ts","",""
"","1562","Discover Audiobooks (/discover/audiobooks) returns 200 and loads","mobile-chrome","2026-04-21","passed","2026-04-21","Smoke: Public Pages Load","smoke.spec.ts","",""
"","1361","Homepage has OG description","chromium","2026-04-21","passed","2026-04-21","SEO: Open Graph Tags","seo.spec.ts","",""
"","2157","Book Detail — Full load within 5s","chromium","2026-04-21","passed","2026-04-21","Performance: Page Load Times","performance.spec.ts","",""
"","1436","Sign Up (/register) returns 200 and loads","chromium","2026-04-21","passed","2026-04-21","Smoke: Public Pages Load","smoke.spec.ts","",""
"","1391","Help Centre (/help) returns 200 and loads","chromium","2026-04-21","passed","2026-04-21","Smoke: Public Pages Load","smoke.spec.ts","",""
"","902","Login form is navigable by keyboard","chromium","2026-04-21","failed","2026-04-21","Accessibility: Keyboard Navigation","accessibility.spec.ts","",""
"","1375","Card details are never displayed in any page response (PB §11.5)","chromium","2026-04-21","passed","2026-04-21","Security: Cookie Configuration (PB §11.5)","security.spec.ts","",""
"","1434","Audiobooks category page loads without error","chromium","2026-04-21","failed","2026-04-21","Browse: Discover Sub-Categories","browse.spec.ts","",""
"","410","/admin does not expose sensitive data","chromium","2026-04-21","passed","2026-04-21","Security: Admin Route Hardening (PB §11.6)","security.spec.ts","",""
"","1712","Events (/events) returns 200 and loads","chromium","2026-04-21","passed","2026-04-21","Smoke: Public Pages Load","smoke.spec.ts","",""
"","3069","Junior is NOT presented as a default-included benefit of any tier (PB §1.3, Q21)","mobile-chrome","2026-04-21","passed","2026-04-21","PB: Subscription Tiers in UI (PB §1.3, v4.6)","product-bible.spec.ts","",""
"","431","/discover/books returns 200","chromium","2026-04-21","passed","2026-04-21","API: HTTP Status Codes","api.spec.ts","",""
"","2314","Title and author displayed (Priority 1)","chromium","2026-04-21","failed","2026-04-21","PB: Book Detail Page Spec (PB §6.3)","product-bible.spec.ts","",""
"","533","/discover/audiobooks returns 200","chromium","2026-04-21","passed","2026-04-21","API: HTTP Status Codes","api.spec.ts","",""
"","2036","Forums (/forums) returns 200 and loads","mobile-chrome","2026-04-21","passed","2026-04-21","Smoke: Public Pages Load","smoke.spec.ts","",""
"","1756","File format names do NOT appear — never show EPUB/PDF/MP3 (PB §6.3)","chromium","2026-04-21","passed","2026-04-21","PB: Book Detail Page Spec (PB §6.3)","product-bible.spec.ts","",""
"","2102","Author name is visible and clickable (Priority 1 per PB §6.3)","chromium","2026-04-21","failed","2026-04-21","Browse: Book Detail Page (PB §6.3)","browse.spec.ts","",""
"","1698","Register with invalid email shows validation","chromium","2026-04-21","passed","2026-04-21","Auth: Registration Page UI","auth.spec.ts","",""
"","36","sitemap.xml is valid XML if present","chromium","2026-04-21","passed","2026-04-21","SEO: Technical SEO","seo.spec.ts","",""
"","2240","No EPUB / PDF / MP3 format names appear in UI (PB §10.5)","mobile-chrome","2026-04-21","passed","2026-04-21","PB: Home Screen Sections (PB §6.1)","product-bible.spec.ts","",""
"","1674","HTTP redirects to HTTPS","mobile-chrome","2026-04-21","passed","2026-04-21","Smoke: SSL & Security Headers","smoke.spec.ts","",""
"","2224","All internal links use HTTPS or relative paths","chromium","2026-04-21","passed","2026-04-21","Security: HTTPS Enforcement","security.spec.ts","",""
"","32","favicon is served","chromium","2026-04-21","passed","2026-04-21","API: Next.js Infrastructure","api.spec.ts","",""
"","17233","'Creator' term does not appear in UI — banned platform-wide per PB Q16","mobile-chrome","2026-04-21","passed","2026-04-21","PB: Brand Identity (§10.1, §10.2)","product-bible.spec.ts","",""
"","94","/admin/login does not expose admin panel (PB §11.6)","chromium","2026-04-21","passed","2026-04-21","API: Admin Route Hardening (PB §11.6)","api.spec.ts","",""
"","2361","Homepage — DOMContentLoaded within 3s","chromium","2026-04-21","passed","2026-04-21","Performance: Page Load Times","performance.spec.ts","",""
"","2034","Content type shown as icon/label — NOT file format (PB §6.3, §10.5)","mobile-chrome","2026-04-21","passed","2026-04-21","Browse: Book Detail Page (PB §6.3)","browse.spec.ts","",""
"","15609","Homepage has OG image","chromium","2026-04-21","failed","2026-04-21","SEO: Open Graph Tags","seo.spec.ts","",""
"","136","/events returns 200","chromium","2026-04-21","passed","2026-04-21","API: HTTP Status Codes","api.spec.ts","",""
"","920","Forgot password page renders email input and submit","chromium","2026-04-21","failed","2026-04-21","Auth: Forgot Password Flow","auth.spec.ts","",""
"","1636","Comics category page loads without error","chromium","2026-04-21","failed","2026-04-21","Browse: Discover Sub-Categories","browse.spec.ts","",""
"","2454","Cover image is large and prominent (Priority 1 per PB §6.3)","mobile-chrome","2026-04-21","failed","2026-04-21","Browse: Book Detail Page (PB §6.3)","browse.spec.ts","",""
"","2279","Audiobooks category page loads without error","mobile-chrome","2026-04-21","failed","2026-04-21","Browse: Discover Sub-Categories","browse.spec.ts","",""
"","2043","News (/news) returns 200 and loads","chromium","2026-04-21","passed","2026-04-21","Smoke: Public Pages Load","smoke.spec.ts","",""
"","1754","Periodicals category page loads without error","chromium","2026-04-21","failed","2026-04-21","Browse: Discover Sub-Categories","browse.spec.ts","",""
"","1739","Discover Documents & Research (/discover/documents) returns 200 and loads","mobile-chrome","2026-04-21","passed","2026-04-21","Smoke: Public Pages Load","smoke.spec.ts","",""
"","1050","Sign up link navigates to /register","chromium","2026-04-21","passed","2026-04-21","Auth: Login Page UI","auth.spec.ts","",""
"","1567","No duplicate page titles across key pages","chromium","2026-04-21","failed","2026-04-21","SEO: Technical SEO","seo.spec.ts","",""
"","1732","Age rating is displayed (PB §2.4)","chromium","2026-04-21","failed","2026-04-21","Browse: Book Detail Page (PB §6.3)","browse.spec.ts","",""
"","1345","Pricing page (if exists) shows the 4 main tiers: Free, Basic, Standard, Premium","mobile-chrome","2026-04-21","failed","2026-04-21","PB: Subscription Tiers in UI (PB §1.3, v4.6)","product-bible.spec.ts","",""
"","3560","Junior is not presented as a comparable standalone subscription tier","mobile-chrome","2026-04-21","passed","2026-04-21","PB: Junior Add-On Model (PB §1.3, §2.3, Q21 — v4.6)","product-bible.spec.ts","",""
"","2198","Books category page loads without error","mobile-chrome","2026-04-21","failed","2026-04-21","Browse: Discover Sub-Categories","browse.spec.ts","",""
"","15704","After login, Library is accessible without redirect","chromium","2026-04-21","failed","2026-04-21","Auth: Successful Login Flow","auth.spec.ts","",""
"","2063","Age rating appears on book detail (PB §2.4)","mobile-chrome","2026-04-21","failed","2026-04-21","PB: Book Detail Page Spec (PB §6.3)","product-bible.spec.ts","",""
"","1337","Forgot Password (/forgot-password) returns 200 and loads","chromium","2026-04-21","passed","2026-04-21","Smoke: Public Pages Load","smoke.spec.ts","",""
"","1088","/discover loads within 5 seconds","mobile-chrome","2026-04-21","passed","2026-04-21","Smoke: Response Times","smoke.spec.ts","",""
"","290","/.env does not expose sensitive data","chromium","2026-04-21","passed","2026-04-21","Security: Admin Route Hardening (PB §11.6)","security.spec.ts","",""
"","1569","Bestsellers section is present on homepage","chromium","2026-04-21","failed","2026-04-21","PB: Home Screen Sections (PB §6.1)","product-bible.spec.ts","",""
"","1941","Home (/) returns 200 and loads","mobile-chrome","2026-04-21","passed","2026-04-21","Smoke: Public Pages Load","smoke.spec.ts","",""
"","1379","Pricing page (if exists) shows the 4 main tiers: Free, Basic, Standard, Premium","chromium","2026-04-21","failed","2026-04-21","PB: Subscription Tiers in UI (PB §1.3, v4.6)","product-bible.spec.ts","",""
"","2038","Author profile pages use /author/ route (PB §6.10)","mobile-chrome","2026-04-21","passed","2026-04-21","PB: Author Profile Rules (PB §6.10, Q15, Q16)","product-bible.spec.ts","",""
