"DESCRIPTION","DURATION IN MS","NAME","PARENT SUITE","START TIME","STATUS","STOP TIME","SUB SUITE","SUITE","TEST CLASS","TEST METHOD"
"","296","/admin/users does not expose sensitive data","chromium","2026-04-02","passed","2026-04-02","Security: Admin Route Hardening (PB §11.6)","security.spec.ts","",""
"","1404","Homepage has OG description","chromium","2026-04-02","passed","2026-04-02","SEO: Open Graph Tags","seo.spec.ts","",""
"","1769","Contact Us (/contact) returns 200 and loads","chromium","2026-04-02","passed","2026-04-02","Smoke: Public Pages Load","smoke.spec.ts","",""
"","2151","Author profile pages use /author/ route (PB §6.10)","mobile-chrome","2026-04-02","passed","2026-04-02","PB: Author Profile Rules (PB §6.10, Q15, Q16)","product-bible.spec.ts","",""
"","2265","Section 'See More' links are present — max 10 per section (PB §6.1)","mobile-chrome","2026-04-02","failed","2026-04-02","PB: Home Screen Sections (PB §6.1)","product-bible.spec.ts","",""
"","1593","Login with wrong credentials shows error, not 500","chromium","2026-04-02","failed","2026-04-02","Auth: Login Page UI","auth.spec.ts","",""
"","644","Book Detail — DOMContentLoaded within 3s","chromium","2026-04-02","passed","2026-04-02","Performance: Page Load Times","performance.spec.ts","",""
"","727","HTTP redirects to HTTPS","chromium","2026-04-02","passed","2026-04-02","Smoke: SSL & Security Headers","smoke.spec.ts","",""
"","188","/discover/comics returns 200","chromium","2026-04-02","passed","2026-04-02","API: HTTP Status Codes","api.spec.ts","",""
"","285","/discover/books returns 200","chromium","2026-04-02","passed","2026-04-02","API: HTTP Status Codes","api.spec.ts","",""
"","1813","News (/news) returns 200 and loads","chromium","2026-04-02","passed","2026-04-02","Smoke: Public Pages Load","smoke.spec.ts","",""
"","1509","Login — Full load within 5s","chromium","2026-04-02","passed","2026-04-02","Performance: Page Load Times","performance.spec.ts","",""
"","4676","Homepage has a meta description","chromium","2026-04-02","passed","2026-04-02","SEO: Meta Tags","seo.spec.ts","",""
"","985","Forgot password page renders email input and submit","chromium","2026-04-02","failed","2026-04-02","Auth: Forgot Password Flow","auth.spec.ts","",""
"","1774","Homepage book cover images load from R2","chromium","2026-04-02","passed","2026-04-02","Smoke: Image Delivery (Cloudflare R2)","smoke.spec.ts","",""
"","89","Login responds within 5 seconds","chromium","2026-04-02","passed","2026-04-02","API: Response Time Benchmarks","api.spec.ts","",""
"","1718","Audiobooks category page loads without error","chromium","2026-04-02","failed","2026-04-02","Browse: Discover Sub-Categories","browse.spec.ts","",""
"","1756","Forums require login — unauthenticated visitors redirected (login is CTA per PB Q14)","mobile-chrome","2026-04-02","passed","2026-04-02","PB: Forum Access Rules (PB §6.6, Q14)","product-bible.spec.ts","",""
"","113","/contact returns 200","chromium","2026-04-02","passed","2026-04-02","API: HTTP Status Codes","api.spec.ts","",""
"","189","/.env does not expose sensitive data","chromium","2026-04-02","passed","2026-04-02","Security: Admin Route Hardening (PB §11.6)","security.spec.ts","",""
"","1664","All internal links use consistent domain (no mixed domains)","chromium","2026-04-02","passed","2026-04-02","SEO: Technical SEO","seo.spec.ts","",""
"","6491","Homepage — Cumulative Layout Shift (CLS) < 0.1","chromium","2026-04-02","passed","2026-04-02","Performance: Web Vitals (via Navigation API)","performance.spec.ts","",""
"","3475","Each book card has a cover image","chromium","2026-04-02","passed","2026-04-02","Browse: Homepage Sections (PB §6.1)","browse.spec.ts","",""
"","16734","'Creator' term does not appear in UI — banned platform-wide per PB Q16","chromium","2026-04-02","passed","2026-04-02","PB: Brand Identity (§10.1, §10.2)","product-bible.spec.ts","",""
"","2018","Search input does not reflect raw HTML (basic XSS check)","chromium","2026-04-02","passed","2026-04-02","Security: XSS Prevention","security.spec.ts","",""
"","12197","Homepage has at least one book card visible","mobile-chrome","2026-04-02","failed","2026-04-02","Browse: Homepage Sections (PB §6.1)","browse.spec.ts","",""
"","3778","/ loads within 5 seconds","mobile-chrome","2026-04-02","passed","2026-04-02","Smoke: Response Times","smoke.spec.ts","",""
"","2759","'Junior' terminology used — not 'Kids' or 'Children' (PB §1.3)","mobile-chrome","2026-04-02","passed","2026-04-02","PB: Subscription Tiers in UI (PB §1.3, v4.6)","product-bible.spec.ts","",""
"","13149","Sections use 'See More' / 'View All' links per PB §6.1 (max 10 per section)","mobile-chrome","2026-04-02","failed","2026-04-02","Browse: Homepage Sections (PB §6.1)","browse.spec.ts","",""
"","2141","Section 'See More' links are present — max 10 per section (PB §6.1)","chromium","2026-04-02","failed","2026-04-02","PB: Home Screen Sections (PB §6.1)","product-bible.spec.ts","",""
"","1248","Login page includes Terms & Conditions and Privacy Policy links","chromium","2026-04-02","failed","2026-04-02","Auth: Login Page UI","auth.spec.ts","",""
"","1514","Books category page loads without error","chromium","2026-04-02","failed","2026-04-02","Browse: Discover Sub-Categories","browse.spec.ts","",""
"","15815","Login page has noindex or appropriate meta (auth pages shouldn't be indexed)","chromium","2026-04-02","failed","2026-04-02","SEO: Meta Tags","seo.spec.ts","",""
"","1101","Pricing page (if exists) shows the 4 main tiers: Free, Basic, Standard, Premium","mobile-chrome","2026-04-02","failed","2026-04-02","PB: Subscription Tiers in UI (PB §1.3, v4.6)","product-bible.spec.ts","",""
"","1769","Preview/Sample button present (Priority 2 per PB §6.3 and §3.9)","mobile-chrome","2026-04-02","passed","2026-04-02","Browse: Book Detail Page (PB §6.3)","browse.spec.ts","",""
"","681","/ loads within 5 seconds","chromium","2026-04-02","passed","2026-04-02","Smoke: Response Times","smoke.spec.ts","",""
"","512","Homepage loads on simulated slow 3G (African market priority — PB §4.5)","chromium","2026-04-02","passed","2026-04-02","Performance: Resource Loading","performance.spec.ts","",""
"","122","/forgot-password returns 200","chromium","2026-04-02","passed","2026-04-02","API: HTTP Status Codes","api.spec.ts","",""
"","12207","Cover image is large and prominent (Priority 1)","chromium","2026-04-02","failed","2026-04-02","PB: Book Detail Page Spec (PB §6.3)","product-bible.spec.ts","",""
"","1338","Valid credentials log in and redirect to app","chromium","2026-04-02","failed","2026-04-02","Auth: Successful Login Flow","auth.spec.ts","",""
"","2052","Price or Free label is displayed (Priority 2 per PB §6.3)","chromium","2026-04-02","passed","2026-04-02","Browse: Book Detail Page (PB §6.3)","browse.spec.ts","",""
"","141","/register returns 200","chromium","2026-04-02","passed","2026-04-02","API: HTTP Status Codes","api.spec.ts","",""
"","3842","Discover Books (/discover/books) returns 200 and loads","chromium","2026-04-02","passed","2026-04-02","Smoke: Public Pages Load","smoke.spec.ts","",""
"","1944","Guardian Dashboard is not linked to logged-out users (PB §5.3)","chromium","2026-04-02","passed","2026-04-02","PB: Junior Add-On Model (PB §1.3, §2.3, Q21 — v4.6)","product-bible.spec.ts","",""
"","1279","Page has exactly one h1 tag","chromium","2026-04-02","passed","2026-04-02","Accessibility: Semantic HTML","accessibility.spec.ts","",""
"","163","/news returns 200","chromium","2026-04-02","passed","2026-04-02","API: HTTP Status Codes","api.spec.ts","",""
"","184","/help returns 200","chromium","2026-04-02","passed","2026-04-02","API: HTTP Status Codes","api.spec.ts","",""
"","2422","Footer contains copyright notice for The Book Crunch Limited","mobile-chrome","2026-04-02","passed","2026-04-02","PB: Web Navigation Structure (PB §5.2)","product-bible.spec.ts","",""
"","2047","Age rating is displayed (PB §2.4)","mobile-chrome","2026-04-02","failed","2026-04-02","Browse: Book Detail Page (PB §6.3)","browse.spec.ts","",""
"","2053","Junior add-on available to Free tier — not exclusive to paid tiers (PB §1.3, Q21)","mobile-chrome","2026-04-02","passed","2026-04-02","PB: Junior Add-On Model (PB §1.3, §2.3, Q21 — v4.6)","product-bible.spec.ts","",""
"","160","/forums without auth returns 200 with login content or redirects","chromium","2026-04-02","passed","2026-04-02","API: Auth-Gated Routes Return Redirect (not 200)","api.spec.ts","",""
"","4617","Homepage — Largest Contentful Paint (LCP) < 4s","chromium","2026-04-02","passed","2026-04-02","Performance: Web Vitals (via Navigation API)","performance.spec.ts","",""
"","255","/discover/periodicals returns 200","chromium","2026-04-02","passed","2026-04-02","API: HTTP Status Codes","api.spec.ts","",""
"","2465","Publisher Dashboard not linked from public homepage (PB §5.3)","mobile-chrome","2026-04-02","passed","2026-04-02","PB: Information Architecture (PB §5.3)","product-bible.spec.ts","",""
"","1701","Author name is visible and clickable (Priority 1 per PB §6.3)","chromium","2026-04-02","failed","2026-04-02","Browse: Book Detail Page (PB §6.3)","browse.spec.ts","",""
"","1612","News (/news) returns 200 and loads","mobile-chrome","2026-04-02","passed","2026-04-02","Smoke: Public Pages Load","smoke.spec.ts","",""
"","1321","/forums redirects unauthenticated user to /login","mobile-chrome","2026-04-02","passed","2026-04-02","Smoke: Auth-Gated Routes Redirect","smoke.spec.ts","",""
"","1026","Library page has search within library (PB §6.2)","chromium","2026-04-02","failed","2026-04-02","Browse: Authenticated User Flows","browse.spec.ts","",""
"","6956","Each book card has a cover image","mobile-chrome","2026-04-02","passed","2026-04-02","Browse: Homepage Sections (PB §6.1)","browse.spec.ts","",""
"","1843","Footer shows payment method logos (PB §5.2)","chromium","2026-04-02","failed","2026-04-02","PB: Web Navigation Structure (PB §5.2)","product-bible.spec.ts","",""
"","1482","Homepage has OG title","chromium","2026-04-02","passed","2026-04-02","SEO: Open Graph Tags","seo.spec.ts","",""
"","1549","Press (/press) returns 200 and loads","mobile-chrome","2026-04-02","passed","2026-04-02","Smoke: Public Pages Load","smoke.spec.ts","",""
"","125","/.env.local does not expose sensitive data","chromium","2026-04-02","passed","2026-04-02","Security: Admin Route Hardening (PB §11.6)","security.spec.ts","",""
"","1788","Discover (/discover) returns 200 and loads","mobile-chrome","2026-04-02","passed","2026-04-02","Smoke: Public Pages Load","smoke.spec.ts","",""
"","181","robots.txt is accessible","chromium","2026-04-02","passed","2026-04-02","API: Next.js Infrastructure","api.spec.ts","",""
"","2429","Homepage does not load excessive JavaScript (< 2MB total)","chromium","2026-04-02","passed","2026-04-02","Performance: Resource Loading","performance.spec.ts","",""
"","150","/press returns 200","chromium","2026-04-02","passed","2026-04-02","API: HTTP Status Codes","api.spec.ts","",""
"","1910","Admin routes not linked from main site (PB §5.3, §11.6)","chromium","2026-04-02","passed","2026-04-02","PB: Information Architecture (PB §5.3)","product-bible.spec.ts","",""
"","1427","Library page shows tabs: In Progress, Favorites, Finished, All My Books (PB §6.2)","mobile-chrome","2026-04-02","failed","2026-04-02","Browse: Authenticated User Flows","browse.spec.ts","",""
"","3001","Primary colour #1EAEDB is used — banned #2CB5B5 must not appear (PB §10.2)","mobile-chrome","2026-04-02","passed","2026-04-02","PB: Brand Identity (§10.1, §10.2)","product-bible.spec.ts","",""
"","682","Login form is navigable by keyboard","chromium","2026-04-02","failed","2026-04-02","Accessibility: Keyboard Navigation","accessibility.spec.ts","",""
"","2707","Homepage — Full load within 5s","chromium","2026-04-02","passed","2026-04-02","Performance: Page Load Times","performance.spec.ts","",""
"","12056","Cover image is large and prominent (Priority 1 per PB §6.3)","mobile-chrome","2026-04-02","failed","2026-04-02","Browse: Book Detail Page (PB §6.3)","browse.spec.ts","",""
"","3780","Homepage book cover images load from R2","mobile-chrome","2026-04-02","passed","2026-04-02","Smoke: Image Delivery (Cloudflare R2)","smoke.spec.ts","",""
"","1200","Preview/Sample button present (Priority 2 per PB §6.3 and §3.9)","chromium","2026-04-02","passed","2026-04-02","Browse: Book Detail Page (PB §6.3)","browse.spec.ts","",""
"","18105","'Creator' term does not appear in UI — banned platform-wide per PB Q16","mobile-chrome","2026-04-02","passed","2026-04-02","PB: Brand Identity (§10.1, §10.2)","product-bible.spec.ts","",""
"","1703","Discover Documents & Research (/discover/documents) returns 200 and loads","mobile-chrome","2026-04-02","passed","2026-04-02","Smoke: Public Pages Load","smoke.spec.ts","",""
"","1193","Card details are never displayed in any page response (PB §11.5)","chromium","2026-04-02","passed","2026-04-02","Security: Cookie Configuration (PB §11.5)","security.spec.ts","",""
"","2508","/forums is protected — unauthenticated access redirects to login","chromium","2026-04-02","passed","2026-04-02","Security: Auth Protection","security.spec.ts","",""
"","1922","Blog (/blog) returns 200 and loads","chromium","2026-04-02","passed","2026-04-02","Smoke: Public Pages Load","smoke.spec.ts","",""
"","2878","Logged-out users see marketing/landing content on homepage","mobile-chrome","2026-04-02","passed","2026-04-02","PB: Information Architecture (PB §5.3)","product-bible.spec.ts","",""
"","1877","Junior is NOT presented as a default-included benefit of any tier (PB §1.3, Q21)","chromium","2026-04-02","passed","2026-04-02","PB: Subscription Tiers in UI (PB §1.3, v4.6)","product-bible.spec.ts","",""
"","387","Security response headers are present","mobile-chrome","2026-04-02","passed","2026-04-02","Smoke: SSL & Security Headers","smoke.spec.ts","",""
"","3328","Coral #E8735A used for section headers only — not CTA button fills (PB §10.2)","mobile-chrome","2026-04-02","passed","2026-04-02","PB: Home Screen Sections (PB §6.1)","product-bible.spec.ts","",""
"","164","/about returns 200","chromium","2026-04-02","passed","2026-04-02","API: HTTP Status Codes","api.spec.ts","",""
"","11875","Discover section includes: Books, Audiobooks, Periodicals, Comics, Documents","chromium","2026-04-02","failed","2026-04-02","PB: Web Navigation Structure (PB §5.2)","product-bible.spec.ts","",""
"","396","/discover/audiobooks returns 200","chromium","2026-04-02","passed","2026-04-02","API: HTTP Status Codes","api.spec.ts","",""
"","2482","Site title contains 'Paygees' (PB header)","mobile-chrome","2026-04-02","passed","2026-04-02","PB: Brand Identity (§10.1, §10.2)","product-bible.spec.ts","",""
"","1606","Book Detail — Full load within 5s","chromium","2026-04-02","passed","2026-04-02","Performance: Page Load Times","performance.spec.ts","",""
"","336","/ returns 200","chromium","2026-04-02","passed","2026-04-02","API: HTTP Status Codes","api.spec.ts","",""
"","5028","Book detail page has a meta description","chromium","2026-04-02","passed","2026-04-02","SEO: Meta Tags","seo.spec.ts","",""
"","1676","Log In (/login) returns 200 and loads","chromium","2026-04-02","passed","2026-04-02","Smoke: Public Pages Load","smoke.spec.ts","",""
"","865","Pick 3 genres flow is present for new users (mandatory per PB)","chromium","2026-04-02","passed","2026-04-02","Auth: Day 1 New User Flow (PB §4.7)","auth.spec.ts","",""
"","3198","Footer shows payment method logos (PB §5.2)","mobile-chrome","2026-04-02","failed","2026-04-02","PB: Web Navigation Structure (PB §5.2)","product-bible.spec.ts","",""
"","857","Interactive elements show visible focus ring","chromium","2026-04-02","passed","2026-04-02","Accessibility: Focus Indicators","accessibility.spec.ts","",""
"","122","/admin/login does not expose admin panel (PB §11.6)","chromium","2026-04-02","passed","2026-04-02","API: Admin Route Hardening (PB §11.6)","api.spec.ts","",""
"","891","Pricing page (if exists) shows the 4 main tiers: Free, Basic, Standard, Premium","chromium","2026-04-02","failed","2026-04-02","PB: Subscription Tiers in UI (PB §1.3, v4.6)","product-bible.spec.ts","",""
"","1723","Free label appears for free books (PB §1.3)","chromium","2026-04-02","failed","2026-04-02","PB: Book Detail Page Spec (PB §6.3)","product-bible.spec.ts","",""
"","2326","Book detail page loads and is not a 404","mobile-chrome","2026-04-02","passed","2026-04-02","Browse: Book Detail Page (PB §6.3)","browse.spec.ts","",""
"","6879","Homepage renders Bestsellers section","mobile-chrome","2026-04-02","passed","2026-04-02","Browse: Homepage Sections (PB §6.1)","browse.spec.ts","",""
"","664","/library redirects unauthenticated user to /login","chromium","2026-04-02","passed","2026-04-02","Smoke: Auth-Gated Routes Redirect","smoke.spec.ts","",""
"","85","Register responds within 5 seconds","chromium","2026-04-02","passed","2026-04-02","API: Response Time Benchmarks","api.spec.ts","",""
"","1954","No 500 errors on any public page","chromium","2026-04-02","passed","2026-04-02","API: Next.js Infrastructure","api.spec.ts","",""
"","1911","File format names do NOT appear — never show EPUB/PDF/MP3 (PB §6.3)","chromium","2026-04-02","passed","2026-04-02","PB: Book Detail Page Spec (PB §6.3)","product-bible.spec.ts","",""
"","2831","Register with invalid email shows validation","chromium","2026-04-02","passed","2026-04-02","Auth: Registration Page UI","auth.spec.ts","",""
"","2794","Admin routes not linked from main site (PB §5.3, §11.6)","mobile-chrome","2026-04-02","passed","2026-04-02","PB: Information Architecture (PB §5.3)","product-bible.spec.ts","",""
"","2166","Tagline 'Affordable | Accessible | Available' is present (PB §4.1)","mobile-chrome","2026-04-02","failed","2026-04-02","PB: Brand Identity (§10.1, §10.2)","product-bible.spec.ts","",""
"","689","Clicking a book card navigates to book detail page","chromium","2026-04-02","failed","2026-04-02","Browse: Authenticated User Flows","browse.spec.ts","",""
"","2217","Book detail page loads and is not a 404","chromium","2026-04-02","passed","2026-04-02","Browse: Book Detail Page (PB §6.3)","browse.spec.ts","",""
"","2997","No EPUB / PDF / MP3 format names appear in UI (PB §10.5)","mobile-chrome","2026-04-02","passed","2026-04-02","PB: Home Screen Sections (PB §6.1)","product-bible.spec.ts","",""
"","1810","Careers (/careers) returns 200 and loads","chromium","2026-04-02","passed","2026-04-02","Smoke: Public Pages Load","smoke.spec.ts","",""
"","1348","No console errors on homepage","chromium","2026-04-02","failed","2026-04-02","Performance: Resource Loading","performance.spec.ts","",""
"","2089","Title and author displayed (Priority 1)","mobile-chrome","2026-04-02","failed","2026-04-02","PB: Book Detail Page Spec (PB §6.3)","product-bible.spec.ts","",""
"","649","/register loads within 5 seconds","chromium","2026-04-02","passed","2026-04-02","Smoke: Response Times","smoke.spec.ts","",""
"","1673","Forums require login — unauthenticated visitors redirected (login is CTA per PB Q14)","chromium","2026-04-02","passed","2026-04-02","PB: Forum Access Rules (PB §6.6, Q14)","product-bible.spec.ts","",""
"","1806","Press (/press) returns 200 and loads","chromium","2026-04-02","passed","2026-04-02","Smoke: Public Pages Load","smoke.spec.ts","",""
"","2547","Discover — Full load within 5s","chromium","2026-04-02","passed","2026-04-02","Performance: Page Load Times","performance.spec.ts","",""
"","1196","/discover loads within 5 seconds","mobile-chrome","2026-04-02","passed","2026-04-02","Smoke: Response Times","smoke.spec.ts","",""
"","2859","Bestsellers section is present on homepage","mobile-chrome","2026-04-02","failed","2026-04-02","PB: Home Screen Sections (PB §6.1)","product-bible.spec.ts","",""
"","1579","Privacy Policy (/privacy) returns 200 and loads","mobile-chrome","2026-04-02","passed","2026-04-02","Smoke: Public Pages Load","smoke.spec.ts","",""
"","888","Login form inputs have labels","chromium","2026-04-02","passed","2026-04-02","Accessibility: Semantic HTML","accessibility.spec.ts","",""
"","10585","Homepage has a main landmark","chromium","2026-04-02","failed","2026-04-02","Accessibility: Semantic HTML","accessibility.spec.ts","",""
"","222","/dashboard/admin does not expose admin panel (PB §11.6)","chromium","2026-04-02","passed","2026-04-02","API: Admin Route Hardening (PB §11.6)","api.spec.ts","",""
"","1590","Body text is dark on light background (not low contrast)","chromium","2026-04-02","passed","2026-04-02","Accessibility: Colour Contrast","accessibility.spec.ts","",""
"","1718","All images have alt text","chromium","2026-04-02","passed","2026-04-02","Accessibility: Semantic HTML","accessibility.spec.ts","",""
"","3165","Navigation links are focusable with Tab","chromium","2026-04-02","passed","2026-04-02","Accessibility: Keyboard Navigation","accessibility.spec.ts","",""
"","840","Sign Out is in profile dropdown only — not in top bar directly (PB §5.2)","chromium","2026-04-02","failed","2026-04-02","PB: Information Architecture (PB §5.3)","product-bible.spec.ts","",""
"","2142","Bestsellers section is present on homepage","chromium","2026-04-02","failed","2026-04-02","PB: Home Screen Sections (PB §6.1)","product-bible.spec.ts","",""
"","1339","Discover category navigation links are present","chromium","2026-04-02","passed","2026-04-02","Browse: Discover Screen (PB §6.8)","browse.spec.ts","",""
"","890","/login loads within 5 seconds","chromium","2026-04-02","passed","2026-04-02","Smoke: Response Times","smoke.spec.ts","",""
"","2327","/settings is protected — unauthenticated access redirects to login","chromium","2026-04-02","passed","2026-04-02","Security: Auth Protection","security.spec.ts","",""
"","1477","Sign Up (/register) returns 200 and loads","mobile-chrome","2026-04-02","passed","2026-04-02","Smoke: Public Pages Load","smoke.spec.ts","",""
"","1740","Forums (/forums) returns 200 and loads","chromium","2026-04-02","passed","2026-04-02","Smoke: Public Pages Load","smoke.spec.ts","",""
"","984","/settings redirects unauthenticated user to /login","chromium","2026-04-02","passed","2026-04-02","Smoke: Auth-Gated Routes Redirect","smoke.spec.ts","",""
"","2011","Age rating appears on book detail (PB §2.4)","mobile-chrome","2026-04-02","failed","2026-04-02","PB: Book Detail Page Spec (PB §6.3)","product-bible.spec.ts","",""
"","1154","Library page shows tabs: In Progress, Favorites, Finished, All My Books (PB §6.2)","chromium","2026-04-02","failed","2026-04-02","Browse: Authenticated User Flows","browse.spec.ts","",""
"","1525","Forums page requires login — redirects unauthenticated users (PB §6.6, Q14)","mobile-chrome","2026-04-02","failed","2026-04-02","Browse: Authenticated User Flows","browse.spec.ts","",""
"","872","/forums redirects unauthenticated user to /login","chromium","2026-04-02","passed","2026-04-02","Smoke: Auth-Gated Routes Redirect","smoke.spec.ts","",""
"","11468","Homepage has at least one book card visible","chromium","2026-04-02","failed","2026-04-02","Browse: Homepage Sections (PB §6.1)","browse.spec.ts","",""
"","187","/events returns 200","chromium","2026-04-02","passed","2026-04-02","API: HTTP Status Codes","api.spec.ts","",""
"","1662","Sign Up (/register) returns 200 and loads","chromium","2026-04-02","passed","2026-04-02","Smoke: Public Pages Load","smoke.spec.ts","",""
"","118","sitemap.xml is accessible","chromium","2026-04-02","passed","2026-04-02","API: Next.js Infrastructure","api.spec.ts","",""
