"DESCRIPTION","DURATION IN MS","NAME","PARENT SUITE","START TIME","STATUS","STOP TIME","SUB SUITE","SUITE","TEST CLASS","TEST METHOD"
"","2011","Log In (/login) returns 200 and loads","mobile-chrome","2026-04-10","passed","2026-04-10","Smoke: Public Pages Load","smoke.spec.ts","",""
"","1743","No duplicate page titles across key pages","chromium","2026-04-10","failed","2026-04-10","SEO: Technical SEO","seo.spec.ts","",""
"","2433","Site title contains 'Paygees' (PB header)","chromium","2026-04-10","passed","2026-04-10","PB: Brand Identity (§10.1, §10.2)","product-bible.spec.ts","",""
"","12810","Discover section includes: Books, Audiobooks, Periodicals, Comics, Documents","mobile-chrome","2026-04-10","failed","2026-04-10","PB: Web Navigation Structure (PB §5.2)","product-bible.spec.ts","",""
"","786","Register page renders key elements","chromium","2026-04-10","failed","2026-04-10","Auth: Registration Page UI","auth.spec.ts","",""
"","136","/forgot-password returns 200","chromium","2026-04-10","passed","2026-04-10","API: HTTP Status Codes","api.spec.ts","",""
"","1770","Guardian Dashboard is not linked to logged-out users (PB §5.3)","chromium","2026-04-10","passed","2026-04-10","PB: Junior Add-On Model (PB §1.3, §2.3, Q21 — v4.6)","product-bible.spec.ts","",""
"","2317","Author name is visible and clickable (Priority 1 per PB §6.3)","mobile-chrome","2026-04-10","failed","2026-04-10","Browse: Book Detail Page (PB §6.3)","browse.spec.ts","",""
"","11870","Homepage has at least one book card visible","mobile-chrome","2026-04-10","failed","2026-04-10","Browse: Homepage Sections (PB §6.1)","browse.spec.ts","",""
"","268","/.env does not expose sensitive data","chromium","2026-04-10","passed","2026-04-10","Security: Admin Route Hardening (PB §11.6)","security.spec.ts","",""
"","165","robots.txt is accessible","chromium","2026-04-10","passed","2026-04-10","API: Next.js Infrastructure","api.spec.ts","",""
"","82","/privacy returns 200","chromium","2026-04-10","passed","2026-04-10","API: HTTP Status Codes","api.spec.ts","",""
"","2817","Coral #E8735A used for section headers only — not CTA button fills (PB §10.2)","mobile-chrome","2026-04-10","passed","2026-04-10","PB: Home Screen Sections (PB §6.1)","product-bible.spec.ts","",""
"","3611","Book detail page has a meta description","chromium","2026-04-10","passed","2026-04-10","SEO: Meta Tags","seo.spec.ts","",""
"","983","Homepage has OG description","chromium","2026-04-10","passed","2026-04-10","SEO: Open Graph Tags","seo.spec.ts","",""
"","333","/discover returns 200","chromium","2026-04-10","passed","2026-04-10","API: HTTP Status Codes","api.spec.ts","",""
"","1485","Events (/events) returns 200 and loads","chromium","2026-04-10","passed","2026-04-10","Smoke: Public Pages Load","smoke.spec.ts","",""
"","516","Login — DOMContentLoaded within 3s","chromium","2026-04-10","passed","2026-04-10","Performance: Page Load Times","performance.spec.ts","",""
"","12057","Cover image is large and prominent (Priority 1)","mobile-chrome","2026-04-10","failed","2026-04-10","PB: Book Detail Page Spec (PB §6.3)","product-bible.spec.ts","",""
"","170","/careers returns 200","chromium","2026-04-10","passed","2026-04-10","API: HTTP Status Codes","api.spec.ts","",""
"","1745","News (/news) returns 200 and loads","mobile-chrome","2026-04-10","passed","2026-04-10","Smoke: Public Pages Load","smoke.spec.ts","",""
"","11805","Homepage contains 'Discover More' or equivalent CTA","chromium","2026-04-10","failed","2026-04-10","Browse: Homepage Sections (PB §6.1)","browse.spec.ts","",""
"","112","Response headers do not expose server technology details","chromium","2026-04-10","passed","2026-04-10","Security: Information Disclosure","security.spec.ts","",""
"","2653","No 500 errors on any public page","chromium","2026-04-10","passed","2026-04-10","API: Next.js Infrastructure","api.spec.ts","",""
"","1566","Bestsellers section is present on homepage","chromium","2026-04-10","failed","2026-04-10","PB: Home Screen Sections (PB §6.1)","product-bible.spec.ts","",""
"","935","Login form inputs have labels","chromium","2026-04-10","failed","2026-04-10","Accessibility: Semantic HTML","accessibility.spec.ts","",""
"","138","/cms does not expose admin panel (PB §11.6)","chromium","2026-04-10","passed","2026-04-10","API: Admin Route Hardening (PB §11.6)","api.spec.ts","",""
"","2331","Book title is visible (Priority 1 per PB §6.3)","mobile-chrome","2026-04-10","failed","2026-04-10","Browse: Book Detail Page (PB §6.3)","browse.spec.ts","",""
"","1816","Home (/) returns 200 and loads","mobile-chrome","2026-04-10","passed","2026-04-10","Smoke: Public Pages Load","smoke.spec.ts","",""
"","1442","Discover category navigation links are present","chromium","2026-04-10","passed","2026-04-10","Browse: Discover Screen (PB §6.8)","browse.spec.ts","",""
"","1543","Books category page loads without error","chromium","2026-04-10","failed","2026-04-10","Browse: Discover Sub-Categories","browse.spec.ts","",""
"","2281","Primary colour #1EAEDB is used — banned #2CB5B5 must not appear (PB §10.2)","mobile-chrome","2026-04-10","passed","2026-04-10","PB: Brand Identity (§10.1, §10.2)","product-bible.spec.ts","",""
"","1367","Log In (/login) returns 200 and loads","chromium","2026-04-10","passed","2026-04-10","Smoke: Public Pages Load","smoke.spec.ts","",""
"","2461","Site serves over HTTPS","mobile-chrome","2026-04-10","passed","2026-04-10","Smoke: SSL & Security Headers","smoke.spec.ts","",""
"","1732","Discover category navigation links are present","mobile-chrome","2026-04-10","passed","2026-04-10","Browse: Discover Screen (PB §6.8)","browse.spec.ts","",""
"","2349","Homepage does not load excessive JavaScript (< 2MB total)","chromium","2026-04-10","passed","2026-04-10","Performance: Resource Loading","performance.spec.ts","",""
"","141","/admin/users does not expose sensitive data","chromium","2026-04-10","passed","2026-04-10","Security: Admin Route Hardening (PB §11.6)","security.spec.ts","",""
"","4193","Homepage renders Bestsellers section","chromium","2026-04-10","passed","2026-04-10","Browse: Homepage Sections (PB §6.1)","browse.spec.ts","",""
"","911","Pricing page (if exists) shows the 4 main tiers: Free, Basic, Standard, Premium","chromium","2026-04-10","failed","2026-04-10","PB: Subscription Tiers in UI (PB §1.3, v4.6)","product-bible.spec.ts","",""
"","2000","Junior add-on available to Free tier — not exclusive to paid tiers (PB §1.3, Q21)","mobile-chrome","2026-04-10","passed","2026-04-10","PB: Junior Add-On Model (PB §1.3, §2.3, Q21 — v4.6)","product-bible.spec.ts","",""
"","16057","Library page has search within library (PB §6.2)","mobile-chrome","2026-04-10","failed","2026-04-10","Browse: Authenticated User Flows","browse.spec.ts","",""
"","318","/ returns 200","chromium","2026-04-10","passed","2026-04-10","API: HTTP Status Codes","api.spec.ts","",""
"","1423","Privacy Policy (/privacy) returns 200 and loads","chromium","2026-04-10","passed","2026-04-10","Smoke: Public Pages Load","smoke.spec.ts","",""
"","2365","No EPUB / PDF / MP3 format names appear in UI (PB §10.5)","mobile-chrome","2026-04-10","passed","2026-04-10","PB: Home Screen Sections (PB §6.1)","product-bible.spec.ts","",""
"","2060","Publisher Dashboard not linked from public homepage (PB §5.3)","mobile-chrome","2026-04-10","passed","2026-04-10","PB: Information Architecture (PB §5.3)","product-bible.spec.ts","",""
"","718","/admin does not expose sensitive data","chromium","2026-04-10","passed","2026-04-10","Security: Admin Route Hardening (PB §11.6)","security.spec.ts","",""
"","1955","Section 'See More' links are present — max 10 per section (PB §6.1)","chromium","2026-04-10","failed","2026-04-10","PB: Home Screen Sections (PB §6.1)","product-bible.spec.ts","",""
"","12159","Discover section includes: Books, Audiobooks, Periodicals, Comics, Documents","chromium","2026-04-10","failed","2026-04-10","PB: Web Navigation Structure (PB §5.2)","product-bible.spec.ts","",""
"","389","/discover/audiobooks returns 200","chromium","2026-04-10","passed","2026-04-10","API: HTTP Status Codes","api.spec.ts","",""
"","2834","HTTP redirects to HTTPS","mobile-chrome","2026-04-10","passed","2026-04-10","Smoke: SSL & Security Headers","smoke.spec.ts","",""
"","15568","Logged-in Free user can access forums (PB Q14 — read + reply access)","chromium","2026-04-10","failed","2026-04-10","PB: Forum Access Rules (PB §6.6, Q14)","product-bible.spec.ts","",""
"","15621","Valid credentials log in and redirect to app","chromium","2026-04-10","failed","2026-04-10","Auth: Successful Login Flow","auth.spec.ts","",""
"","1802","Forums require login — unauthenticated visitors redirected (login is CTA per PB Q14)","chromium","2026-04-10","passed","2026-04-10","PB: Forum Access Rules (PB §6.6, Q14)","product-bible.spec.ts","",""
"","1733","Junior is not presented as a comparable standalone subscription tier","chromium","2026-04-10","passed","2026-04-10","PB: Junior Add-On Model (PB §1.3, §2.3, Q21 — v4.6)","product-bible.spec.ts","",""
"","1428","Logged-out users see marketing/landing content on homepage","chromium","2026-04-10","passed","2026-04-10","PB: Information Architecture (PB §5.3)","product-bible.spec.ts","",""
"","156","/forums returns 200","chromium","2026-04-10","passed","2026-04-10","API: HTTP Status Codes","api.spec.ts","",""
"","1910","All images have alt text","chromium","2026-04-10","passed","2026-04-10","Accessibility: Semantic HTML","accessibility.spec.ts","",""
"","1003","/discover loads within 5 seconds","mobile-chrome","2026-04-10","passed","2026-04-10","Smoke: Response Times","smoke.spec.ts","",""
"","2410","Tagline 'Affordable | Accessible | Available' is present (PB §4.1)","mobile-chrome","2026-04-10","failed","2026-04-10","PB: Brand Identity (§10.1, §10.2)","product-bible.spec.ts","",""
"","710","Book Detail — DOMContentLoaded within 3s","chromium","2026-04-10","passed","2026-04-10","Performance: Page Load Times","performance.spec.ts","",""
"","1619","Site title contains 'Paygees' (PB header)","mobile-chrome","2026-04-10","passed","2026-04-10","PB: Brand Identity (§10.1, §10.2)","product-bible.spec.ts","",""
"","1677","About Paygees (/about) returns 200 and loads","mobile-chrome","2026-04-10","passed","2026-04-10","Smoke: Public Pages Load","smoke.spec.ts","",""
"","1673","Blog (/blog) returns 200 and loads","mobile-chrome","2026-04-10","passed","2026-04-10","Smoke: Public Pages Load","smoke.spec.ts","",""
"","1317","All internal links use consistent domain (no mixed domains)","chromium","2026-04-10","passed","2026-04-10","SEO: Technical SEO","seo.spec.ts","",""
"","12613","Top navigation includes: Home, Library, News, Events, Forums","mobile-chrome","2026-04-10","failed","2026-04-10","PB: Web Navigation Structure (PB §5.2)","product-bible.spec.ts","",""
"","266","/admin/* returns 404 (not a redirect hint) per PB §11.6","mobile-chrome","2026-04-10","passed","2026-04-10","Smoke: Admin Route Hardening","smoke.spec.ts","",""
"","2282","Logo reads 'PAYGEES' (PB §10.1)","chromium","2026-04-10","passed","2026-04-10","PB: Brand Identity (§10.1, §10.2)","product-bible.spec.ts","",""
"","1225","Error pages do not expose stack traces","chromium","2026-04-10","passed","2026-04-10","Security: Information Disclosure","security.spec.ts","",""
"","217","/admin/* returns 404 (not a redirect hint) per PB §11.6","chromium","2026-04-10","passed","2026-04-10","Smoke: Admin Route Hardening","smoke.spec.ts","",""
"","84","Homepage responds within 5 seconds","chromium","2026-04-10","passed","2026-04-10","API: Response Time Benchmarks","api.spec.ts","",""
"","130","/forums without auth returns 200 with login content or redirects","chromium","2026-04-10","passed","2026-04-10","API: Auth-Gated Routes Return Redirect (not 200)","api.spec.ts","",""
"","1765","'Junior' terminology used — not 'Kids' or 'Children' (PB §1.3)","chromium","2026-04-10","passed","2026-04-10","PB: Subscription Tiers in UI (PB §1.3, v4.6)","product-bible.spec.ts","",""
"","1437","Help Centre (/help) returns 200 and loads","mobile-chrome","2026-04-10","passed","2026-04-10","Smoke: Public Pages Load","smoke.spec.ts","",""
"","15659","Sign Out is in profile dropdown only — not in top bar directly (PB §5.2)","chromium","2026-04-10","failed","2026-04-10","PB: Information Architecture (PB §5.3)","product-bible.spec.ts","",""
"","1614","Content type shown as icon/label — NOT file format (PB §6.3, §10.5)","chromium","2026-04-10","passed","2026-04-10","Browse: Book Detail Page (PB §6.3)","browse.spec.ts","",""
"","3515","Homepage — Full load within 5s","chromium","2026-04-10","passed","2026-04-10","Performance: Page Load Times","performance.spec.ts","",""
"","11706","Sections use 'See More' / 'View All' links per PB §6.1 (max 10 per section)","chromium","2026-04-10","failed","2026-04-10","Browse: Homepage Sections (PB §6.1)","browse.spec.ts","",""
"","939","/register loads within 5 seconds","mobile-chrome","2026-04-10","passed","2026-04-10","Smoke: Response Times","smoke.spec.ts","",""
"","4461","Login with empty fields shows validation","chromium","2026-04-10","passed","2026-04-10","Auth: Login Page UI","auth.spec.ts","",""
"","148","/events returns 200","chromium","2026-04-10","passed","2026-04-10","API: HTTP Status Codes","api.spec.ts","",""
"","1582","Author name is visible and clickable (Priority 1 per PB §6.3)","chromium","2026-04-10","failed","2026-04-10","Browse: Book Detail Page (PB §6.3)","browse.spec.ts","",""
"","1369","Homepage — First Contentful Paint (FCP) < 3s","chromium","2026-04-10","passed","2026-04-10","Performance: Web Vitals (via Navigation API)","performance.spec.ts","",""
"","1390","Periodicals category page loads without error","chromium","2026-04-10","failed","2026-04-10","Browse: Discover Sub-Categories","browse.spec.ts","",""
"","10649","Homepage has a main landmark","chromium","2026-04-10","failed","2026-04-10","Accessibility: Semantic HTML","accessibility.spec.ts","",""
"","145","/settings without auth returns 200 with login content or redirects","chromium","2026-04-10","passed","2026-04-10","API: Auth-Gated Routes Return Redirect (not 200)","api.spec.ts","",""
"","2272","Price or Free label is displayed (Priority 2 per PB §6.3)","mobile-chrome","2026-04-10","passed","2026-04-10","Browse: Book Detail Page (PB §6.3)","browse.spec.ts","",""
"","1057","/discover loads within 5 seconds","chromium","2026-04-10","passed","2026-04-10","Smoke: Response Times","smoke.spec.ts","",""
"","2604","Junior is NOT presented as a default-included benefit of any tier (PB §1.3, Q21)","mobile-chrome","2026-04-10","passed","2026-04-10","PB: Subscription Tiers in UI (PB §1.3, v4.6)","product-bible.spec.ts","",""
"","690","Forgot password page renders email input and submit","chromium","2026-04-10","failed","2026-04-10","Auth: Forgot Password Flow","auth.spec.ts","",""
"","15845","Login with wrong credentials shows error, not 500","chromium","2026-04-10","failed","2026-04-10","Auth: Login Page UI","auth.spec.ts","",""
"","5782","Homepage renders Bestsellers section","mobile-chrome","2026-04-10","passed","2026-04-10","Browse: Homepage Sections (PB §6.1)","browse.spec.ts","",""
"","1857","Discover Periodicals (/discover/periodicals) returns 200 and loads","mobile-chrome","2026-04-10","passed","2026-04-10","Smoke: Public Pages Load","smoke.spec.ts","",""
"","2115","Logged-out users see marketing/landing content on homepage","mobile-chrome","2026-04-10","passed","2026-04-10","PB: Information Architecture (PB §5.3)","product-bible.spec.ts","",""
"","233","Security response headers are present","mobile-chrome","2026-04-10","passed","2026-04-10","Smoke: SSL & Security Headers","smoke.spec.ts","",""
"","2948","/ loads within 5 seconds","mobile-chrome","2026-04-10","passed","2026-04-10","Smoke: Response Times","smoke.spec.ts","",""
"","12468","Homepage has at least one book card visible","chromium","2026-04-10","failed","2026-04-10","Browse: Homepage Sections (PB §6.1)","browse.spec.ts","",""
"","1541","Price or Free label is displayed (Priority 2 per PB §6.3)","chromium","2026-04-10","passed","2026-04-10","Browse: Book Detail Page (PB §6.3)","browse.spec.ts","",""
"","2172","Coral #E8735A used for section headers only — not CTA button fills (PB §10.2)","chromium","2026-04-10","passed","2026-04-10","PB: Home Screen Sections (PB §6.1)","product-bible.spec.ts","",""
"","1498","Preview/Sample button present (Priority 2 per PB §6.3 and §3.9)","chromium","2026-04-10","passed","2026-04-10","Browse: Book Detail Page (PB §6.3)","browse.spec.ts","",""
"","3955","Navigation links are focusable with Tab","chromium","2026-04-10","passed","2026-04-10","Accessibility: Keyboard Navigation","accessibility.spec.ts","",""
"","661","/ loads within 5 seconds","chromium","2026-04-10","passed","2026-04-10","Smoke: Response Times","smoke.spec.ts","",""
"","1842","Discover Documents & Research (/discover/documents) returns 200 and loads","chromium","2026-04-10","passed","2026-04-10","Smoke: Public Pages Load","smoke.spec.ts","",""
"","1609","Privacy Policy (/privacy) returns 200 and loads","mobile-chrome","2026-04-10","passed","2026-04-10","Smoke: Public Pages Load","smoke.spec.ts","",""
"","122","/wp-admin does not expose admin panel (PB §11.6)","chromium","2026-04-10","passed","2026-04-10","API: Admin Route Hardening (PB §11.6)","api.spec.ts","",""
"","17111","'Creator' term does not appear in UI — banned platform-wide per PB Q16","mobile-chrome","2026-04-10","passed","2026-04-10","PB: Brand Identity (§10.1, §10.2)","product-bible.spec.ts","",""
"","1511","Body text is dark on light background (not low contrast)","chromium","2026-04-10","passed","2026-04-10","Accessibility: Colour Contrast","accessibility.spec.ts","",""
"","276","sitemap.xml is valid XML if present","chromium","2026-04-10","passed","2026-04-10","SEO: Technical SEO","seo.spec.ts","",""
"","11706","Discover page loads and shows content","chromium","2026-04-10","failed","2026-04-10","Browse: Discover Screen (PB §6.8)","browse.spec.ts","",""
"","6274","Book cards show content type label (Book/Comic/Audiobook)","mobile-chrome","2026-04-10","passed","2026-04-10","Browse: Homepage Sections (PB §6.1)","browse.spec.ts","",""
"","16049","Forums page requires login — redirects unauthenticated users (PB §6.6, Q14)","mobile-chrome","2026-04-10","failed","2026-04-10","Browse: Authenticated User Flows","browse.spec.ts","",""
"","6436","Homepage — Cumulative Layout Shift (CLS) < 0.1","chromium","2026-04-10","passed","2026-04-10","Performance: Web Vitals (via Navigation API)","performance.spec.ts","",""
"","15542","After login, Library is accessible without redirect","chromium","2026-04-10","failed","2026-04-10","Auth: Successful Login Flow","auth.spec.ts","",""
"","2063","Forums page does not return a 500 error","mobile-chrome","2026-04-10","failed","2026-04-10","PB: Forum Access Rules (PB §6.6, Q14)","product-bible.spec.ts","",""
"","894","Login redirect param cannot be used to redirect to external site","chromium","2026-04-10","failed","2026-04-10","Security: Open Redirect Prevention","security.spec.ts","",""
"","306","/discover/books returns 200","chromium","2026-04-10","passed","2026-04-10","API: HTTP Status Codes","api.spec.ts","",""
"","177","/news returns 200","chromium","2026-04-10","passed","2026-04-10","API: HTTP Status Codes","api.spec.ts","",""
"","2202","Audiobooks category page loads without error","mobile-chrome","2026-04-10","failed","2026-04-10","Browse: Discover Sub-Categories","browse.spec.ts","",""
"","1666","Discover Comics & Illustrations (/discover/comics) returns 200 and loads","chromium","2026-04-10","passed","2026-04-10","Smoke: Public Pages Load","smoke.spec.ts","",""
"","1673","Audiobooks category page loads without error","chromium","2026-04-10","failed","2026-04-10","Browse: Discover Sub-Categories","browse.spec.ts","",""
"","2220","Section 'See More' links are present — max 10 per section (PB §6.1)","mobile-chrome","2026-04-10","failed","2026-04-10","PB: Home Screen Sections (PB §6.1)","product-bible.spec.ts","",""
"","1876","Pricing page (if exists) shows the 4 main tiers: Free, Basic, Standard, Premium","mobile-chrome","2026-04-10","failed","2026-04-10","PB: Subscription Tiers in UI (PB §1.3, v4.6)","product-bible.spec.ts","",""
"","175","/discover/documents returns 200","chromium","2026-04-10","passed","2026-04-10","API: HTTP Status Codes","api.spec.ts","",""
"","1243","Interactive elements show visible focus ring","chromium","2026-04-10","passed","2026-04-10","Accessibility: Focus Indicators","accessibility.spec.ts","",""
"","1258","Sign up link navigates to /register","chromium","2026-04-10","passed","2026-04-10","Auth: Login Page UI","auth.spec.ts","",""
"","4367","Each book card has a cover image","chromium","2026-04-10","passed","2026-04-10","Browse: Homepage Sections (PB §6.1)","browse.spec.ts","",""
"","206","Discover responds within 5 seconds","chromium","2026-04-10","passed","2026-04-10","API: Response Time Benchmarks","api.spec.ts","",""
"","1708","Forgot Password (/forgot-password) returns 200 and loads","mobile-chrome","2026-04-10","passed","2026-04-10","Smoke: Public Pages Load","smoke.spec.ts","",""
"","15567","After login, Sign Out is in profile dropdown only per PB §5.2","chromium","2026-04-10","failed","2026-04-10","Auth: Successful Login Flow","auth.spec.ts","",""
"","16717","Book detail page has OG tags with book info","chromium","2026-04-10","failed","2026-04-10","SEO: Open Graph Tags","seo.spec.ts","",""
"","2068","Book detail page loads and is not a 404","chromium","2026-04-10","passed","2026-04-10","Browse: Book Detail Page (PB §6.3)","browse.spec.ts","",""
"","16231","Homepage has a canonical URL","chromium","2026-04-10","failed","2026-04-10","SEO: Canonical URLs","seo.spec.ts","",""
"","15542","Library page has search within library (PB §6.2)","chromium","2026-04-10","failed","2026-04-10","Browse: Authenticated User Flows","browse.spec.ts","",""
"","1425","Card details are never displayed in any page response (PB §11.5)","chromium","2026-04-10","passed","2026-04-10","Security: Cookie Configuration (PB §11.5)","security.spec.ts","",""
"","4438","Home (/) returns 200 and loads","chromium","2026-04-10","passed","2026-04-10","Smoke: Public Pages Load","smoke.spec.ts","",""
"","3302","Bestsellers section is present on homepage","mobile-chrome","2026-04-10","failed","2026-04-10","PB: Home Screen Sections (PB §6.1)","product-bible.spec.ts","",""
"","1509","Careers (/careers) returns 200 and loads","chromium","2026-04-10","passed","2026-04-10","Smoke: Public Pages Load","smoke.spec.ts","",""
"","1586","Discover Periodicals (/discover/periodicals) returns 200 and loads","chromium","2026-04-10","passed","2026-04-10","Smoke: Public Pages Load","smoke.spec.ts","",""
"","1966","/settings is protected — unauthenticated access redirects to login","chromium","2026-04-10","passed","2026-04-10","Security: Auth Protection","security.spec.ts","",""
"","1958","Logo reads 'PAYGEES' (PB §10.1)","mobile-chrome","2026-04-10","passed","2026-04-10","PB: Brand Identity (§10.1, §10.2)","product-bible.spec.ts","",""
"","1065","/forums redirects unauthenticated user to /login","mobile-chrome","2026-04-10","passed","2026-04-10","Smoke: Auth-Gated Routes Redirect","smoke.spec.ts","",""
"","2295","Periodicals category page loads without error","mobile-chrome","2026-04-10","failed","2026-04-10","Browse: Discover Sub-Categories","browse.spec.ts","",""
"","2907","Homepage — DOMContentLoaded within 3s","chromium","2026-04-10","passed","2026-04-10","Performance: Page Load Times","performance.spec.ts","",""
"","2058","Discover Books (/discover/books) returns 200 and loads","mobile-chrome","2026-04-10","passed","2026-04-10","Smoke: Public Pages Load","smoke.spec.ts","",""
"","1623","Blog (/blog) returns 200 and loads","chromium","2026-04-10","passed","2026-04-10","Smoke: Public Pages Load","smoke.spec.ts","",""
"","418","Homepage loads on simulated slow 3G (African market priority — PB §4.5)","chromium","2026-04-10","passed","2026-04-10","Performance: Resource Loading","performance.spec.ts","",""
"","101","/register returns 200","chromium","2026-04-10","passed","2026-04-10","API: HTTP Status Codes","api.spec.ts","",""
"","1520","Terms of Service (/terms) returns 200 and loads","mobile-chrome","2026-04-10","passed","2026-04-10","Smoke: Public Pages Load","smoke.spec.ts","",""
"","2117","/forums is protected — unauthenticated access redirects to login","chromium","2026-04-10","passed","2026-04-10","Security: Auth Protection","security.spec.ts","",""
"","882","Pick 3 genres flow is present for new users (mandatory per PB)","chromium","2026-04-10","passed","2026-04-10","Auth: Day 1 New User Flow (PB §4.7)","auth.spec.ts","",""
"","144","/admin/login does not expose admin panel (PB §11.6)","chromium","2026-04-10","passed","2026-04-10","API: Admin Route Hardening (PB §11.6)","api.spec.ts","",""
"","1605","Register — Full load within 5s","chromium","2026-04-10","passed","2026-04-10","Performance: Page Load Times","performance.spec.ts","",""
"","13021","Sections use 'See More' / 'View All' links per PB §6.1 (max 10 per section)","mobile-chrome","2026-04-10","failed","2026-04-10","Browse: Homepage Sections (PB §6.1)","browse.spec.ts","",""
"","2073","Preview/Sample button present (Priority 2 per PB §6.3 and §3.9)","mobile-chrome","2026-04-10","passed","2026-04-10","Browse: Book Detail Page (PB §6.3)","browse.spec.ts","",""
"","1506","Comics category page loads without error","chromium","2026-04-10","failed","2026-04-10","Browse: Discover Sub-Categories","browse.spec.ts","",""
"","11958","Top navigation includes: Home, Library, News, Events, Forums","chromium","2026-04-10","failed","2026-04-10","PB: Web Navigation Structure (PB §5.2)","product-bible.spec.ts","",""
