"DESCRIPTION","DURATION IN MS","NAME","PARENT SUITE","START TIME","STATUS","STOP TIME","SUB SUITE","SUITE","TEST CLASS","TEST METHOD"
"","1621","Discover section includes: Books, Audiobooks, Periodicals, Comics, Documents","chromium","2026-03-21","passed","2026-03-21","PB: Web Navigation Structure (PB §5.2)","product-bible.spec.ts","",""
"","801","Body text is dark on light background (not low contrast)","chromium","2026-03-21","passed","2026-03-21","Accessibility: Colour Contrast","accessibility.spec.ts","",""
"","1733","Homepage contains 'Discover More' or equivalent CTA","chromium","2026-03-21","passed","2026-03-21","Browse: Homepage Sections (PB §6.1)","browse.spec.ts","",""
"","291","/admin/* returns 404 (not a redirect hint) per PB §11.6","chromium","2026-03-21","passed","2026-03-21","Smoke: Admin Route Hardening","smoke.spec.ts","",""
"","124","/admin/login does not expose sensitive data","chromium","2026-03-21","passed","2026-03-21","Security: Admin Route Hardening (PB §11.6)","security.spec.ts","",""
"","1911","Homepage book cover images load from R2","mobile-chrome","2026-03-21","passed","2026-03-21","Smoke: Image Delivery (Cloudflare R2)","smoke.spec.ts","",""
"","158","/library without auth returns 200 with login content or redirects","chromium","2026-03-21","passed","2026-03-21","API: Auth-Gated Routes Return Redirect (not 200)","api.spec.ts","",""
"","946","Forums page requires login — redirects unauthenticated users (PB §6.6, Q14)","mobile-chrome","2026-03-21","failed","2026-03-21","Browse: Authenticated User Flows","browse.spec.ts","",""
"","1389","Footer contains copyright notice for The Book Crunch Limited","chromium","2026-03-21","passed","2026-03-21","PB: Web Navigation Structure (PB §5.2)","product-bible.spec.ts","",""
"","35","sitemap.xml is accessible","chromium","2026-03-21","passed","2026-03-21","API: Next.js Infrastructure","api.spec.ts","",""
"","823","Pricing page (if exists) shows the 4 main tiers: Free, Basic, Standard, Premium","chromium","2026-03-21","failed","2026-03-21","PB: Subscription Tiers in UI (PB §1.3, v4.6)","product-bible.spec.ts","",""
"","1390","Title and author displayed (Priority 1)","chromium","2026-03-21","passed","2026-03-21","PB: Book Detail Page Spec (PB §6.3)","product-bible.spec.ts","",""
"","1464","Contact Us (/contact) returns 200 and loads","chromium","2026-03-21","passed","2026-03-21","Smoke: Public Pages Load","smoke.spec.ts","",""
"","203","/discover returns 200","chromium","2026-03-21","passed","2026-03-21","API: HTTP Status Codes","api.spec.ts","",""
"","166","/privacy returns 200","chromium","2026-03-21","passed","2026-03-21","API: HTTP Status Codes","api.spec.ts","",""
"","1550","No duplicate page titles across key pages","chromium","2026-03-21","failed","2026-03-21","SEO: Technical SEO","seo.spec.ts","",""
"","523","/settings redirects unauthenticated user to /login","chromium","2026-03-21","passed","2026-03-21","Smoke: Auth-Gated Routes Redirect","smoke.spec.ts","",""
"","767","Junior add-on available to Free tier — not exclusive to paid tiers (PB §1.3, Q21)","chromium","2026-03-21","passed","2026-03-21","PB: Junior Add-On Model (PB §1.3, §2.3, Q21 — v4.6)","product-bible.spec.ts","",""
"","2112","Discover section includes: Books, Audiobooks, Periodicals, Comics, Documents","mobile-chrome","2026-03-21","passed","2026-03-21","PB: Web Navigation Structure (PB §5.2)","product-bible.spec.ts","",""
"","1638","Forums (/forums) returns 200 and loads","chromium","2026-03-21","passed","2026-03-21","Smoke: Public Pages Load","smoke.spec.ts","",""
"","235","/help returns 200","chromium","2026-03-21","passed","2026-03-21","API: HTTP Status Codes","api.spec.ts","",""
"","1669","Cover image is large and prominent (Priority 1)","chromium","2026-03-21","passed","2026-03-21","PB: Book Detail Page Spec (PB §6.3)","product-bible.spec.ts","",""
"","1482","Forgot Password (/forgot-password) returns 200 and loads","mobile-chrome","2026-03-21","passed","2026-03-21","Smoke: Public Pages Load","smoke.spec.ts","",""
"","495","/library redirects unauthenticated user to /login","chromium","2026-03-21","passed","2026-03-21","Smoke: Auth-Gated Routes Redirect","smoke.spec.ts","",""
"","2052","'Junior' terminology used — not 'Kids' or 'Children' (PB §1.3)","mobile-chrome","2026-03-21","passed","2026-03-21","PB: Subscription Tiers in UI (PB §1.3, v4.6)","product-bible.spec.ts","",""
"","2226","Price or Free label is displayed (Priority 2 per PB §6.3)","mobile-chrome","2026-03-21","passed","2026-03-21","Browse: Book Detail Page (PB §6.3)","browse.spec.ts","",""
"","1478","Privacy Policy (/privacy) returns 200 and loads","chromium","2026-03-21","passed","2026-03-21","Smoke: Public Pages Load","smoke.spec.ts","",""
"","3285","Homepage — Full load within 5s","chromium","2026-03-21","passed","2026-03-21","Performance: Page Load Times","performance.spec.ts","",""
"","1428","Periodicals category page loads without error","chromium","2026-03-21","failed","2026-03-21","Browse: Discover Sub-Categories","browse.spec.ts","",""
"","1401","Comics category page loads without error","chromium","2026-03-21","failed","2026-03-21","Browse: Discover Sub-Categories","browse.spec.ts","",""
"","1739","Discover Books (/discover/books) returns 200 and loads","mobile-chrome","2026-03-21","passed","2026-03-21","Smoke: Public Pages Load","smoke.spec.ts","",""
"","2278","News (/news) returns 200 and loads","mobile-chrome","2026-03-21","passed","2026-03-21","Smoke: Public Pages Load","smoke.spec.ts","",""
"","954","No 'Publisher Profile' page — Publisher is internal-only (PB Q16)","mobile-chrome","2026-03-21","passed","2026-03-21","PB: Author Profile Rules (PB §6.10, Q15, Q16)","product-bible.spec.ts","",""
"","4549","Search input does not reflect raw HTML (basic XSS check)","chromium","2026-03-21","passed","2026-03-21","Security: XSS Prevention","security.spec.ts","",""
"","2146","File format names do NOT appear — never show EPUB/PDF/MP3 (PB §6.3)","chromium","2026-03-21","failed","2026-03-21","PB: Book Detail Page Spec (PB §6.3)","product-bible.spec.ts","",""
"","1432","Audiobooks category page loads without error","chromium","2026-03-21","failed","2026-03-21","Browse: Discover Sub-Categories","browse.spec.ts","",""
"","757","Interactive elements show visible focus ring","chromium","2026-03-21","passed","2026-03-21","Accessibility: Focus Indicators","accessibility.spec.ts","",""
"","1767","Login page renders all required elements","chromium","2026-03-21","passed","2026-03-21","Auth: Login Page UI","auth.spec.ts","",""
"","2565","Sections use 'See More' / 'View All' links per PB §6.1 (max 10 per section)","mobile-chrome","2026-03-21","passed","2026-03-21","Browse: Homepage Sections (PB §6.1)","browse.spec.ts","",""
"","1080","Junior add-on available to Free tier — not exclusive to paid tiers (PB §1.3, Q21)","mobile-chrome","2026-03-21","passed","2026-03-21","PB: Junior Add-On Model (PB §1.3, §2.3, Q21 — v4.6)","product-bible.spec.ts","",""
"","2829","Homepage renders Bestsellers section","chromium","2026-03-21","passed","2026-03-21","Browse: Homepage Sections (PB §6.1)","browse.spec.ts","",""
"","2523","Book detail page loads and is not a 404","mobile-chrome","2026-03-21","passed","2026-03-21","Browse: Book Detail Page (PB §6.3)","browse.spec.ts","",""
"","553","Error pages do not expose stack traces","chromium","2026-03-21","passed","2026-03-21","Security: Information Disclosure","security.spec.ts","",""
"","1568","Forums page does not return a 500 error","chromium","2026-03-21","failed","2026-03-21","PB: Forum Access Rules (PB §6.6, Q14)","product-bible.spec.ts","",""
"","494","Register — DOMContentLoaded within 3s","chromium","2026-03-21","passed","2026-03-21","Performance: Page Load Times","performance.spec.ts","",""
"","614","Login redirect param cannot be used to redirect to external site","chromium","2026-03-21","failed","2026-03-21","Security: Open Redirect Prevention","security.spec.ts","",""
"","1734","Publisher Dashboard not linked from public homepage (PB §5.3)","chromium","2026-03-21","passed","2026-03-21","PB: Information Architecture (PB §5.3)","product-bible.spec.ts","",""
"","2030","Top navigation includes: Home, Library, News, Events, Forums","mobile-chrome","2026-03-21","passed","2026-03-21","PB: Web Navigation Structure (PB §5.2)","product-bible.spec.ts","",""
"","956","After login, Sign Out is in profile dropdown only per PB §5.2","chromium","2026-03-21","failed","2026-03-21","Auth: Successful Login Flow","auth.spec.ts","",""
"","1548","Discover Documents & Research (/discover/documents) returns 200 and loads","chromium","2026-03-21","passed","2026-03-21","Smoke: Public Pages Load","smoke.spec.ts","",""
"","2140","Preview/Sample button present (Priority 2 per PB §6.3 and §3.9)","mobile-chrome","2026-03-21","passed","2026-03-21","Browse: Book Detail Page (PB §6.3)","browse.spec.ts","",""
"","592","/ returns 200","chromium","2026-03-21","passed","2026-03-21","API: HTTP Status Codes","api.spec.ts","",""
"","1467","No EPUB / PDF / MP3 format names appear in UI (PB §10.5)","chromium","2026-03-21","passed","2026-03-21","PB: Home Screen Sections (PB §6.1)","product-bible.spec.ts","",""
"","2206","Guardian Dashboard is not linked to logged-out users (PB §5.3)","mobile-chrome","2026-03-21","passed","2026-03-21","PB: Junior Add-On Model (PB §1.3, §2.3, Q21 — v4.6)","product-bible.spec.ts","",""
"","327","/discover/books returns 200","chromium","2026-03-21","passed","2026-03-21","API: HTTP Status Codes","api.spec.ts","",""
"","2507","Book detail page has a meta description","chromium","2026-03-21","passed","2026-03-21","SEO: Meta Tags","seo.spec.ts","",""
"","10406","/forums is protected — unauthenticated access redirects to login","chromium","2026-03-21","failed","2026-03-21","Security: Auth Protection","security.spec.ts","",""
"","819","After login, Library is accessible without redirect","chromium","2026-03-21","failed","2026-03-21","Auth: Successful Login Flow","auth.spec.ts","",""
"","1682","Discover page loads and shows content","chromium","2026-03-21","passed","2026-03-21","Browse: Discover Screen (PB §6.8)","browse.spec.ts","",""
"","1828","Author profile pages use /author/ route (PB §6.10)","chromium","2026-03-21","passed","2026-03-21","PB: Author Profile Rules (PB §6.10, Q15, Q16)","product-bible.spec.ts","",""
"","3146","Discover Books (/discover/books) returns 200 and loads","chromium","2026-03-21","passed","2026-03-21","Smoke: Public Pages Load","smoke.spec.ts","",""
"","2105","Discover (/discover) returns 200 and loads","mobile-chrome","2026-03-21","passed","2026-03-21","Smoke: Public Pages Load","smoke.spec.ts","",""
"","2427","Admin routes not linked from main site (PB §5.3, §11.6)","mobile-chrome","2026-03-21","passed","2026-03-21","PB: Information Architecture (PB §5.3)","product-bible.spec.ts","",""
"","1580","Library page shows tabs: In Progress, Favorites, Finished, All My Books (PB §6.2)","mobile-chrome","2026-03-21","failed","2026-03-21","Browse: Authenticated User Flows","browse.spec.ts","",""
"","1430","Privacy Policy (/privacy) returns 200 and loads","mobile-chrome","2026-03-21","passed","2026-03-21","Smoke: Public Pages Load","smoke.spec.ts","",""
"","543","/register loads within 5 seconds","mobile-chrome","2026-03-21","passed","2026-03-21","Smoke: Response Times","smoke.spec.ts","",""
"","5092","Login with empty fields shows validation","chromium","2026-03-21","passed","2026-03-21","Auth: Login Page UI","auth.spec.ts","",""
"","1089","Documents category page loads without error","chromium","2026-03-21","failed","2026-03-21","Browse: Discover Sub-Categories","browse.spec.ts","",""
"","1149","Clicking a book card navigates to book detail page","mobile-chrome","2026-03-21","failed","2026-03-21","Browse: Authenticated User Flows","browse.spec.ts","",""
"","1926","Book detail page loads and is not a 404","chromium","2026-03-21","passed","2026-03-21","Browse: Book Detail Page (PB §6.3)","browse.spec.ts","",""
"","2435","Author profile pages use /author/ route (PB §6.10)","mobile-chrome","2026-03-21","passed","2026-03-21","PB: Author Profile Rules (PB §6.10, Q15, Q16)","product-bible.spec.ts","",""
"","1656","Site title contains 'Paygees' (PB header)","mobile-chrome","2026-03-21","passed","2026-03-21","PB: Brand Identity (§10.1, §10.2)","product-bible.spec.ts","",""
"","1895","Forums page does not return a 500 error","mobile-chrome","2026-03-21","failed","2026-03-21","PB: Forum Access Rules (PB §6.6, Q14)","product-bible.spec.ts","",""
"","96","/admin/users does not expose sensitive data","chromium","2026-03-21","passed","2026-03-21","Security: Admin Route Hardening (PB §11.6)","security.spec.ts","",""
"","79","Register responds within 5 seconds","chromium","2026-03-21","passed","2026-03-21","API: Response Time Benchmarks","api.spec.ts","",""
"","3735","Book cards show content type label (Book/Comic/Audiobook)","mobile-chrome","2026-03-21","passed","2026-03-21","Browse: Homepage Sections (PB §6.1)","browse.spec.ts","",""
"","1513","Sign Up (/register) returns 200 and loads","mobile-chrome","2026-03-21","passed","2026-03-21","Smoke: Public Pages Load","smoke.spec.ts","",""
"","1574","Forums require login — unauthenticated visitors redirected (login is CTA per PB Q14)","chromium","2026-03-21","failed","2026-03-21","PB: Forum Access Rules (PB §6.6, Q14)","product-bible.spec.ts","",""
"","134","/dashboard/admin does not expose admin panel (PB §11.6)","chromium","2026-03-21","passed","2026-03-21","API: Admin Route Hardening (PB §11.6)","api.spec.ts","",""
"","1626","Junior is NOT presented as a default-included benefit of any tier (PB §1.3, Q21)","chromium","2026-03-21","passed","2026-03-21","PB: Subscription Tiers in UI (PB §1.3, v4.6)","product-bible.spec.ts","",""
"","3772","Site title contains 'Paygees' (PB header)","chromium","2026-03-21","passed","2026-03-21","PB: Brand Identity (§10.1, §10.2)","product-bible.spec.ts","",""
"","1856","Discover Comics & Illustrations (/discover/comics) returns 200 and loads","mobile-chrome","2026-03-21","passed","2026-03-21","Smoke: Public Pages Load","smoke.spec.ts","",""
"","396","/events returns 200","chromium","2026-03-21","passed","2026-03-21","API: HTTP Status Codes","api.spec.ts","",""
"","1585","Help Centre (/help) returns 200 and loads","chromium","2026-03-21","passed","2026-03-21","Smoke: Public Pages Load","smoke.spec.ts","",""
"","1925","Bestsellers section is present on homepage","mobile-chrome","2026-03-21","passed","2026-03-21","PB: Home Screen Sections (PB §6.1)","product-bible.spec.ts","",""
"","1150","/settings is protected — unauthenticated access redirects to login","chromium","2026-03-21","passed","2026-03-21","Security: Auth Protection","security.spec.ts","",""
"","950","/ loads within 5 seconds","mobile-chrome","2026-03-21","passed","2026-03-21","Smoke: Response Times","smoke.spec.ts","",""
"","1203","Login with wrong credentials shows error, not 500","chromium","2026-03-21","failed","2026-03-21","Auth: Login Page UI","auth.spec.ts","",""
"","2561","Cookies have appropriate flags","chromium","2026-03-21","passed","2026-03-21","API: Security Headers","api.spec.ts","",""
"","183","Discover responds within 5 seconds","chromium","2026-03-21","passed","2026-03-21","API: Response Time Benchmarks","api.spec.ts","",""
"","158","/discover/comics returns 200","chromium","2026-03-21","passed","2026-03-21","API: HTTP Status Codes","api.spec.ts","",""
"","17173","Homepage has OG title","chromium","2026-03-21","failed","2026-03-21","SEO: Open Graph Tags","seo.spec.ts","",""
"","138","/about returns 200","chromium","2026-03-21","passed","2026-03-21","API: HTTP Status Codes","api.spec.ts","",""
"","2108","Age rating appears on book detail (PB §2.4)","mobile-chrome","2026-03-21","passed","2026-03-21","PB: Book Detail Page Spec (PB §6.3)","product-bible.spec.ts","",""
"","2969","Discover — Full load within 5s","chromium","2026-03-21","passed","2026-03-21","Performance: Page Load Times","performance.spec.ts","",""
"","744","Sign Out is in profile dropdown only — not in top bar directly (PB §5.2)","chromium","2026-03-21","failed","2026-03-21","PB: Information Architecture (PB §5.3)","product-bible.spec.ts","",""
"","83","/.env.local does not expose sensitive data","chromium","2026-03-21","passed","2026-03-21","Security: Admin Route Hardening (PB §11.6)","security.spec.ts","",""
"","2894","Content type shown as icon/label — NOT file format (PB §6.3, §10.5)","mobile-chrome","2026-03-21","failed","2026-03-21","Browse: Book Detail Page (PB §6.3)","browse.spec.ts","",""
"","231","/wp-admin does not expose admin panel (PB §11.6)","chromium","2026-03-21","passed","2026-03-21","API: Admin Route Hardening (PB §11.6)","api.spec.ts","",""
"","1020","Library page shows tabs: In Progress, Favorites, Finished, All My Books (PB §6.2)","chromium","2026-03-21","failed","2026-03-21","Browse: Authenticated User Flows","browse.spec.ts","",""
"","1806","No console errors on homepage","chromium","2026-03-21","failed","2026-03-21","Performance: Resource Loading","performance.spec.ts","",""
"","443","/register loads within 5 seconds","chromium","2026-03-21","passed","2026-03-21","Smoke: Response Times","smoke.spec.ts","",""
"","1583","All internal links use HTTPS or relative paths","chromium","2026-03-21","passed","2026-03-21","Security: HTTPS Enforcement","security.spec.ts","",""
"","1862","Documents category page loads without error","mobile-chrome","2026-03-21","failed","2026-03-21","Browse: Discover Sub-Categories","browse.spec.ts","",""
"","1639","Blog (/blog) returns 200 and loads","mobile-chrome","2026-03-21","passed","2026-03-21","Smoke: Public Pages Load","smoke.spec.ts","",""
"","765","Card details are never displayed in any page response (PB §11.5)","chromium","2026-03-21","passed","2026-03-21","Security: Cookie Configuration (PB §11.5)","security.spec.ts","",""
"","91","/admin does not expose admin panel (PB §11.6)","chromium","2026-03-21","passed","2026-03-21","API: Admin Route Hardening (PB §11.6)","api.spec.ts","",""
"","2239","Title and author displayed (Priority 1)","mobile-chrome","2026-03-21","passed","2026-03-21","PB: Book Detail Page Spec (PB §6.3)","product-bible.spec.ts","",""
"","174","Homepage responds within 5 seconds","chromium","2026-03-21","passed","2026-03-21","API: Response Time Benchmarks","api.spec.ts","",""
"","86","/admin/finance does not expose sensitive data","chromium","2026-03-21","passed","2026-03-21","Security: Admin Route Hardening (PB §11.6)","security.spec.ts","",""
"","1976","Publisher Dashboard not linked from public homepage (PB §5.3)","mobile-chrome","2026-03-21","passed","2026-03-21","PB: Information Architecture (PB §5.3)","product-bible.spec.ts","",""
"","1426","Logo reads 'PAYGEES' (PB §10.1)","mobile-chrome","2026-03-21","passed","2026-03-21","PB: Brand Identity (§10.1, §10.2)","product-bible.spec.ts","",""
"","396","/blog returns 200","chromium","2026-03-21","passed","2026-03-21","API: HTTP Status Codes","api.spec.ts","",""
"","1572","Press (/press) returns 200 and loads","chromium","2026-03-21","passed","2026-03-21","Smoke: Public Pages Load","smoke.spec.ts","",""
"","1696","HTTP redirects to HTTPS","mobile-chrome","2026-03-21","passed","2026-03-21","Smoke: SSL & Security Headers","smoke.spec.ts","",""
"","1548","Junior is not presented as a comparable standalone subscription tier","chromium","2026-03-21","passed","2026-03-21","PB: Junior Add-On Model (PB §1.3, §2.3, Q21 — v4.6)","product-bible.spec.ts","",""
"","1221","Books category page loads without error","chromium","2026-03-21","failed","2026-03-21","Browse: Discover Sub-Categories","browse.spec.ts","",""
"","218","/settings without auth returns 200 with login content or redirects","chromium","2026-03-21","passed","2026-03-21","API: Auth-Gated Routes Return Redirect (not 200)","api.spec.ts","",""
"","98","/forgot-password returns 200","chromium","2026-03-21","passed","2026-03-21","API: HTTP Status Codes","api.spec.ts","",""
"","484","Security response headers are present","mobile-chrome","2026-03-21","passed","2026-03-21","Smoke: SSL & Security Headers","smoke.spec.ts","",""
"","1385","Age rating appears on book detail (PB §2.4)","chromium","2026-03-21","passed","2026-03-21","PB: Book Detail Page Spec (PB §6.3)","product-bible.spec.ts","",""
"","1792","All internal links use consistent domain (no mixed domains)","chromium","2026-03-21","passed","2026-03-21","SEO: Technical SEO","seo.spec.ts","",""
"","3765","Each book card has a cover image","mobile-chrome","2026-03-21","passed","2026-03-21","Browse: Homepage Sections (PB §6.1)","browse.spec.ts","",""
"","1903","Section 'See More' links are present — max 10 per section (PB §6.1)","mobile-chrome","2026-03-21","passed","2026-03-21","PB: Home Screen Sections (PB §6.1)","product-bible.spec.ts","",""
"","3675","Homepage has at least one book card visible","mobile-chrome","2026-03-21","passed","2026-03-21","Browse: Homepage Sections (PB §6.1)","browse.spec.ts","",""
"","369","/discover/audiobooks returns 200","chromium","2026-03-21","passed","2026-03-21","API: HTTP Status Codes","api.spec.ts","",""
"","679","Login redirect param to external domain is ignored","chromium","2026-03-21","failed","2026-03-21","Security: Open Redirect Prevention","security.spec.ts","",""
"","843","Book Detail — DOMContentLoaded within 3s","chromium","2026-03-21","passed","2026-03-21","Performance: Page Load Times","performance.spec.ts","",""
"","1161","/library is protected — unauthenticated access redirects to login","chromium","2026-03-21","passed","2026-03-21","Security: Auth Protection","security.spec.ts","",""
"","1065","Pricing page (if exists) shows the 4 main tiers: Free, Basic, Standard, Premium","mobile-chrome","2026-03-21","failed","2026-03-21","PB: Subscription Tiers in UI (PB §1.3, v4.6)","product-bible.spec.ts","",""
"","1513","Log In (/login) returns 200 and loads","chromium","2026-03-21","passed","2026-03-21","Smoke: Public Pages Load","smoke.spec.ts","",""
"","3472","Homepage has at least one book card visible","chromium","2026-03-21","passed","2026-03-21","Browse: Homepage Sections (PB §6.1)","browse.spec.ts","",""
"","3367","Each book card has a cover image","chromium","2026-03-21","passed","2026-03-21","Browse: Homepage Sections (PB §6.1)","browse.spec.ts","",""
"","2262","Cover image is large and prominent (Priority 1 per PB §6.3)","mobile-chrome","2026-03-21","passed","2026-03-21","Browse: Book Detail Page (PB §6.3)","browse.spec.ts","",""
"","1657","Careers (/careers) returns 200 and loads","mobile-chrome","2026-03-21","passed","2026-03-21","Smoke: Public Pages Load","smoke.spec.ts","",""
"","1794","Events (/events) returns 200 and loads","chromium","2026-03-21","passed","2026-03-21","Smoke: Public Pages Load","smoke.spec.ts","",""
"","1623","Log In (/login) returns 200 and loads","mobile-chrome","2026-03-21","passed","2026-03-21","Smoke: Public Pages Load","smoke.spec.ts","",""
"","1939","No EPUB / PDF / MP3 format names appear in UI (PB §10.5)","mobile-chrome","2026-03-21","passed","2026-03-21","PB: Home Screen Sections (PB §6.1)","product-bible.spec.ts","",""
"","448","/login loads within 5 seconds","chromium","2026-03-21","passed","2026-03-21","Smoke: Response Times","smoke.spec.ts","",""
"","5649","R2 signed URLs on homepage load successfully","chromium","2026-03-21","passed","2026-03-21","API: Cloudflare R2 Image Delivery","api.spec.ts","",""
