"DESCRIPTION","DURATION IN MS","NAME","PARENT SUITE","START TIME","STATUS","STOP TIME","SUB SUITE","SUITE","TEST CLASS","TEST METHOD"
"","2208","Periodicals category page loads without error","mobile-chrome","2026-05-05","failed","2026-05-05","Browse: Discover Sub-Categories","browse.spec.ts","",""
"","3341","Discover — Full load within 5s","chromium","2026-05-05","passed","2026-05-05","Performance: Page Load Times","performance.spec.ts","",""
"","1754","No 500 errors on any public page","chromium","2026-05-05","passed","2026-05-05","API: Next.js Infrastructure","api.spec.ts","",""
"","2439","Discover — DOMContentLoaded within 3s","chromium","2026-05-05","passed","2026-05-05","Performance: Page Load Times","performance.spec.ts","",""
"","16570","'Creator' term does not appear in UI — banned platform-wide per PB Q16","chromium","2026-05-05","passed","2026-05-05","PB: Brand Identity (§10.1, §10.2)","product-bible.spec.ts","",""
"","1658","Discover Comics & Illustrations (/discover/comics) returns 200 and loads","mobile-chrome","2026-05-05","passed","2026-05-05","Smoke: Public Pages Load","smoke.spec.ts","",""
"","12021","Discover section includes: Books, Audiobooks, Periodicals, Comics, Documents","chromium","2026-05-05","failed","2026-05-05","PB: Web Navigation Structure (PB §5.2)","product-bible.spec.ts","",""
"","1995","File format names do NOT appear — never show EPUB/PDF/MP3 (PB §6.3)","mobile-chrome","2026-05-05","passed","2026-05-05","PB: Book Detail Page Spec (PB §6.3)","product-bible.spec.ts","",""
"","246","/admin does not expose sensitive data","chromium","2026-05-05","passed","2026-05-05","Security: Admin Route Hardening (PB §11.6)","security.spec.ts","",""
"","2347","Section 'See More' links are present — max 10 per section (PB §6.1)","chromium","2026-05-05","failed","2026-05-05","PB: Home Screen Sections (PB §6.1)","product-bible.spec.ts","",""
"","153","/forgot-password returns 200","chromium","2026-05-05","passed","2026-05-05","API: HTTP Status Codes","api.spec.ts","",""
"","1779","Privacy Policy (/privacy) returns 200 and loads","chromium","2026-05-05","passed","2026-05-05","Smoke: Public Pages Load","smoke.spec.ts","",""
"","2678","Logo reads 'PAYGEES' (PB §10.1)","mobile-chrome","2026-05-05","passed","2026-05-05","PB: Brand Identity (§10.1, §10.2)","product-bible.spec.ts","",""
"","16544","Clicking a book card navigates to book detail page","mobile-chrome","2026-05-05","failed","2026-05-05","Browse: Authenticated User Flows","browse.spec.ts","",""
"","276","/forums without auth returns 200 with login content or redirects","chromium","2026-05-05","passed","2026-05-05","API: Auth-Gated Routes Return Redirect (not 200)","api.spec.ts","",""
"","870","/forums redirects unauthenticated user to /login","chromium","2026-05-05","passed","2026-05-05","Smoke: Auth-Gated Routes Redirect","smoke.spec.ts","",""
"","1074","/forums redirects unauthenticated user to /login","mobile-chrome","2026-05-05","passed","2026-05-05","Smoke: Auth-Gated Routes Redirect","smoke.spec.ts","",""
"","1305","Terms of Service (/terms) returns 200 and loads","mobile-chrome","2026-05-05","passed","2026-05-05","Smoke: Public Pages Load","smoke.spec.ts","",""
"","939","/ loads within 5 seconds","chromium","2026-05-05","passed","2026-05-05","Smoke: Response Times","smoke.spec.ts","",""
"","226","/register returns 200","chromium","2026-05-05","passed","2026-05-05","API: HTTP Status Codes","api.spec.ts","",""
"","1229","Footer shows payment method logos (PB §5.2)","chromium","2026-05-05","passed","2026-05-05","PB: Web Navigation Structure (PB §5.2)","product-bible.spec.ts","",""
"","1709","Forums (/forums) returns 200 and loads","mobile-chrome","2026-05-05","passed","2026-05-05","Smoke: Public Pages Load","smoke.spec.ts","",""
"","2722","Site title contains 'Paygees' (PB header)","chromium","2026-05-05","passed","2026-05-05","PB: Brand Identity (§10.1, §10.2)","product-bible.spec.ts","",""
"","1022","Audiobooks category page loads without error","chromium","2026-05-05","failed","2026-05-05","Browse: Discover Sub-Categories","browse.spec.ts","",""
"","887","Interactive elements show visible focus ring","chromium","2026-05-05","passed","2026-05-05","Accessibility: Focus Indicators","accessibility.spec.ts","",""
"","1556","No 'Publisher Profile' page — Publisher is internal-only (PB Q16)","chromium","2026-05-05","passed","2026-05-05","PB: Author Profile Rules (PB §6.10, Q15, Q16)","product-bible.spec.ts","",""
"","1691","Homepage — First Contentful Paint (FCP) < 3s","chromium","2026-05-05","passed","2026-05-05","Performance: Web Vitals (via Navigation API)","performance.spec.ts","",""
"","1270","No 'Publisher Profile' page — Publisher is internal-only (PB Q16)","mobile-chrome","2026-05-05","passed","2026-05-05","PB: Author Profile Rules (PB §6.10, Q15, Q16)","product-bible.spec.ts","",""
"","999","Login page includes Terms & Conditions and Privacy Policy links","chromium","2026-05-05","failed","2026-05-05","Auth: Login Page UI","auth.spec.ts","",""
"","2041","Login — DOMContentLoaded within 3s","chromium","2026-05-05","passed","2026-05-05","Performance: Page Load Times","performance.spec.ts","",""
"","1949","Author profile pages use /author/ route (PB §6.10)","mobile-chrome","2026-05-05","passed","2026-05-05","PB: Author Profile Rules (PB §6.10, Q15, Q16)","product-bible.spec.ts","",""
"","1624","Sign up link navigates to /register","chromium","2026-05-05","passed","2026-05-05","Auth: Login Page UI","auth.spec.ts","",""
"","286","/press returns 200","chromium","2026-05-05","passed","2026-05-05","API: HTTP Status Codes","api.spec.ts","",""
"","15653","After login, Library is accessible without redirect","chromium","2026-05-05","failed","2026-05-05","Auth: Successful Login Flow","auth.spec.ts","",""
"","1183","Cookies have appropriate flags","chromium","2026-05-05","passed","2026-05-05","API: Security Headers","api.spec.ts","",""
"","3052","Free label appears for free books (PB §1.3)","mobile-chrome","2026-05-05","failed","2026-05-05","PB: Book Detail Page Spec (PB §6.3)","product-bible.spec.ts","",""
"","2433","Navigation links are focusable with Tab","chromium","2026-05-05","passed","2026-05-05","Accessibility: Keyboard Navigation","accessibility.spec.ts","",""
"","34","favicon is served","chromium","2026-05-05","passed","2026-05-05","API: Next.js Infrastructure","api.spec.ts","",""
"","1491","Publisher Dashboard not linked from public homepage (PB §5.3)","chromium","2026-05-05","passed","2026-05-05","PB: Information Architecture (PB §5.3)","product-bible.spec.ts","",""
"","273","Security response headers are present","chromium","2026-05-05","passed","2026-05-05","Smoke: SSL & Security Headers","smoke.spec.ts","",""
"","778","Book Detail — DOMContentLoaded within 3s","chromium","2026-05-05","passed","2026-05-05","Performance: Page Load Times","performance.spec.ts","",""
"","2020","Cover image is large and prominent (Priority 1 per PB §6.3)","chromium","2026-05-05","failed","2026-05-05","Browse: Book Detail Page (PB §6.3)","browse.spec.ts","",""
"","2204","Junior is not presented as a comparable standalone subscription tier","chromium","2026-05-05","passed","2026-05-05","PB: Junior Add-On Model (PB §1.3, §2.3, Q21 — v4.6)","product-bible.spec.ts","",""
"","15570","Sign Out is in profile dropdown only — not in top bar directly (PB §5.2)","chromium","2026-05-05","failed","2026-05-05","PB: Information Architecture (PB §5.3)","product-bible.spec.ts","",""
"","1707","Discover Books (/discover/books) returns 200 and loads","mobile-chrome","2026-05-05","passed","2026-05-05","Smoke: Public Pages Load","smoke.spec.ts","",""
"","1822","Audiobooks category page loads without error","mobile-chrome","2026-05-05","failed","2026-05-05","Browse: Discover Sub-Categories","browse.spec.ts","",""
"","15693","Homepage has OG image","chromium","2026-05-05","failed","2026-05-05","SEO: Open Graph Tags","seo.spec.ts","",""
"","3960","Each book card has a cover image","chromium","2026-05-05","passed","2026-05-05","Browse: Homepage Sections (PB §6.1)","browse.spec.ts","",""
"","1884","News (/news) returns 200 and loads","mobile-chrome","2026-05-05","passed","2026-05-05","Smoke: Public Pages Load","smoke.spec.ts","",""
"","154","/.env.local does not expose sensitive data","chromium","2026-05-05","passed","2026-05-05","Security: Admin Route Hardening (PB §11.6)","security.spec.ts","",""
"","12766","Sections use 'See More' / 'View All' links per PB §6.1 (max 10 per section)","mobile-chrome","2026-05-05","failed","2026-05-05","Browse: Homepage Sections (PB §6.1)","browse.spec.ts","",""
"","179","/admin/login does not expose admin panel (PB §11.6)","chromium","2026-05-05","passed","2026-05-05","API: Admin Route Hardening (PB §11.6)","api.spec.ts","",""
"","1122","Forgot password link navigates to /forgot-password","chromium","2026-05-05","passed","2026-05-05","Auth: Login Page UI","auth.spec.ts","",""
"","5939","Homepage has a meta description","chromium","2026-05-05","passed","2026-05-05","SEO: Meta Tags","seo.spec.ts","",""
"","6672","Book detail page has a meta description","chromium","2026-05-05","passed","2026-05-05","SEO: Meta Tags","seo.spec.ts","",""
"","180","Discover responds within 5 seconds","chromium","2026-05-05","passed","2026-05-05","API: Response Time Benchmarks","api.spec.ts","",""
"","15772","Sign Out is in profile dropdown only — not in top bar directly (PB §5.2)","mobile-chrome","2026-05-05","failed","2026-05-05","PB: Information Architecture (PB §5.3)","product-bible.spec.ts","",""
"","1505","Comics category page loads without error","chromium","2026-05-05","failed","2026-05-05","Browse: Discover Sub-Categories","browse.spec.ts","",""
"","855","Register page includes T&C consent text per PB","chromium","2026-05-05","passed","2026-05-05","Auth: Registration Page UI","auth.spec.ts","",""
"","6804","Discover (/discover) returns 200 and loads","chromium","2026-05-05","passed","2026-05-05","Smoke: Public Pages Load","smoke.spec.ts","",""
"","1495","Pricing page (if exists) shows the 4 main tiers: Free, Basic, Standard, Premium","chromium","2026-05-05","failed","2026-05-05","PB: Subscription Tiers in UI (PB §1.3, v4.6)","product-bible.spec.ts","",""
"","15771","Library page has search within library (PB §6.2)","chromium","2026-05-05","failed","2026-05-05","Browse: Authenticated User Flows","browse.spec.ts","",""
"","778","/library redirects unauthenticated user to /login","chromium","2026-05-05","passed","2026-05-05","Smoke: Auth-Gated Routes Redirect","smoke.spec.ts","",""
"","2076","/settings is protected — unauthenticated access redirects to login","chromium","2026-05-05","passed","2026-05-05","Security: Auth Protection","security.spec.ts","",""
"","1572","Coral #E8735A used for section headers only — not CTA button fills (PB §10.2)","chromium","2026-05-05","passed","2026-05-05","PB: Home Screen Sections (PB §6.1)","product-bible.spec.ts","",""
"","721","Login form inputs have labels","chromium","2026-05-05","failed","2026-05-05","Accessibility: Semantic HTML","accessibility.spec.ts","",""
"","1722","Age rating appears on book detail (PB §2.4)","chromium","2026-05-05","failed","2026-05-05","PB: Book Detail Page Spec (PB §6.3)","product-bible.spec.ts","",""
"","1774","Title and author displayed (Priority 1)","chromium","2026-05-05","failed","2026-05-05","PB: Book Detail Page Spec (PB §6.3)","product-bible.spec.ts","",""
"","43","sitemap.xml is accessible","chromium","2026-05-05","passed","2026-05-05","API: Next.js Infrastructure","api.spec.ts","",""
"","374","/discover/audiobooks returns 200","chromium","2026-05-05","passed","2026-05-05","API: HTTP Status Codes","api.spec.ts","",""
"","73","robots.txt is present and allows crawling","chromium","2026-05-05","passed","2026-05-05","SEO: Technical SEO","seo.spec.ts","",""
"","2149","'Junior' terminology used — not 'Kids' or 'Children' (PB §1.3)","chromium","2026-05-05","passed","2026-05-05","PB: Subscription Tiers in UI (PB §1.3, v4.6)","product-bible.spec.ts","",""
"","1068","Homepage has OG description","chromium","2026-05-05","passed","2026-05-05","SEO: Open Graph Tags","seo.spec.ts","",""
"","114","/admin/finance does not expose sensitive data","chromium","2026-05-05","passed","2026-05-05","Security: Admin Route Hardening (PB §11.6)","security.spec.ts","",""
"","1562","Books category page loads without error","chromium","2026-05-05","failed","2026-05-05","Browse: Discover Sub-Categories","browse.spec.ts","",""
"","225","/blog returns 200","chromium","2026-05-05","passed","2026-05-05","API: HTTP Status Codes","api.spec.ts","",""
"","2138","Search input does not reflect raw HTML (basic XSS check)","chromium","2026-05-05","passed","2026-05-05","Security: XSS Prevention","security.spec.ts","",""
"","769","Login redirect param cannot be used to redirect to external site","chromium","2026-05-05","failed","2026-05-05","Security: Open Redirect Prevention","security.spec.ts","",""
"","2473","Home (/) returns 200 and loads","chromium","2026-05-05","passed","2026-05-05","Smoke: Public Pages Load","smoke.spec.ts","",""
"","3268","Guardian Dashboard is not linked to logged-out users (PB §5.3)","mobile-chrome","2026-05-05","passed","2026-05-05","PB: Junior Add-On Model (PB §1.3, §2.3, Q21 — v4.6)","product-bible.spec.ts","",""
"","3391","Book title is visible (Priority 1 per PB §6.3)","chromium","2026-05-05","failed","2026-05-05","Browse: Book Detail Page (PB §6.3)","browse.spec.ts","",""
"","1686","/forums is protected — unauthenticated access redirects to login","chromium","2026-05-05","passed","2026-05-05","Security: Auth Protection","security.spec.ts","",""
"","1961","Age rating appears on book detail (PB §2.4)","mobile-chrome","2026-05-05","failed","2026-05-05","PB: Book Detail Page Spec (PB §6.3)","product-bible.spec.ts","",""
"","10958","Login page renders all required elements","chromium","2026-05-05","failed","2026-05-05","Auth: Login Page UI","auth.spec.ts","",""
"","1212","Footer contains copyright notice for The Book Crunch Limited","chromium","2026-05-05","passed","2026-05-05","PB: Web Navigation Structure (PB §5.2)","product-bible.spec.ts","",""
"","2381","Content type shown as icon/label — NOT file format (PB §6.3, §10.5)","mobile-chrome","2026-05-05","passed","2026-05-05","Browse: Book Detail Page (PB §6.3)","browse.spec.ts","",""
"","1844","Help Centre (/help) returns 200 and loads","chromium","2026-05-05","passed","2026-05-05","Smoke: Public Pages Load","smoke.spec.ts","",""
"","1757","Blog (/blog) returns 200 and loads","mobile-chrome","2026-05-05","passed","2026-05-05","Smoke: Public Pages Load","smoke.spec.ts","",""
"","17909","'Creator' term does not appear in UI — banned platform-wide per PB Q16","mobile-chrome","2026-05-05","passed","2026-05-05","PB: Brand Identity (§10.1, §10.2)","product-bible.spec.ts","",""
"","2177","No EPUB / PDF / MP3 format names appear in UI (PB §10.5)","mobile-chrome","2026-05-05","passed","2026-05-05","PB: Home Screen Sections (PB §6.1)","product-bible.spec.ts","",""
"","1974","Footer contains company and support links (PB §5.2)","mobile-chrome","2026-05-05","passed","2026-05-05","PB: Web Navigation Structure (PB §5.2)","product-bible.spec.ts","",""
"","16365","Logged-in Free user can access forums (PB Q14 — read + reply access)","chromium","2026-05-05","failed","2026-05-05","PB: Forum Access Rules (PB §6.6, Q14)","product-bible.spec.ts","",""
"","222","Login responds within 5 seconds","chromium","2026-05-05","passed","2026-05-05","API: Response Time Benchmarks","api.spec.ts","",""
"","2733","Curated section uses 'Editor's Picks' — not 'Staff Picks' or 'Paygees Picks'","mobile-chrome","2026-05-05","passed","2026-05-05","PB: Editor's Picks Naming Canonical Rule (PB §6.1)","product-bible.spec.ts","",""
"","2022","Preview/Sample button present (Priority 2 per PB §6.3 and §3.9)","chromium","2026-05-05","passed","2026-05-05","Browse: Book Detail Page (PB §6.3)","browse.spec.ts","",""
"","2102","Events (/events) returns 200 and loads","mobile-chrome","2026-05-05","passed","2026-05-05","Smoke: Public Pages Load","smoke.spec.ts","",""
"","3557","Junior is not presented as a comparable standalone subscription tier","mobile-chrome","2026-05-05","passed","2026-05-05","PB: Junior Add-On Model (PB §1.3, §2.3, Q21 — v4.6)","product-bible.spec.ts","",""
"","2340","/ loads within 5 seconds","mobile-chrome","2026-05-05","passed","2026-05-05","Smoke: Response Times","smoke.spec.ts","",""
"","3269","Logged-out users see marketing/landing content on homepage","chromium","2026-05-05","passed","2026-05-05","PB: Information Architecture (PB §5.3)","product-bible.spec.ts","",""
"","278","/events returns 200","chromium","2026-05-05","passed","2026-05-05","API: HTTP Status Codes","api.spec.ts","",""
"","145","/about returns 200","chromium","2026-05-05","passed","2026-05-05","API: HTTP Status Codes","api.spec.ts","",""
"","1733","No console errors on homepage","chromium","2026-05-05","failed","2026-05-05","Performance: Resource Loading","performance.spec.ts","",""
"","1689","Blog (/blog) returns 200 and loads","chromium","2026-05-05","passed","2026-05-05","Smoke: Public Pages Load","smoke.spec.ts","",""
"","268","/discover/documents returns 200","chromium","2026-05-05","passed","2026-05-05","API: HTTP Status Codes","api.spec.ts","",""
"","1631","Contact Us (/contact) returns 200 and loads","chromium","2026-05-05","passed","2026-05-05","Smoke: Public Pages Load","smoke.spec.ts","",""
"","12843","Homepage contains 'Discover More' or equivalent CTA","mobile-chrome","2026-05-05","failed","2026-05-05","Browse: Homepage Sections (PB §6.1)","browse.spec.ts","",""
"","2857","Discover Audiobooks (/discover/audiobooks) returns 200 and loads","chromium","2026-05-05","passed","2026-05-05","Smoke: Public Pages Load","smoke.spec.ts","",""
"","256","/cms does not expose admin panel (PB §11.6)","chromium","2026-05-05","passed","2026-05-05","API: Admin Route Hardening (PB §11.6)","api.spec.ts","",""
"","1588","Site serves over HTTPS","mobile-chrome","2026-05-05","passed","2026-05-05","Smoke: SSL & Security Headers","smoke.spec.ts","",""
"","1666","Log In (/login) returns 200 and loads","chromium","2026-05-05","passed","2026-05-05","Smoke: Public Pages Load","smoke.spec.ts","",""
"","2518","Author name is visible and clickable (Priority 1 per PB §6.3)","mobile-chrome","2026-05-05","failed","2026-05-05","Browse: Book Detail Page (PB §6.3)","browse.spec.ts","",""
"","11799","Homepage contains 'Discover More' or equivalent CTA","chromium","2026-05-05","failed","2026-05-05","Browse: Homepage Sections (PB §6.1)","browse.spec.ts","",""
"","959","/settings redirects unauthenticated user to /login","chromium","2026-05-05","passed","2026-05-05","Smoke: Auth-Gated Routes Redirect","smoke.spec.ts","",""
"","1654","Events (/events) returns 200 and loads","chromium","2026-05-05","passed","2026-05-05","Smoke: Public Pages Load","smoke.spec.ts","",""
"","1254","All internal links use consistent domain (no mixed domains)","chromium","2026-05-05","passed","2026-05-05","SEO: Technical SEO","seo.spec.ts","",""
"","3163","Admin routes not linked from main site (PB §5.3, §11.6)","mobile-chrome","2026-05-05","passed","2026-05-05","PB: Information Architecture (PB §5.3)","product-bible.spec.ts","",""
"","3651","Tagline 'Affordable | Accessible | Available' is present (PB §4.1)","mobile-chrome","2026-05-05","passed","2026-05-05","PB: Brand Identity (§10.1, §10.2)","product-bible.spec.ts","",""
"","1262","Contact Us (/contact) returns 200 and loads","mobile-chrome","2026-05-05","passed","2026-05-05","Smoke: Public Pages Load","smoke.spec.ts","",""
"","2222","Guardian Dashboard is not linked to logged-out users (PB §5.3)","chromium","2026-05-05","passed","2026-05-05","PB: Junior Add-On Model (PB §1.3, §2.3, Q21 — v4.6)","product-bible.spec.ts","",""
"","1529","Card details are never displayed in any page response (PB §11.5)","chromium","2026-05-05","passed","2026-05-05","Security: Cookie Configuration (PB §11.5)","security.spec.ts","",""
"","1637","Cover image is large and prominent (Priority 1)","mobile-chrome","2026-05-05","passed","2026-05-05","PB: Book Detail Page Spec (PB §6.3)","product-bible.spec.ts","",""
"","117","/api/admin does not expose sensitive data","chromium","2026-05-05","passed","2026-05-05","Security: Admin Route Hardening (PB §11.6)","security.spec.ts","",""
"","107","Response headers do not expose server technology details","chromium","2026-05-05","passed","2026-05-05","Security: Information Disclosure","security.spec.ts","",""
"","11876","Homepage has at least one book card visible","mobile-chrome","2026-05-05","failed","2026-05-05","Browse: Homepage Sections (PB §6.1)","browse.spec.ts","",""
"","1605","Discover Documents & Research (/discover/documents) returns 200 and loads","chromium","2026-05-05","passed","2026-05-05","Smoke: Public Pages Load","smoke.spec.ts","",""
"","2506","Cover image is large and prominent (Priority 1 per PB §6.3)","mobile-chrome","2026-05-05","failed","2026-05-05","Browse: Book Detail Page (PB §6.3)","browse.spec.ts","",""
"","1914","Discover Audiobooks (/discover/audiobooks) returns 200 and loads","mobile-chrome","2026-05-05","passed","2026-05-05","Smoke: Public Pages Load","smoke.spec.ts","",""
"","2122","Homepage book cover images load from R2","mobile-chrome","2026-05-05","passed","2026-05-05","Smoke: Image Delivery (Cloudflare R2)","smoke.spec.ts","",""
"","2124","Homepage book cover images load from R2","chromium","2026-05-05","passed","2026-05-05","Smoke: Image Delivery (Cloudflare R2)","smoke.spec.ts","",""
"","635","Homepage loads on simulated slow 3G (African market priority — PB §4.5)","chromium","2026-05-05","passed","2026-05-05","Performance: Resource Loading","performance.spec.ts","",""
"","3155","'Junior' terminology used — not 'Kids' or 'Children' (PB §1.3)","mobile-chrome","2026-05-05","passed","2026-05-05","PB: Subscription Tiers in UI (PB §1.3, v4.6)","product-bible.spec.ts","",""
"","3655","Book cards show content type label (Book/Comic/Audiobook)","mobile-chrome","2026-05-05","passed","2026-05-05","Browse: Homepage Sections (PB §6.1)","browse.spec.ts","",""
"","2025","Price or Free label is displayed (Priority 2 per PB §6.3)","mobile-chrome","2026-05-05","passed","2026-05-05","Browse: Book Detail Page (PB §6.3)","browse.spec.ts","",""
"","1821","Forums page does not return a 500 error","mobile-chrome","2026-05-05","failed","2026-05-05","PB: Forum Access Rules (PB §6.6, Q14)","product-bible.spec.ts","",""
"","1864","Careers (/careers) returns 200 and loads","chromium","2026-05-05","passed","2026-05-05","Smoke: Public Pages Load","smoke.spec.ts","",""
"","1655","About Paygees (/about) returns 200 and loads","chromium","2026-05-05","passed","2026-05-05","Smoke: Public Pages Load","smoke.spec.ts","",""
"","425","/discover/books returns 200","chromium","2026-05-05","passed","2026-05-05","API: HTTP Status Codes","api.spec.ts","",""
"","1558","Discover Periodicals (/discover/periodicals) returns 200 and loads","mobile-chrome","2026-05-05","passed","2026-05-05","Smoke: Public Pages Load","smoke.spec.ts","",""
"","2579","Book detail page loads and is not a 404","chromium","2026-05-05","passed","2026-05-05","Browse: Book Detail Page (PB §6.3)","browse.spec.ts","",""
"","241","/contact returns 200","chromium","2026-05-05","passed","2026-05-05","API: HTTP Status Codes","api.spec.ts","",""
"","1818","Press (/press) returns 200 and loads","chromium","2026-05-05","passed","2026-05-05","Smoke: Public Pages Load","smoke.spec.ts","",""
"","2483","Preview/Sample button present (Priority 2 per PB §6.3 and §3.9)","mobile-chrome","2026-05-05","passed","2026-05-05","Browse: Book Detail Page (PB §6.3)","browse.spec.ts","",""
"","299","/.env does not expose sensitive data","chromium","2026-05-05","passed","2026-05-05","Security: Admin Route Hardening (PB §11.6)","security.spec.ts","",""
"","209","/admin/login does not expose sensitive data","chromium","2026-05-05","passed","2026-05-05","Security: Admin Route Hardening (PB §11.6)","security.spec.ts","",""
"","1153","HTTP redirects to HTTPS","chromium","2026-05-05","passed","2026-05-05","Smoke: SSL & Security Headers","smoke.spec.ts","",""
"","13007","Top navigation includes: Home, Library, News, Events, Forums","chromium","2026-05-05","failed","2026-05-05","PB: Web Navigation Structure (PB §5.2)","product-bible.spec.ts","",""
"","29","sitemap.xml is valid XML if present","chromium","2026-05-05","passed","2026-05-05","SEO: Technical SEO","seo.spec.ts","",""
"","2768","Book detail page loads and is not a 404","mobile-chrome","2026-05-05","passed","2026-05-05","Browse: Book Detail Page (PB §6.3)","browse.spec.ts","",""
"","316","/library without auth returns 200 with login content or redirects","chromium","2026-05-05","passed","2026-05-05","API: Auth-Gated Routes Return Redirect (not 200)","api.spec.ts","",""
"","1758","File format names do NOT appear — never show EPUB/PDF/MP3 (PB §6.3)","chromium","2026-05-05","passed","2026-05-05","PB: Book Detail Page Spec (PB §6.3)","product-bible.spec.ts","",""
"","2093","Press (/press) returns 200 and loads","mobile-chrome","2026-05-05","passed","2026-05-05","Smoke: Public Pages Load","smoke.spec.ts","",""
"","1717","Page has exactly one h1 tag","chromium","2026-05-05","passed","2026-05-05","Accessibility: Semantic HTML","accessibility.spec.ts","",""
"","15635","After login, Sign Out is in profile dropdown only per PB §5.2","chromium","2026-05-05","failed","2026-05-05","Auth: Successful Login Flow","auth.spec.ts","",""
"","1147","/discover loads within 5 seconds","chromium","2026-05-05","passed","2026-05-05","Smoke: Response Times","smoke.spec.ts","",""
"","2576","Bestsellers section is present on homepage","mobile-chrome","2026-05-05","failed","2026-05-05","PB: Home Screen Sections (PB §6.1)","product-bible.spec.ts","",""
